subtopic,website,title,date,author,text,url
Culture,tanea.gr,Πέθανε η σπουδαία συγγραφέας Αλκη Ζέη,28 Φεβρουαρίου 2020 | 07:19,tanea.gr,"Νέα μεγάλη απώλεια για την ελληνική λογοτεχνία ο θάνατος της συγγραφέως  Αλκης Ζέη  σε ηλικία 97 ετών. Σταθερή αξία για τη σύγχρονη λογοτεχνία μας, η Αλκη Ζέη, μπορεί να έγραφε κυρίως για παιδιά, όμως απευθυνόταν και στους ενήλικες. Η Αλκη Ζέη είχε γεννηθεί στην Αθήνα τo 1923 και πέρασε τα πρώτα παιδικά της χρόνια στη Σάμο, απ’ όπου καταγόταν η μητέρα της. Οταν άρχισε το σχολείο, η οικογένειά της εγκαταστάθηκε στο Μαρούσι και στη συνέχεια στην Αθήνα. Σπούδασε στη Φιλοσοφική Σχολή του Πανεπιστημίου Αθηνών, στη Δραματική Σχολή του Ωδείου Αθηνών και στο Κινηματογραφικό Ινστιτούτο της Μόσχας. Η σχέση της με το γράψιμο ξεκίνησε από τα γυμνασιακά της χρόνια, με έργα για το κουκλοθέατρο, διηγήματα και νουβέλες, που δημοσιεύονταν σε διάφορα λογοτεχνικά περιοδικά. Στους κοινωνικούς αγώνες Η Ζέη συμμετείχε στην ΕΠΟΝ στη διάρκεια της κατοχής και το 1984 οδηγήθηκε στην εξορία. Από το 1952 μέχρι το 1964 έζησαν με τον σύζυγό της, τον θεατρικό συγγραφέα Γιώργο Σεβαστίκογλου, ως πολιτικοί πρόσφυγες στη Σοβιετική Ενωση, όπου γεννήθηκαν και τα δυο παιδιά τους. Η Αρραβωνιαστικιά του Αχιλλέα , Το καπλάνι της βιτρίνας και Ο μεγάλος περίπατος του Πέτρου, συμπεριλαμβάνονται στα διαχρονικά βιβλία της σύγχρονης ελληνικής λογοτεχνίας. Εμπνέονται από προσωπικές της εμπειρίες υφαίνοντας την υπόθεσή τους παράλληλα με ιστορικά γεγονότα. Τα θέματα που πραγματεύονται είναι καθημερινά και πανανθρώπινα. Το Καπλάνι της βιτρίνας, το πρώτο της μυθιστόρημα, υπήρξε έργο – σταθμός για την ελληνική παιδική λογοτεχνία και θεωρείται πλέον κλασικό έργο της παγκόσμιας λογοτεχνίας για παιδιά, με συνεχείς επανεκδόσεις από το 1963 που πρωτοκυκλοφόρησε στην Ελλάδα και πολλές μεταφράσεις και διακρίσεις στο εξωτερικό. Η Αλκη Ζέη αποτελεί πρέσβειρα της σύγχρονης ελληνικής λογοτεχνίας στο εξωτερικό, καθώς το σύνολο του έργου της είναι μεταφρασμένο και κυκλοφορεί σε πολλές χώρες ανά τον κόσμο. Η ίδια έχει επίσης μεταφράσει από τα γαλλικά, τα ιταλικά και τα ρωσικά αρκετά βιβλία, ανάμεσα στα οποία έργα των Τζιάννι Ροντάρι και Βέρα Πανόβα.  ",https://www.tanea.gr/2020/02/28/lifearts/culture/pethane-i-spoudaia-syggrafeas-alki-zei/
Culture,tanea.gr,Τομ Χανκς : Ανακοίνωσε την ημερομηνία εγκαινίων του «Academy Museum of Motion Pictures»,14 Φεβρουαρίου 2020 | 11:10,tanea.gr,"Στην τελετή απονομής των φετινών Βραβείων Όσκαρ, ο Τομ Χανκς αποκάλυψε ότι το «Academy Museum of Motion Pictures» θα ανοίξει τις πύλες του στο κοινό τη Δευτέρα, 14 Δεκεμβρίου του 2020 (έκανε την ανακοίνωση με την ιδιότητα του μέλους του διοικητικού συμβουλίου του μουσείου και προέδρου της καμπάνιας για το Academy Museum). Χαρακτηρισμένο ως το «κορυφαίο στον κόσμο μουσείο κινηματογραφικών ταινιών», το αμερικανικό τοπόσημο στην Καλιφόρνια, στο Miracle Mile στο Λος Άντζελες, θα μεταδίδει τη δύναμη των ταινιών, θα προσφέρει τη δυνατότητα ματιάς στο πώς δημιουργούνται οι ταινίες και θα εξερευνά τον ευρύτατο πολιτιστικό αντίκτυπό τους. Η βασική κατασκευή, την οποία έχει σχεδιάσει ο διάσημος Ιταλός αρχιτέκτονας Ρέντσο Πιάνο, έχει ολοκληρωθεί και ήδη βρίσκεται σε εξέλιξη η κατασκευή τεσσάρων ορόφων που θα φιλοξενούν καινοτόμες εκθέσεις. «Αδημονούμε να υποδεχθούμε ολόκληρο τον κόσμο στο Academy Museum. Όταν, στις 14 Δεκεμβρίου, ανοίξουν οι πύλες μας, ο συναρπαστικός συνδυασμός εκθέσεων, προβολών και δημόσιων και εκπαιδευτικών προγραμμάτων θα δώσει τη δυνατότητα στους απανταχού φίλους του κινηματογράφου να βιώσουν άνευ προηγουμένου εμπειρίες» τόνισε ο διευθυντής του μουσείου, Μπιλ Κράμερ. Σχολιάζοντας την ανακοίνωση της ημερομηνίας της έναρξης λειτουργίας του μουσείου, ο Ρον Μέγιερ, πρόεδρος του διοικητικού συμβουλίου του Academy Museum και αντιπρόεδρος της NBCUniversal, υπογράμμισε: «Αυτό είναι ένα μουσείο το οποίο μόνο η Ακαδημία μπορούσε να δημιουργήσει: συναρπαστικό και διαφωτιστικό. Ιστορικό και σύγχρονο. Προσδοκούμε να μοιραστούμε το παγκόσμιο εύρος του κινηματογράφου».  ",https://www.tanea.gr/2020/02/14/lifearts/cinema/tom-xanks-anakoinose-tin-imerominia-egkainion-tou-academy-museum-of-motion-pictures/
Culture,tanea.gr,Η Κόνστανς Γου δεν έχει δει ακόμα το «Hustlers»,14 Φεβρουαρίου 2020 | 10:55,tanea.gr,"Η Κόνστανς Γου δεν έχει δει ακόμα την ταινία «Hustlers», παρά το γεγονός ότι έχει πρωταγωνιστικό ρόλο στην κινηματογραφική επιτυχία. «Δεν την έχω δει ακόμα» ομολόγησε η ηθοποιός που ήταν προσκεκλημένη στην εκπομπή «Live with Kelly and Ryan». Ωστόσο κατέστησε σαφές ότι η ταινία «Hustlers» δεν είναι η μοναδική, στην οποία συμμετείχε και δεν έχει δει. Η ηθοποιός είπε ότι αφού παρακολούθησε το «Crazy Rich Asians» το 2018 για το οποίο κέρδισε Χρυσή Σφαίρα «σταμάτησε να βλέπει τα πάντα». «Δεν παρακολούθησα τις εμφανίσεις μου σε talk show, στη σειρά «Fresh Off the Boat» ή στο φιλμ «Hustlers» απλά επειδή σκέφτηκα ότι θέλω να επικεντρωθώ στο παρόν και να μην είμαι αυτοκριτική και να σκέφτομαι και να μιλώ πάρα πολύ για το παρελθόν» πρόσθεσε. Τον Μάιο του 2019, η Κόνστανς Γου επικρίθηκε έντονα για την αντίδρασή της για τη συνέχιση της σειράς «Fresh Off the Boat» για έκτη σεζόν. Εκείνη την εποχή, έγραψε στο Twitter: «Τόσο αναστατωμένη τώρα που κυριολεκτικά κλαίω», αλλά αργότερα διευκρίνισε το σχόλιό της λέγοντας ότι ήταν «προσωρινά αναστατωμένη» επειδή η ανανέωση σήμαινε ότι έπρεπε να «εγκαταλείψει ένα άλλο project, με το οποίο ήταν πραγματικά παθιασμένη». Πηγή: ΑΠΕ-ΜΠΕ  ",https://www.tanea.gr/2020/02/14/lifearts/cinema/i-konstans-gou-den-exei-dei-akoma-to-hustlers/
Culture,www.thetoc.gr,"Δημοσκόπηση: Το 62,4% των Ελλήνων θα πήγαινε Ηρώδειο, Επίδαυρο το καλοκαίρι - Θετικοί σε συναυλίες, θέατρα, σινεμά",,THETOC TEAM,"Ενόψει του πιο  αβέβαιου καλοκαιριού για τον Πολιτισμό και τις Τέχνες , το Youfly.com διενήργησε μία δημοσκόπηση για την ψυχαγωγία και τα θεάματα, έτσι ώστε να ""πιάσει τον παλμό"" του κοινού και να δούμε εάν -εν μέσω της πανδημίας και των περιοριστικών μέτρων για την εξάπλωση του κορονοϊού- θα πήγαιναν σε συναυλίες, θεατρικές παραστάσεις και άλλα θεάματα. Στη δημοσκόπηση, στην οποία συμμετείχαν 1.906 άτομα όλων των ηλικιών (18-65), αποτυπώνεται η ανησυχία των θεατών και η ανάγκη τους για ισχυρά μέτρα προφύλαξης και κοινωνικής αποστασιοποίησης. Σύμφωνα λοιπόν με τα στοιχεία της  έρευνας του Youfly.com , κατά τη διάρκεια της καραντίνας,  το θέατρο έχει λείψει στο 69,2% των πολιτών, ο κινηματογράφος στο 65,2%, ενώ οι μουσικές σκηνές και οι πίστες στο 65,3%.  Μάλιστα, στην ερώτηση ""Εάν δεν βρεθεί το φάρμακο κατά του κορονοϊού, θα πηγαίνατε σε ένα ανοιχτό θέατρο (πχ Ηρώδειο, Επίδαυρο) φέτος το καλοκαίρι, το 62,4 των πολιτών απάντησε ΝΑΙ, ενώ το 37,6 ΟΧΙ. Σε αντίστοιχη ερώτηση, αλλά για ανοιχτές συναυλίες, το 53,6% απάντησε πως ΝΑΙ θα πήγαινε, ενώ το 46,4% ΟΧΙ. Όσον αφορά στον κινηματογράφο, το 58,8% λέει πως θα πήγαινε και το 41,2% ότι δεν θα πήγαινε. ",https://www.thetoc.gr/politismos/article/to-624-ton-ellinon-tha-pigaine-irodeio-epidauro-to-kalokairi---thetikoi-se-sunaulies-theatra-sinema/
Culture,tanea.gr,"Ο Ηλίας Καρελλάς «βάζει» στο θέατρο σκιών τον Βαμβακάρη, τον Παπαϊωάννου και τον Τσιτσάνη",14 Φεβρουαρίου 2020 | 16:57,tanea.gr,"Τι θα γινόταν αν ο Καραγκιόζης αποφάσιζε να μαζέψει τους καλύτερους έλληνες μουσικούς για να παίξουν στον γάμο του Μπαρμπάγιώργου; Αν ο σούπερ ήρωας του θεάτρου σκιών ζητούσε να γνωρίσει τους πιο άξιους αντιπροσώπους της ρεμπέτικης μουσικής και μάλιστα προσπαθούσε να τους πείσει στο καινούργιο μαγαζί που ανοίγει και θα εγκαινιάσει με τον γάμο του μπάρμπα του; Όλα αυτά θα συμβούν στην παράσταση «Avanti μαέστρο… ρεμπέτικα» που παρουσιάζεται στο Μέγαρο Μουσικής Αθηνών από τις 19 Φεβρουαρίου και για τέσσερις Τετάρτες. Ένα μουσικό ταξίδι σκιών και λαϊκής ορχήστρας φυσικά με την επιμέλεια του καλύτερου στο είδος. Ο Ηλίας Καρελλάς με δεκάδες παραστάσεις Θεάτρου Σκιών συνδυασμένες με μουσική στο ενεργητικό του, αυτή τη φορά καταπιάνεται με το ρεμπέτικο, είδος με το οποίο έχει ασχοληθεί και στο παρελθόν στην παράσταση «Οι κουμπάροι» αλλά σε περιορισμένο εύρος. «Όλες μου τις παραστάσεις τις διέπει η μουσική που είναι σαν να είμαι και εγώ μέλος μιας ορχήστρας» αναφέρει ο Ηλίας Καρελλάς όταν ξεκινάει να μου αφηγείται αυτή την πρωτότυπη ιδέα. «Η πρόταση ήρθε από την Κατερίνα Τσιρίδου και τον Αγάθωνα, που είναι από τους σημερινούς πιο αντιπροσωπευτικούς και γνήσιους δημιουργούς δημιουργούς και εκπροσώπους του ρεμπέτικου. Μαζί με τον Ξηντάρη του οποίου ο εγγονός παίζει μπουζούκι στην παράσταση» συνεχίζει ο Ηλίας. Στόχος της παράσταση είναι να παντρευτούν δύο κόσμοι πολύ διαφορετικοί και στο παρελθόν παρεξηγημένοι. Γιατί και για το ελληνικό θέατρο σκιών ήταν περίεργα τα πράγματα μέχρι πριν από λίγα χρόνια –η λέξη «καραγκιόζης» είχε περάσει και στην αργκό- αλά και για το ρεμπέτικο. «Από την ομιλία του Μάνου Χατζιδάκι για το ρεμπέτικο το 1949 και μετά τον Ευγένιο Σπαθάρη αλλά και τις δικές μου δουλειές οι συνθήκες για τον Καραγκιόζη και το ρεμπέτικο άλλαξαν» αναφέρει η Ηλίας και συνεχίζει: «Θα μπορούσαμε να πούμε ότι οι ρεμπέτες είναι αντισταρ όπως και ο Καραγκιόζης». Η παράσταση εντάσσεται στον κύκλο «With a twist» του Μεγάρου Μουσικής και θα ανέβει στην ιδιαίτερη αυλή του Καραγκιόζη στο φουαγιέ του χώρου. Εκεί, μέσα στο Σπίτι του Καραγκιόζη – δημιουργία και αυτό του Ηλία Καρελλά- ενήλικες κυρίως αλλά και έφηβοι και παιδιά θα δουν να ζωντανεύει ο Μάρκος Βαμβακάρης, ο Γιάννης Παπαϊωάννου, ο Βασίλης Τσιτσάνης και πολλοί άλλοι. Και δεν θα ζωντανέψουν απλώς μέσα από τα υπέροχα τραγούδια τους αλλά και μέσα από τις φιγούρες που έχει φτιάξει ειδικά για την παράσταση ο Ηλίας. Όπως μου εξηγεί ο ίδιος η ιστορία είναι μια από τις παραδοσιακές κωμωδίες του Καραγκιόζη αλλά έχει διασκευαστεί σε μεγάλο βαθμό για τις ανάγκες της παράστασης. Ο Ηλίας Καρελλάς συνεχίζει με μεγάλη επιτυχία την παράσταση «Συρανό» που ανεβαίνει στο θέατρο Κάππα με τον Λευτέρη Ελευθερίου στον πρωταγωνιστικό ρόλο και τους String Demons ζωντανά στη σκηνή, αλλά και τις παραστάσεις στο Σπίτι του Καραγκιόζη στο Μέγαρο με σκοπό να μάθουν μικροί και μεγάλοι, όχι μόνο τις ιστορίες του Καραγκιόζη, αλλά και την προέλευση του Θεάτρου Σκιών.  ",https://www.tanea.gr/2020/02/14/lifearts/culture/o-ilias-karellas-vazei-sto-theatro-skion-ton-vamvakari-ton-papaioannou-kai-ton-tsitsani/
Culture,newpost.gr,Έργα Πικάσο και Ματίς βρίσκονται εγκλωβισμένα σε μουσείο της Αυστραλίας,"Δημοσίευση 3 Απριλίου 2020, 14:00 ",newpost.gr,"Εγκλωβισμένα βρίσκονται κορυφαία έργα τέχνης εξαιτίας τουκορωνοϊού στην  Αυστραλία .Πρόκειται για δεκάδες  πίνακες  οι οποίοι είχαν δανειστεί από μεγάλαμουσείατης Ευρώπης και της Αμερικής και φιλοξενούνταν στο πλαίσιο της έκεθσης  «Matisse & Picasso»  που διοργάνωσε ηΕθνική Πινακοθήκη της Αυστραλίαςη οποία έβαλε λουκέτο στις 23 Μαρτίου. Να σημειωθεί πως ηέκθεση  «Matisse & Picasso» είναι η πρώτη στην  Αυστραλία  που πρόβαλε την ιστορία της καλλιτεχνικής σχέσης δύο καλλιτεχνών που θεωρούνται από τους σημαντικότερους του 20ου αιώνα στην  Ευρώπη . «Έχουμε περίπου 100 έργα των Ματίς και Πικάσο εδώ από 23 δανεισμούς απ’ όλο τον κόσμο, από την Πινακοθήκη Τέιτ του Λονδίνου, το Μητροπολητικό Μουσείο Τέχνης της Νέας Υόρκης και το Μουσείο Πικάσο στο Παρίσι μεταξύ άλλων»  δήλωσε ο Νικ Μίτζεβιτς, διευθυντής της Εθνικής Πινακοθήκης Τέχνης της Αυστραλίας. Η Εθνική Πινακοθήκη Τέχνης φιλοξενούσε την έκθεση «Matisse & Picasso» έως τις 13 Απριλίου, αλλά λόγω της πανδημίας του κορονοϊού έκλεισε τις πύλες της νωρίτερα. «Είναι αδύνατο να μετακινήσουμε αυτά τα έργα με ασφάλεια, όποτε παραμένουν μαζί μας, μέχρις ότου το προσωπικό των πολιτιστικών ιδρυμάτων έρθει στην Αυστραλία για να τα συγκεντρώσει» εξήγησε ο διευθυντής της NGA. Η διεθνής ανταλλαγή έργων μεταξύ μεγάλων δημόσιων ιδρυμάτων είναι ζωτικής σημασίας για τη διοργάνωση σημαντικών εκθέσεων τέχνης. Αλλά η μετακίνηση αυτών των έργων σε όλο τον πλανήτη είναι μια περίπλοκη και δαπανηρή επιχείρηση. Οι πίνακες δεν μπορούν να μεταφερθούν χωρίς συνοδεία ανθρώπου. Και επειδή τα ανθρώπινα όντα δεν μπορούν να ταξιδέψουν πουθενά αυτό το διάστημα, δεν μπορούν και οι πίνακες. Η Εθνική Πινακοθήκη Τέχνης της Αυστραλίας έχει δανείσει περίπου 1200 έργα, μερικά εντός της Αυστραλίας, κάποια στο εξωτερικό. Εκεί όπως φαίνεται θα μείνουν το επόμενο διάστημα. Η Εθνική Πινακοθήκη της Αυστραλίας έκλεισε στις 23 Μαρτίου. Η έκθεση «Matisse & Picasso» είναι η πρώτη στην Αυστραλία που πρόβαλε την ιστορία της καλλιτεχνικής σχέσης δύο καλλιτεχνών που θεωρούνται από τους σημαντικότερους του 20ου αιώνα στην Ευρώπη.",https://newpost.gr/entertainment/5e871bd39414801b30244240/erga-pikaso-kai-matis-vriskontai-egklovismena-se-moyseio-tis-aystralias
