subtopic,website,title,date,author,text,url
Culture,tanea.gr,Άλκηστις Πρωτοψάλτη : Ο ξεριζωμός από την Αλεξάνδρεια και η καταξίωση,18 Φεβρουαρίου 2020 | 09:02,tanea.gr,"Καλεσμένη στην εκπομπή του του Νίκου Χατζηνικολάου «Ενώπιος Ενωπίω» βρέθηκε το βράδυ της Δευτέρας (17/2) η Άλκηστις Πρωτοψάλτη. Η σπουδαία ερμηνεύτρια, σε μία εξομολόγηση ζωής, μίλησε για τον ξεριζωμό από την Αλεξάνδρεια της Αιγύπτου, τα πρώτα βήματα στη μουσική και την καταξίωση. κατά τη διάρκεια της συνέντευξης εκείνη και ο Στέφανος Κορκολής αποκάλυψαν μία αστεία περιπέτεια που έζησαν κάποτε. «Αν μπορώ να πω ότι έχω μία φίλη είναι η Άλκηστις Πρωτοψάλτη γιατί είναι βράχος» , δήλωσε αρχικά ο τραγουδιστής. Παράλληλα, οι δύο καλλιτέχνες αντάλλαξαν φιλοφρονήσεις και μίλησαν με τρυφερά λόγια ο ένας για τον άλλον. «Ήμασταν οι πρώτοι που εφαρμόσαμε τον αντικαπνιστικό νόμο», δήλωσε ο Στέφανος Κορκολής , υπογραμμίζοντας ότι κατάφεραν την πρώτη ημέρα των εμφανίσεών τους σε μαγαζί της Θεσσαλονίκης να το εφαρμόσουν με επιτυχία. Ωστόσο, όπως τόνισε η Άλκηστις Πρωτοψάλτη την επόμενη ημέρα χάλασαν οι δύο μηχανές καπνού του μαγαζιού και ήταν στη σκηνή χωρίς να μπορούν να δουν τίποτα. Μάλιστα, είπαν πέντε τραγούδια και όταν κατάφεραν να αντικρίσουν ο ένας τον άλλον, έσκασαν στα γέλια. Φυσικά, απέδωσαν το περιστατικό στις “κατάρες” των καπνιστών! ",https://www.tanea.gr/2020/02/18/lifearts/music/alkistis-protopsalti-o-kserizomos-apo-tin-aleksandreia-kai-i-kataksiosi/
Culture,tanea.gr,Μπομπ Μάρλεϊ: Επετειακό βιντεοκλίπ για το «Redemption Song»,7 Φεβρουαρίου 2020 | 11:50,tanea.gr,"Η οικογένεια του Μπομπ Μάρλεϊ, η Universal Music και η Island Records ένωσαν τις δυνάμεις τους για να εορτάσουν με ένα εμπνευσμένο βιντεοκλίπ τα 40 χρόνια από την κυκλοφορία του «Redemption Song». Το τραγούδι κυκλοφόρησε τον Οκτώβριο του 1980, στο άλμπουμ «Uprising» των Bob Marley & the Wailers. Τον επόμενο χρόνο, ο καρκίνος γονάτισε τον Μπομπ. Δημιουργία των Γάλλων καλλιτεχνών Octave Marsal και Theo De Gueltzl, το κλιπ περιλαμβάνει 3.000 πρωτότυπα σχέδια που οπτικοποιούν το μήνυμα του τραγουδιού, τη χειραφέτηση. Εικονογραφία από την Τζαμάικα γεμίζει την οθόνη: ένα δυνατό λιοντάρι φέρει στέμμα, στη συνέχεια βγάζει φτερά και πετά απομακρυνόμενο από ένα βασίλειο. Ο Μάρλεϊ παίζει μια κιθάρα γεμάτη λουλούδια. «Από την ιστορία της Δουλείας και της Τζαμάικα, την κουλτούρα των Ρασταφάρι, την κληρονομιά των προφητών (του Χαϊλέ Σελασιέ του 1ου, του Μάρκους Γκάρβεϊ και του Μάλκολμ Χ), αλλά και από την προσωπική ζωή του Μπομπ, οδηγούμε τους ακροατές σε ένα ταξίδι μέσω αλληγοριών και απεικονίσεων» είπαν, σε ανακοίνωσή τους, οι Γάλλοι καλλιτέχνες. Το κλιπ είναι το πρώτο στο πλαίσιο του «Marley75», ενός εορτασμού καθ’ όλη τη διάρκεια της φετινής χρονιάς των 75ων γενεθλίων του θρύλου του ρέγκε. Αν ζούσε, στις 6 Φεβρουαρίου ο Μπομπ Μάρλεϊ θα γινόταν 75 χρόνων. Όλη τη χρονιά, στο YouTube θα εμφανίζονται βίντεο με υλικό που θα δημοσιεύεται για πρώτη φορά (μουσική, τέχνη, φωτογραφία και άλλα). Οι γιοι του Μπομπ, ο Ζίγκι και ο Στέφεν, θα τιμήσουν την επέτειο γενεθλίων με μια «Bob Marley Celebration» στο φεστιβάλ BeachLife, στη Redondo Beach της Καλιφόρνιας (1 έως 3 Μαΐου). Πηγή: ΑΠΕ-ΜΠΕ  ",https://www.tanea.gr/2020/02/07/lifearts/music/mpomp-marlei-epeteiako-vinteoklip-gia-to-redemption-song/
Culture,tanea.gr,«Μεταχορδές» στο Μουσείο Μπενάκη από την Φιλαρμόνια Ορχήστρα Αθηνών,15 Φεβρουαρίου 2020 | 20:15,tanea.gr,"Στο Μουσείο Μπενάκη επιστρέφει η Φιλαρμόνια για μια ακόμη συναυλία - την τρίτη της φετινής της σειράς – υπό τον τίτλο ΜΕΤΑΧΟΡΔΕΣ το Σάββατο 22 Φεβρουαρίου. Στο πρώτο μέρος οι δεξιοτέχνες μουσικοί του συνόλου εγχόρδων της ορχήστρας θα συνεργαστούν με τον εξαιρετικό Έλληνα διεθνούς φήμης μαέστρο, Γιώργο Μπαλατσινό, σε ένα πρόγραμμα με μουσική του 20ού αιώνα για έγχορδα. Η συναυλία θα ξεκινήσει με το έργο του Γιώργου Σισιλιάνου «Μεταμορφώσεις». Το έργο αυτό, σε ελεύθερη μορφή παραλλαγών, γράφτηκε το 1993 και αποτελεί μεταγραφή μιας σπουδής για πιάνο του ίδιου συνθέτη. Θα ακολουθήσει το Κοντσερτίνο για όμποε και ορχήστρα εγχόρδων του Νίκου Σκαλκώτα. Πρόκειται για ένα έργο που ο μεγάλος συνθέτης δεν πρόλαβε να ενορχηστρώσει. Η Φιλαρμόνια επιλέγει για τη συναυλία αυτή την ενορχήστρωση του Piero Guarino. Σολίστ στο όμποε είναι ο Έλληνας καλλιτέχνης Κώστας Γιοβάνης. Η συναυλία θα κλείσει με ένα από τα εμβληματικότερα έργα της παγκόσμιας μουσικής φιλολογίας. Ξεκινώντας τη συμμετοχή της στο διεθνές έτος Μπετόβεν (250 χρόνια από τη γέννησή του), η Φιλαρμόνια αναμετράται με την δημοφιλή Συμφωνία αρ. 5, σε ντο ελάσσονα. Πρόκειται για ένα έργο σταθμό, γύρω από το οποίο αναπτύχθηκαν ολόκληρες αισθητικές θεωρίες και ρεύματα και με βάση το οποίο χαρακτηρίστηκαν συνθέτες, έργα, αλλά και ολόκληρες ιστορικές περίοδοι. Ένα έργο στο μεταίχμιο μεταξύ απαράμιλλης κλασικής αυστηρότητας και εκρηκτικής ρομαντικής εκφραστικότητας, σε μια ξεχωριστή και πολυαναμενόμενη ερμηνεία από τη Φιλαρμόνια και τον Γιώργο Μπαλατσινό. Πρόγραμμα:Γιώργος Σισιλιάνος,Μεταμορφώσεις για ορχήστρα εγχόρδων, έργο 55 Νίκος Σκαλκώτας,Κοντσερτίνο για όμποε και ορχήστρα εγχόρδων Ενορχήστρωση – Piero Guarino Ludwig van Beethoven, Συμφωνία αρ. 5, σε ντο ελάσσονα, έργο 67 Σολίστ:  Κώστας Γιοβάνης, όμποε Διεύθυνση:  Γιώργος Μπαλατσινός  ",https://www.tanea.gr/2020/02/15/lifearts/music/metaxordes-sto-mouseio-mpenaki-apo-tin-filarmonia-orxistra-athinon/
Culture,tanea.gr,Μπομπ Μάρλεϊ : Μιούζικαλ αφιερωμένο στον θρύλο της ρέγκε,18 Φεβρουαρίου 2020 | 10:56,tanea.gr,"Ένα νέο μιούζικαλ εμπνευσμένο από τη ζωή και τη μουσική του θρύλου της reggae Μπομπ Μάρλεϊ θα κάνει το ντεμπούτο του στο Λονδίνο τον επόμενο χρόνο. Το μιούζικαλ «Get Up, Stand Up!» θα κάνει πρεμιέρα στο θέατρο Lyric, στο Λονδίνο, στις 6 Φεβρουαρίου του 2021, την ημέρα που ο επιδραστικός μουσικός θα γιόρταζε τα 76α γενέθλιά του. Η ιστορία της ανόδου του Μπομπ Μάρλεϊ στο παγκόσμιο μουσικό στερέωμα μεταφέρεται στη θεατρική σκηνή από το βραβευμένο δίδυμο με βραβείο Λόρενς Ολιβιέ, τον θεατρικό συγγραφέα Λι Χολ και τον σκηνοθέτη Ντομινίκ Κουκ. Στον πρωταγωνιστικό ρόλο ως Μπομπ Μάρλεϊ θα εμφανιστεί ο Αρίνζε Κένε, ηθοποιός και θεατρικός συγγραφέας. «Αισθάνομαι απόλυτη τιμή που θα αναλάβω αυτόν τον ρόλο. Δεν είναι μόνο τιμή που θα μπορέσω να μεταδώσω το μήνυμα του Μπομπ Μάρλεϊ ακόμη περισσότερο, αλλά το να γίνω εκείνος για λίγο, είναι ένα πραγματικό όνειρο. Μεγάλωσα με τη μουσική του και το μάντρα του και ο ίδιος ήταν ένα από τα πρότυπα μου από τότε που ήμουν παιδί. Νιώθω σαν να είναι στο DNA μου. Είναι ο άνθρωπος, τον αγαπώ», ανέφερε ο Αρίνζε Κένε. Πηγή: ΑΠΕ-ΜΠΕ  ",https://www.tanea.gr/2020/02/18/lifearts/music/mpomp-marlei-miouzikal-afieromeno-ston-thrylo-tis-regke/
Culture,tanea.gr,Παράταση για την έκθεση «Εξαιρέσεις» στην Πινακοθήκη του Δήμου Αθηναίων,2 Ιανουαρίου 2020 | 10:36,tanea.gr,"Παρατείνεται έως τις 29 Μαρτίου 2020 η έκθεση «Εξαιρέσεις: Όψεις του εξπρεσιονισμού στην Ελλάδα» στην Πινακοθήκη δήμου Αθηναίων, στην οποία συγκεντρώνονται έργα της Συλλογής της Πινακοθήκης και σύνολα από σημαντικές καλλιτεχνικές προσωπικότητες, με κεντρική μορφή τον Γιώργο Μπουζιάνη,  που εκπροσωπούν πράγματι «εξαιρέσεις» ως προς το ακαδημαϊκό κλίμα που επικρατεί στην ελληνική τέχνη τον 20ο αι. και ως προς τις επικρατούσες νεοτερικές τάσεις που χαρακτηρίζουν τη γενιά του ’30. Τα έργα που παρουσιάζονται στην έκθεση Εξαιρέσεις, σε μεγάλο βαθμό δεν έχουν ποτέ εκτεθεί μέχρι σήμερα στο σύνολό τους ή κάποια και καθόλου. Τα κυριότερα έχουν εκτεθεί μόνον αποσπασματικά, ως αριστουργήματα της Συλλογής της Πινακοθήκης, η οποία έχει πολύ νωρίς δώσει το λόγο σε σημαντικούς καλλιτέχνες για να προτείνουν και να συγκεντρώσουν τα έργα που ανήκουν στην πόλη των Αθηνών. Το 2018, στην έκθεση γύρω από τη θητεία του Παπαλουκά ως διευθυντή της Πινακοθήκης, παρουσιάστηκαν  οι επιστολές με τις οποίες έδωσε αγώνα για να υποστηρίξει το έργο του Μπουζιάνη, του Παρθένη, του Βιτσώρη, και πολλών άλλων νεότερων καλλιτεχνών. Έτσι, βοήθησε καλλιτέχνες, στήριξε ομάδες και καλλιτεχνικές συντροφιές και ανοίχτηκε σε όλες τις εκφράσεις και εικαστικά μέσα, δίνοντας ίση βαρύτητα στους ζωγραφικούς πίνακες, τα σχέδια, τις υδατογραφίες, τα παστέλ, τα χαρακτικά, τα σκίτσα, τις καρικατούρες, κλπ. Κεντρική μορφή της έκθεσης είναι ο Γιώργος Μπουζιάνης, που μαζί με τον χαράκτη Γιώργο Οικονομίδη, είναι οι μόνοι που είχαν άμεση σχέση με τις ομάδες του εξπρεσιονισμού στη Γερμανία και τη Γαλλία και η επιρροή του ανοίγει ένα κύκλο νεότερων καλλιτεχνών, που θα βρουν μέσα από τα έργα του Οικονόμου και του Τριανταφυλλίδη, δρόμους  που τους απομακρύνουν από τις κυρίαρχες τάσεις του Παρισινού μοντερνισμού κι ανοίγονται σε εκφράσεις πιο ρεαλιστικές κι εκφραστικές. Πολλοί από αυτούς τους καλλιτέχνες είναι λίγο γνωστοί σε κοινό και κριτικούς, συνιστώντας πράγματι έναν κύκλο εξαιρέσεων τόσο μέσα από το έργο τους όσο και μέσα από τη στάση ζωής τους, μακριά από τη δημοσιότητα. Στην έκθεση παρουσιάζονται έργα καλλιτεχνών, οι οποίοι ανήκαν στην ομάδα Στάθμη, μεταξύ άλλων, εκτός του Γ. Μπουζιάνη, των Θ. Απάρτη,  Α. Σώχου, Γ. Ζογγολόπουλου, Αγγ. Θεοδωρόπουλου, Γ. Μηταράκη, η Αγλ. Παππά, Τ. Ελευθεριάδη, Ο. Κανέλλη, Β. Σεμερτζίδη,  Σπ. Παπαλουκά, Γ. Βακαλό, Γ. Σπυρόπουλου, Έρ. Φραντζισκάκη, Ελ. Ζογγολοπούλου. Σκοπός της έκθεσης είναι να αναδείξει το ευρύ φάσμα της Συλλογής της Πινακοθήκης δήμου Αθηναίων, η οποία συνέλεξε με μεγάλη αυτονομία κάποιες ιδιαίτερες μορφές της Ελληνικής τέχνης και έδωσε το λόγο στις «εξαιρέσεις» πιο συχνά από ότι στους κανόνες, και στους ίδιους τους καλλιτέχνες από την ίδρυσή της,  ίσως το σημαντικότερο χαρακτηριστικό που εκφράζει το πνεύμα της. Την επιμέλεια της έκθεσης έχει ο Ντένης Ζαχαρόπουλος.  ",https://www.tanea.gr/2020/01/02/lifearts/culture/paratasi-gia-tin-ekthesi-eksaireseis-stin-pinakothiki-tou-dimou-athinaion/
Culture,tanea.gr,Γιατί η μουσική (δεν) είναι παγκόσμια γλώσσα,2 Ιανουαρίου 2020 | 12:01,tanea.gr,"Τραγούδια και χοροί της αγάπης, φτιαγμένα από την Μπιγιόνσε ή την κοινότητα Γκουαρανί της Παραγουάης. Η μουσική τους απευθύνεται στα μέλη της κοινωνικής ομάδας τα οποία κατανοούν το νόημα. Δηλαδή η μουσική είναι μία παγκόσμια γλώσσα, σύμφωνα με την πρόσφατη έρευνα από την επιστημονική κοινότητα του Χάρβαρντ που δημοσιεύτηκε στο περιοδικό«Science» Το πρόγραμμα, με το όνομα Natural History of Song (Φυσική Ιστορία του Τραγουδιού), έτρεξαν ψυχολόγοι ερευνητές του Χάρβαρντ και δημιούργησαν ένα είδος παγκόσμιας μουσικής γραμματικής, από τα λεγόμενα «δομικά υλικά» τα οποία χρησιμοποιούνται σε όλες τις μουσικές συνθέσεις στον κόσμο. «Είναι εύκολο να πούμε ότι η μουσική εμφανίζει διαπολιτισμικές ομοιότητες όμως δεν είναι εξίσου εύκολο να κατανοήσουμε ποια είναι αυτά τα δομικά στοιχεία» δηλώνει ο Μανβίρ Σινγκ ένας από τους βασικούς ερευνητές του προγράμματος. Σχεδόν κάθε κοινωνία την οποία μελέτησαν οι ερευνητές είχε τραγούδια μέσα στο πλαίσιο είκοσι τύπων συμπεριφοράς. Σε αυτά συμπεριλαμβάνονται τραγούδια του χορού, της φροντίδας των παιδιών, της επούλωσης, της θρησκευτικής δραστηριότητας, της ψυχαγωγίας και του πένθους. Για να δείξουν την καθολικότητα αυτών των συμπεριφορών, οι ερευνητές ανέλυσαν στατιστικά τις τραγουδιστικές ερμηνείες, τις οποίες είχαν συλλέξει εθνομουσικολόγοι από εξήντα κοινωνικές ομάδες μικρής κλίμακας σε όλον τον κόσμο. Διαβάστε περισσότερα στην έντυπη έκδοση τα ΝΕΑ της Πέμπτης που κυκλοφορεί",https://www.tanea.gr/2020/01/02/lifearts/culture/giati-i-mousiki-den-einai-pagkosmia-glossa/
Culture,tanea.gr,Ανοίγει για πρώτη φορά η αρχαιότερη πυραμίδα της Αιγύπτου,3 Ιανουαρίου 2020 | 13:14,tanea.gr,"Μέσα στους πρώτους μήνες του 2020, ανοίγει για πρώτη φορά μία από τις παλαιότερες πυραμίδες της Αιγύπτου, η κλιμακωτή Πυραμίδα Ζοζέρ, μετά την ολοκλήρωση των έργων αποκατάστασης, όπως ανακοίνωσε ο γενικός γραμματέας του Ανώτατου Συμβουλίου Αρχαιοτήτων Μουστάφα Ουαζίρι. Η απόφαση αυτή αποβλέπει σε ένα γενικότερο σχέδιο του υπουργείου Τουρισμού και Αρχαιοτήτων για την προστασία και αναζωογόνηση των ιστορικών τοποθεσιών της Αιγύπτου, γράφει ο αιγυπτιακός τύπος. Ο Ουαζίρι μίλησε για την «παλαιότερη πυραμίδα του κόσμου», όπου τα έργα αποκατάστασης ξεκίνησαν το 2006, σταμάτησαν το 2011 και συνεχίστηκαν το 2013. Στην πυραμίδα αυτή που κατασκευάστηκε πριν από 4.700 χρόνια για να αποτελέσει τον τάφο του Φαραώ Ζοζέρ, έχει αποκατασταθεί η εξωτερική της πρόσοψη, η οποία θα φωτιστεί κατάλληλα, με μελέτη Βρετανών επιστημόνων και τεχνικών.",https://www.tanea.gr/2020/01/03/lifearts/culture/anoigei-gia-proti-fora-i-arxaioteri-pyramida-tis-aigyptou/
Culture,tanea.gr,Θάνος Μικρούτσικος : Η συγκλονιστική τελευταία του συναυλία – Τον χειροκροτούσαν 10 λεπτά,29 Δεκεμβρίου 2019 | 14:23,tanea.gr,"«Όσο αντέχω θα είμαι εδώ». Με αυτά τα λόγια αποχαιρέτισε ο Θάνος Μικρούτσικος το κοινό του Ηρωδείου στις 29 Ιουνίου. Ήταν η τελευταία φορά που βρέθηκε στο φυσικό του χώρο, στη σκηνή, μπροστά από το πιάνο του. Μετά από ένα συνταρακτικό δεκάλεπτο που ερμήνευσε με τον δικό του μοναδικό τρόπο το τραγούδι της ζωής του, το «7 Νάνοι στο S/S Cyrenia», ο Μικρούτσικος έμεινε στη σκηνή για σχεδόν άλλα δέκα λεπτά. Αυτή τη φορά δεν επέλεξε εκείνος πότε θα αποχωρήσει αλλά οι χιλιάδες φίλοι του. Άνθρωποι όλων των ηλικιών χειροκροτούσαν όρθιοι έναν από τους σημαντικότερους συνθέτες της χώρας μας. Σε μια στιγμή που δεν μπορείς να ξεχάσεις κοινό και καλλιτέχνης έγιναν πραγματικά ένα. Χωρίς πολλά λόγια, χωρίς κλάματα. Τουλάχιστον όχι από εκείνον. Σαν να ξέραμε όλοι ότι αυτή ήταν η τελευταία φορά που θα απολαύσαμε τη ζωντάνια του, την ενέργεια του, το ταλέντο του. Λίγα βήματα πιο πίσω η Ρίτα Αντωνοπούλου, ο Χρήστος Θηβαίος και ο Κώστας Θωμαΐδης προσπαθούσαν να συγκρατήσουν τα δάκρυα τους. Η τελευταία συναυλία της ζωής του αφορούσε -τι άλλο;- τον Νίκο Καββαδία. Με ένα ιδιαίτερο σχήμα, με τρία πιάνα και πνευστά, ο συνθέτης θέλησε να κλείσει έναν κύκλο που σημάδεψε την καριέρα του αλλά και τον ελληνικό πολιτισμό. Η σημαντικότερη ίσως προσφορά του, η μελοποίηση του Καββαδία ήταν και ο τρόπος του να μας πει αντίο. Ήταν και ο δικός μας τρόπος να του ευχηθούμε να χορεύει πάντα στο φτερό του καρχαρία.",https://www.tanea.gr/2019/12/29/lifearts/culture/thanos-mikroutsikos-i-sygklonistiki-teleytaia-tou-synaylia-ton-xeirokrotousan-10-lepta/
