subtopic,website,title,date,author,text,url
Culture,newpost.gr,Εθνική Λυρική Σκηνή: 20.000 δωρεάν εισιτήρια παραστάσεων για το ιατρικό και νοσηλευτικό προσωπικό του ΕΣΥ,"Δημοσίευση 8 Απριλίου 2020, 16:00 ",newpost.gr,"Ως ελάχιστη ένδειξη ευγνωμοσύνης και σεβασμού προς τους  Ιατρούς και Νοσηλευτές  του  ΕΣΥ , οι οποίοι βρίσκονται στην πρώτη γραμμή της αντιμετώπισης της πανδημίας του κορωνοϊού, η Υπουργός Πολιτισμού και Αθλητισμού κ.  Λίνα Μενδώνη  στήριξε άμεσα και έμπρακτα την πρωτοβουλία του Καλλιτεχνικού Διευθυντή της Εθνικής Λυρικής Σκηνής, κ. Γιώργου Κουμεντάκη: Το Υπουργείο Πολιτισμού και Αθλητισμού σε συνεργασία με την Εθνική Λυρική Σκηνή προσφέρουν προς τους Ιατρούς και Νοσηλευτές του ΕΣΥ 20.000 δωρεάν εισιτήρια για τις παραστάσεις της, από την έναρξη της επαναλειτουργίας της και έως το καλοκαίρι του 2021. Η σπουδαιότητα της προσφοράς των  Ιατρών και Νοσηλευτών του ΕΣΥ  για τη διασφάλιση της δημόσιας υγείας και της ζωής όλων μας είναι ύψιστης σημασίας. Το Υπουργείο Πολιτισμού και Αθλητισμού και η Εθνική Λυρική Σκηνή προσφέρουμε «θεραπεία με τα σύνεργα της λυρικής τέχνης, της μουσικής και του χορού», στους ανθρώπους «πίσω από τις μάσκες», οι οποίοι με αυταπάρνηση, τεράστιες δυσκολίες και κίνδυνο -ακόμα και για τη ζωή τους-, δίνουν τη μάχη με τον κορονοϊό. Αναγνωρίζουμε τη μεγαλειώδη προσφορά τους με αυτό το μικρό αντίδωρο, που θα τους προσφέρει τις θεραπευτικές και ψυχαγωγικές ιδιότητες της τέχνης, αφού περάσει η υγειονομική κρίση. Οι λεπτομέρειες για τη διανομή των δωρεάν εισιτηρίων της  ΕΛΣ  προς τους Ιατρούς και Νοσηλευτές του ΕΣΥ θα ανακοινωθούν το επόμενο χρονικό διάστημα, όταν θα ξεκινήσει η άρση των περιοριστικών μέτρων και δρομολογηθεί η σταδιακή επαναλειτουργία των θεάτρων.",https://newpost.gr/entertainment/5e8dd6f52f1136da1fe56f0a/ethniki-lyriki-skini-20-000-dorean-eisitiria-parastaseon-gia-to-iatriko-kai-nosileytiko-prosopiko-toy-esy
Culture,tanea.gr,Στον αέρα το τρέιλερ της νέας ταινίας του Γουές Άντερσον,17 Φεβρουαρίου 2020 | 09:57,tanea.gr,"Το έτος 2020 θα προβληθεί στους κινηματογράφους η νέα ταινία του Γουές Άντερσον. Το ερχόμενο καλοκαίρι, ο ιδιαίτερης ιδιοσυγκρασίας σκηνοθέτης, θα παραδώσει την ταινία «French Dispatch» με επίκεντρο εβδομαδιαίο αμερικανικό περιοδικό με το ίδιο όνομα -παρόμοιο του New Yorker- το οποίο διευθύνουν Αμερικανοί στη φανταστική γαλλική πόλη του 20ου αιώνα, Ennui-sur-Blasé. Η ταινία που ζωντανεύει τις ιστορίες που παρουσιάζονται στο τελευταίο τεύχος της έκδοσης, σύμφωνα με την επίσημη σύνοψη αποτελεί «μία ερωτική επιστολή προς τους δημοσιογράφους του κόσμου». Το «French Dispatch», διάρκειας δύο ωρών, είναι εμπνευσμένo από την αγάπη του Γουές Άντερσον για το The New Yorker, με τους χαρακτήρες και τα περιστατικά να αφορούν αληθινά γεγονότα και πρόσωπα του περιοδικού. Στο τρέιλερ της ταινίας που μόλις κυκλοφόρησε παρουσιάζονται μεγάλοι σταρ, μεταξύ των οποίων οι Τιμοτέ Σαλαμέ, Φράνσις ΜακΝτόρμαντ, Μπενίσιο ντελ Τόρο, Μπιλ Μάρεϊ, Λεά Σεϊντού, Σέρσια Ρόναν, Όουεν Γουίλσον, Ελίζαμπεθ Μος και πολλοί άλλοι. Η ταινία αναμένεται να αρχίσει να προβάλλεται στις κινηματογραφικές αίθουσες τον Αύγουστο και ενδέχεται να κάνει πρεμιέρα στο Φεστιβάλ Κινηματογράφου των Καννών τον Μάιο. Πηγή: ΑΠΕ-ΜΠΕ  ",https://www.tanea.gr/2020/02/17/lifearts/cinema/ston-aera-to-treiler-tis-neas-tainias-tou-goues-anterson/
Culture,tanea.gr,Stranger Things: Το νέο τρέιλερ θα σε αφήσει με το στόμα ανοιχτό,14 Φεβρουαρίου 2020 | 21:50,tanea.gr,"Διαθέσιμο στους θαυμαστές της δημοφιλούς σειράς «Stranger Things» είναι το νέο τρέιλερ της 4ης σεζόν, το οποίο κάνει ήδη τον γύρο του Διαδικτύου. Το τρέιλερ έχει τίτλο «Από τη Ρωσία με Αγάπη», είναι διάρκειας λιγότερο του ενός λεπτού και μας επιφυλάσσει μια έκπληξη. Τον αγαπημένο χαρακτήρα Τζίμ Χόπερ, ο οποίος είναι ζωντανός και βρίσκεται αιχμάλωτος στην παγωμένη Ρωσία. Ο τρίτος κύκλος τελειώνει με την οικογένεια Μπάιερ να φεύγει για το Σικάγο ενώ η τελευταία σκηνή μεταφέρει τους θεατές σε φυλακές στη Ρωσία όπου ένας φύλακας επιχειρεί να ανοίξει ένα κελί και ο συνάδελφός του του λέει «όχι, όχι τον Αμερικανό». Τελικά ανοίγουν το διπλανό κελί, όπου κρατείται ένας Ρώσος, τον οποίο αρπάζουν και μεταφέρουν σε υπόγειο, πολλά μέτρα κάτω από τη γη, όπου βρίσκεται ο… Ντεμογκόργκον.",https://www.tanea.gr/2020/02/14/lifearts/cinema/stranger-things-to-neo-treiler-tha-se-afisei-me-to-stoma-anoixto/
Culture,tanea.gr,Μπαράζ παραιτήσεων στα «γαλλικά Όσκαρ» μετά τις 12 υποψηφιότητες Πολάνσκι,15 Φεβρουαρίου 2020 | 12:43,tanea.gr,"Σύσσωμο παραιτήθηκε το διοικητικό συμβούλιο της Ακαδημίας Cesar, η οποία απονέμει τα γαλλικά βραβεία κινηματογράφου, αντίστοιχα των Όσκαρ, μόλις δύο εβδομάδες πριν από την τελετή απονομής, έπειτα από την έντονη κριτική που δέχτηκε με αφορμή τη νέα ταινία του Ρομάν Πολάνσκι «Κατηγορώ» (J’ Accuse/ An Officer and a Spy), η οποία βρέθηκε στην κορυφή του καταλόγου με τις υποψηφιότητες. Περισσότεροι από 200 ηθοποιοί, παραγωγοί, σκηνοθέτες και προσωπικότητες του κινηματογράφου διατύπωσαν σε ανοιχτή επιστολή τους προς το ΔΣ της Ακαδημίας, αίτημα για «ριζική μεταρρύθμιση». Σε αυτήν κατήγγειλαν την δυσλειτουργία και την έλλειψη διαφάνειας στα οικονομικά της Ακαδημίας. Επίσης εξέφρασαν παράπονα γιατί το ιδρυτικό καταστατικό των Cesar δεν έχει αλλάξει εδώ και πολύ καιρό και γιατί τα σχεδόν 5.000 μέλη της Ακαδημίας δεν έχουν δικαίωμα ψήφου ούτε λόγου στις απφάσεις της. «Όταν κινητοποιούμαστε, συμβαίνουν πράγματα!», έγραψε στο Twitter η φεμινιστική κολεκτίβα Nous Toutes (Όλες Εμείς). Μια άλλη οργάνωση, η Osez Le Feminisme (Τολμήστε τον Φεμινισμό), ανακοίνωσε το εξής: «Φανταστείτε τι έπεται. Μια νέα επιτροπή που θα ψηφίζει χωρίς την αυτοπεποίθηση του αρσενικού, χωρίς αδιαφάνεια και σεξισμό. Θα σταματήσουμε επιτέλους να χειροκροτούμε τους βιαστές και τους παιδεραστές που διαφεύγουν;». Την παρουσία της ταινίας του Πολάνσκι στον κατάλογο με τις υποψηφιότητες κατήγγειλαν και η υπουργός Ισότητας της Γαλλίας καθώς και κριτικοί κινηματογράφου, αλλά η Ακαδημία απάντησε ότι δεν μπορεί να παίρνει «θέση για θέματα ηθικής» όταν αξιολογεί ταινίες. «Για να τιμήσουμε τους άνδρες και τις γυναίκες που έκαναν κινηματογράφο το 2019, για να βρούμε την ηρεμία και να διασφαλίσουμε ότι το κινηματογραφικό φεστιβάλ παραμένει αυτό ακριβώς–ένα φεστιβάλ–το ΔΣ αποφάσισε ομόφωνα να παραιτηθεί», ανέφερε η Ακαδημία σε ανακοίνωσή της. «Αυτή η συλλογική απόφαση θα επιτρέψει την πλήρη ανανέωση του συμβουλίου», προσθέτει. Μια γενική συνέλευση πρόκειται να πραγματοποιηθεί μετά την επικείμενη τελετή απονομής για την εκλογή νέου ΔΣ και διοίκησης που θα εργαστούν για την εφαρμογή των μεταρρυθμίσεων και του εκσυγχρονισμού (της Ακαδημίας), ανέφερε η Ακαδημία. Το ΔΣ δήλωσε ότι θα ζητήσει από το Εθνικό Κέντρο Κινηματογράφου, μια υπηρεσία που υπάγεται στο υπουργείο Πολιτισμού, να ορίσει έναν μεσολαβητή για να επιβλέπει τις «ριζικές μεταρρυθμίσεις» του καταστατικού του και της διοίκησης.  ",https://www.tanea.gr/2020/02/15/lifearts/cinema/mparaz-paraitiseon-sta-gallika-oskar-meta-tis-12-ypopsifiotites-polanski/
Culture,tanea.gr,Πέθανε στα 103 του ο θρύλος Κερκ Ντάγκλας,6 Φεβρουαρίου 2020 | 04:35,tanea.gr,"Ο Κερκ  Ντάγκλας , ηθοποιός, παραγωγός και σκηνοθέτης του θεάτρου και του κινηματογράφου, εμβληματική μορφή μιας χρυσής εποχής για το Χόλιγουντ, πολλές ερμηνείες του οποίου θεωρούνται κλασικές, όπως αυτή στην ταινία Σπάρτακος (1960, σε σκηνοθεσία Στάνλεϊ Κιούμπρικ), πέθανε χθες Τετάρτη σε ηλικία 103 ετών, ανακοίνωσε ο γιος του, ο Μάικλ Ντάγκλας, επίσης διάσημος ηθοποιός. Ο θρύλος της έβδομης τέχνης είχε αντιμετωπίσει σοβαρά προβλήματα υγείας από τη δεκαετία του 1990 και μετά. Υπέστη εγκεφαλικό το 1996 και καρδιακή προσβολή το 2001. Ο Κερκ Ντάγκλας έπαιξε τις επτά δεκαετίες της καριέρας του σε περίπου εκατό ταινίες, ανάμεσά τους στη μεταφορά του βιβλίου Είκοσι χιλιάδες λεύγες κάτω από τη θάλασσα, του Ιούλιου Βερν (1954), αλλά και φιλμ γουέστερν, δραματικές, αστυνομικές, πολεμικές ταινίες, πολύ συχνά στον ρόλο του σκληρού. «Με τεράστια θλίψη τα αδέλφια μου και εγώ ανακοινώνουμε ότι ο Κερκ Ντάγκλας μας άφησε (…) σε ηλικία 103 ετών. Για τον κόσμο, ήταν ένας θρύλος, ένας ηθοποιός της χρυσής εποχής των κινηματογραφικών ταινιών (…), ένας ανθρωπιστής, η δέσμευση του οποίου στη δικαιοσύνη και στις υποθέσεις στις οποίες πίστευε τον μετέτρεψαν σε πρότυπο και πηγή έμπνευσης για όλους μας», πάντως «για εμένα και τ’ αδέρφια μου, τον Τζόελ και τον Πίτερ, ήταν απλώς ο μπαμπάς», ανέφερε ο Μάικλ Ντάγκλας σε ανακοίνωση που δημοσιοποίησε. Μεγάλος γυναικάς Μεγάλος γυναικάς, ο Ντάγκλας είχε διάφορες κατακτήσεις αλλά ζούσε από το 1994 με την ίδια γυναίκα, την Αν Μπάιντενς, που συνάντησε το 1954 στη Γαλλία κι έγινε η δεύτερη σύζυγός του. Ο Κερκ Ντάγκλας, γιος εβραίων μεταναστών από τη Λευκορωσία, είχε γίνει γνωστός για το εκρηκτικό στιλ πολλών ερμηνειών του, διότι αποτύπωνε στη μεγάλη οθόνη ιδίως το αίσθημα της οργής και της εξέγερσης εναντίον «της αδικίας», όπως έλεγε ο ίδιος. Μετατράπηκε σε ένα από τα μεγαλύτερα αστέρια της κινηματογραφικής βιομηχανίας τις δεκαετίες του 1950 και του 1960. Πρωταγωνίστησε επίσης στην προσπάθεια να σπάσει η λεγόμενη «μαύρη λίστα» στο Χόλιγουντ, ο αποκλεισμός ηθοποιών, σκηνοθετών και σεναριογράφων διότι συνδέονταν με το κομμουνιστικό κίνημα ή θεωρούνταν συμπαθούντες και συνοδοιπόροι τη δεκαετία του 1950. Ο ίδιος είχε εξομολογηθεί πως αισθανόταν μεγαλύτερη υπερηφάνεια για αυτό, παρά για οποιονδήποτε ρόλο του. Πηγή: ΑΠΕ  ",https://www.tanea.gr/2020/02/06/lifearts/cinema/pethane-sta-103-tou-o-thrylos-kerk-ntagklas/
Culture,tanea.gr,Τέσσερις νέες ταινίες για τον Άνταμ Σάντλερ μετά το «Murder Mystery»,4 Φεβρουαρίου 2020 | 12:26,tanea.gr,"Η Netflix επεκτείνει τη συνεργασία της με τον Άνταμ Σάντλερ και τη Happy Madison Productions για ακόμη τέσσερις ταινίες. Η πλατφόρμα streaming ανακοίνωσε τη συμφωνία την Παρασκευή, σημειώνοντας ότι το «Murder Mystery» του Άνταμ Σάντλερ ήταν ο πιο δημοφιλής τίτλος στο Netflix στις ΗΠΑ πέρυσι. Η ταινία, «Mystery Murder», στην οποία συμπρωταγωνίστησε με την Τζένιφερ Άνιστον, ήταν η έκτη για το Netflix του Αμερικανού ηθοποιού, κωμικού, σεναριογράφου και παραγωγού μαζί με τα φιλμ «The Ridiculous 6», «The Do-Over», «Sandy Wexler», «The Week Of» και το επερχόμενο «Hubie Halloween». Η Netflix ανακοίνωσε ότι οι συνδρομητές της έχουν περάσει δύο δισεκατομμύρια ώρες παρακολουθώντας τις ταινίες του Άνταμ Σάντλερ από το 2015, όταν το «The Ridiculous 6» έκανε πρεμιέρα. Ο Άνταμ Σάντλερ πρωταγωνιστεί ως κοσμηματοποιός και εθισμένος στον τζόγο στην ταινία «Uncut Gems» των Τζος και Μπένι Σάφντι, η οποία συγκέντρωσε εισπράξεις 48 εκατομμυρίων δολαρίων στη Βόρεια Αμερική μέσα σε έξι εβδομάδες. Η Netflix δεν αποκάλυψε λεπτομέρειες για τις τέσσερις νέες ταινίες που θα γυριστούν βάσει της συμφωνίας. Το «Hubie Halloween», το οποίο επίσης ασχολείται με τους Kevin James, Julie Bowen, Ray Liotta, Maya Rudolph, Rob Schneider και Shaquille O’Neal, παράγεται με την προηγούμενη συμφωνία του. Ο Σάντλερ ξεκίνησε την καριέρα του ως stand – up κωμικός, εντάχθηκε στο σόου Saturday Night Live ως σεναριογράφος από το 1991 έως το 1995, προτού ιδρύσει την εταιρεία κινηματογραφικών παραγωγών, Happy Madison Productions. Πηγή: ΑΠΕ-ΜΠΕ  ",https://www.tanea.gr/2020/02/04/lifearts/cinema/tesseris-nees-tainies-gia-ton-antam-santler-meta-to-murder-mystery/
Culture,tanea.gr,Μουσική που παρακολουθεί τα καιρικά μοτίβα,3 Φεβρουαρίου 2020 | 11:12,tanea.gr,"Η σύνθεση, από τη συνεργασία της Μπγιορκ με την Microsoft, ακούει στο όνομα «Kórsafn» στα ισλανδικά και σημαίνει «Αρχείο χορωδιακής μουσικής», θα παίζεται συνεχώς στο λόμπι ξενοδοχείου στο κάτω Μανχάταν. Στη σύνθεση, η Μπγιορκ χρησιμοποιεί ήχους από το μουσικό αρχείο της, το οποίο τροφοδοτεί τα τελευταία 17 χρόνια για να δημιουργήσει καινούργιες διασκευές. Σε αυτό περιλαμβάνεται και μουσική από την Χορωδία Hamrahlid της Ισλανδίας, στην οποία η Μπγιορκ συμμετείχε όταν ήταν μικρή και την οποία η ίδια αξιοποίησε στο πειραματικό θεατρικό show της «Cornucopia». Με τη βοήθεια της τεχνητής νοημοσύνης της Microsoft, η μουσική θα προσαρμόζεται στις ανατολές του ήλιου, τα ηλιοβασιλέματα και τις αλλαγές της βαρομετρικής πίεσης, χρησιμοποιώντας δεδομένα από κάμερα τοποθετημένη στην σκεπή του ξενοδοχείου. Η συνεχής ροή δεδομένων θα «εκπαιδεύει» την AI της εταιρείας λογισμικού να αναγνωρίζει πυκνή συννεφιά, χιόνι, βροχή, καθαρό ουρανό και πετούμενα, σε διαφορετικό φως και εποχές. «Μια αρχιτεκτονική δομή στο κάτω Μανχάταν μου έτεινε το χέρι σε ένα AI ταγκό κι εγώ αποδέχθηκα την πρόσκληση, και είμαι σε εγρήγορση, όλο περιέργεια, περιμένοντας τα αποτελέσματα» είπε, σε ανακοίνωσή της, η Μπγιορκ. «Τους πρόσφερα τα αρχεία μου χορωδιακής μουσικής, γραμμένα σε διάστημα 17 χρόνων, τα οποία θα αιωρούνται, μέσα από το “φλιπεράκι” της τεχνητής νοημοσύνης, με οδηγό τις μεταναστεύσεις των πτηνών, τα σύννεφα, τα αεροπλάνα κι αυτό το απολαυστικό πράγμα που λέμε “βαρόμετρο”! Η κοιλάδα του ποταμού Χάντσον είναι ένα από τα με τη μεγαλύτερη κίνηση πουλιών δέλτα ποταμών του πλανήτη. Το ξέρω από προσωπική εμπειρία… Ελπίζω ότι θα το απολαύσετε αυτό!» Η σύνθεση είναι η δεύτερη μια σειράς «Ηχοτοπία σε λόμπι» που συνεχίζει η εταιρεία λογισμικού με το νεοϋορκέζικο ξενοδοχείο. Η πρώτη ήταν σύνθεση της πειραματικής μουσικού Τζουλιάνα Μπάργουικ, με την ευκαιρία των εγκαινίων του Sister Hotel, τον Απρίλιο του 2019.  ",https://www.tanea.gr/2020/02/03/lifearts/music/mousiki-pou-parakolouthei-ta-kairika-motiva/
Culture,tanea.gr,Ριάνα : Νέα διάκριση για την διάσημη ποπ σταρ,15 Φεβρουαρίου 2020 | 09:11,tanea.gr,"Πρώτα κέρδισε το «Urban Luxe» το 2019 στην τελετή απονομής των Βρετανικών Βραβείων Μόδας για το brand ειδών μακιγιάζ Fenty που ίδρυσε και σύντομα η Ριάνα αναμένεται να αναγνωριστεί και πάλι για το πολύπλευρο ταλέντο της. H Αμερικανική Εθνική Ένωση για την Πρόοδο των Έγχρωμων Ατόμων – National Association for the Advancement of Colored People (NAACP), οργάνωση για τα πολιτικά δικαιώματα θα τιμήσει τη σούπερ σταρ της R&B και ποπ μουσικής με το βραβείο του πρόεδρου της οργάνωσης, την ανώτατη διάκριση. Εκτός από τη λαμπρή περίφημη μουσική καριέρα της, η Ριάνα αναγνωρίζεται για το ανθρωπιστικό της έργο και για την επιχειρηματική της δράση. Η Ριάνα δημιούργησε το brand καλλυντικών Fenty Beauty, τη σειρά εσωρούχων Savage x Fenty και τη σειρά ενδυμάτων με τον LVMH, Moët Hennessy Louis Vuitton. Στον ανθρωπιστικό τομέα, υποστήριξε σταθερά προγράμματα ποιοτικής εκπαίδευσης και αντιμετώπισης καταστάσεων έκτακτης ανάγκης σε όλο τον κόσμο μέσω του μη κερδοσκοπικού οργανισμού της, Clara Lionel Foundation, τον οποίο ίδρυσε το 2012. Το βραβείο του προέδρου της NAACP απονέμεται σε ένδειξη αναγνώρισης «ξεχωριστών επιτευγμάτων και της προσφοράς της». Τα περασμένα έτη το βραβείο παρέλαβαν οι JAY-Z, Lauryn Hill, Muhammad Ali, Soledad O’Brien. Ο πρόεδρος της NAACP Ντέρικ Τζόνσον αναμένεται να απονείμει το βραβείο στην τραγουδίστρια από τα Μπαρμπάντος στις 22 Φεβρουαρίου. Η Ριάνα είναι μία από τις πιο επιτυχημένες μουσικούς των τελευταίων 20 χρόνων, έχει πουλήσει πάνω από 250 εκατομμύρια δίσκους σε όλο τον κόσμο και έχει κερδίσει εννέα Grammy.  ",https://www.tanea.gr/2020/02/15/lifearts/music/riana-nea-diakrisi-gia-tin-star-tis-pop/
