subtopic,website,title,date,author,text,url
story,www.cnn.gr,Ανάλυση Reuters: Ο κορωνοϊός θα δοκιμάσει την ενότητα της Ευρωζώνης,"16:00 Τετάρτη, 22 Απριλίου 2020","Newsroom, CNN Greece","Μία  νέα  κρίση χρέους  της  ευρωζώνης  λόγω της πανδημίας του  κορωνοϊού   δεν είναι πιθανή , αλλά οι μεγάλες διαφορές στο ύψος του χρέους που θα έχουν οι χώρες - μέλη της καθώς θα εξέρχονται από την ύφεση μπορεί να δοκιμάσουν σοβαρά την ενότητά της, σύμφωνα με ανάλυση του  Reuters . Το  Διεθνές Νομισματικό Ταμείο  αναμένει ότι το  χρέος των 19 χωρών της ευρωζώνης  θα αυξηθεί φέτος περισσότερο από 13% του ΑΕΠ, φθάνοντας στο  97% , καθώς τα περιοριστικά μέτρα σε όλη την Ευρώπη θα οδηγήσουν σε μία  πρωτοφανή ύφεση 7,5% . Παρά, όμως, τον αναμενόμενο μεγάλης έκτασης δανεισμό, η επίπτωση στις αποδόσεις των ομολόγων ήταν έως τώρα μικρή. Το επιτόκιο στα  ομόλογα των χωρών με υψηλό χρέος  -  Ιταλίας ,  Ισπανίας ,  Ελλάδας  ή  Πορτογαλίας  - έχει αυξηθεί κατά μόνο 40-50 μονάδες βάσης (0,4 έως 0,5 της ποσοστιαίας μονάδας), χάρη στις μεγάλες αγορές ομολόγων της Ευρωπαϊκής Κεντρικής Τράπεζας (ΕΚΤ). «Καθώς η  ΕΚΤ  κυριολεκτικά σκουπίζει τη δευτερογενή αγορά… ο κίνδυνος μίας κρίσης κρατικού χρέους είναι περίπου μηδενικός», δήλωσε οικονομολόγος της Saxo Bank, απηχώντας την άποψη πολλών άλλων οικονομολόγων και αξιωματούχων. Τη μεγαλύτερη διαφορά σε σχέση με την κρίση κρατικού χρέους της Ευρωζώνης του 2010-2012 την κάνει η ΕΚΤ. Τότε, δεν υπήρχε η χωρίς όρους δέσμευση της ΕΚΤ ότι θα «κάνει ό,τι χρειαστεί» για να στηρίξει το ευρώ. Μόλις έγινε αυτή η δέσμευση, στα μέσα του 2012, η κρίση τελείωσε. Ούτε υπήρχε τότε το  πρόγραμμα ΟΤΜ (Outright Monetary Transactions) απεριόριστων αγορών κρατικών ομολόγων της ΕΚΤ  ή το έμπειρο ταμείο διασώσεων (ο ESM) με διαθέσιμη δυνατότητα δανεισμού ύψους 410 δισ. ευρώ, έτοιμο να δανείσει φθηνά και ουσιαστικά χωρίς όρους. Είναι, ωστόσο, το γεγονός ότι  ο Νότος θα πρέπει να ανακάμψει από την ύφεση  με ένα πολύ μεγάλο χρέος, σε αντίθεση με τον Βορρά, που ανησυχεί τις αγορές και αξιωματούχους της Ευρωζώνης. Ο βασικός κίνδυνος είναι πολιτικός: για να μείνει ακέραιη, η Ευρωζώνη δεν πρέπει να επιτρέψει σε  εθνικιστικά  και  ευρωσκεπτικιστικά κόμματα  στον Νότο να κεφαλαιοποιήσουν τις δυσκολίες της ανάκαμψης με τεράστια επίπεδα χρέους και να παρακινήσουν την κοινή γνώμη κατά της ΕΕ, σημείωναν οικονομολόγοι. «Η ΕΚΤ μπορεί να αγοράσει πολλά ιταλικά ομόλογα αλλά δεν μπορεί να πείσει τις αγορές ότι η Ιταλία θέλει να παραμείνει στο ευρώ για πάντα», δήλωσε ο επικεφαλής οικονομολόγος της Berenberg Bank. «Ο χαμηλής πιθανότητας κίνδυνος ότι μία  μελλοντική ιταλική κυβέρνηση  μπορεί να θέλει να φύγει από το ευρώ παρακολουθείται από την αγορά. Δεν πρόκειται για λεπτομέρειες, αλλά για τον κίνδυνο μίας πολιτικής αντίδρασης», πρόσθεσε, η οποία θα μπορούσε να πάρει τη μορφή μίας  λαϊκής δυσφορίας στην Ιταλία  για τη σχετικά περιορισμένη ικανότητά της να αντιδράσει στην πανδημία σε σύγκριση με τη Γερμανία ή την Ολλανδία. Η άμεση  δημοσιονομική αντίδραση της Γερμανίας  στην πανδημία ήταν σχεδόν επτά φορές μεγαλύτερη από αυτή της Ιταλίας, όπου η κρίση ήταν δριμύτερη, δήλωσε ο πρόεδρος του Eurogroup  Μάριο Σεντένο , προσθέτοντας ότι ένας τέτοιος «κατακερματισμός» υπονομεύει την ενιαία αγορά και το ευρώ.  21 Photos: 21 Photos: 21 Photos: 21 Photos: 21 Photos: 21 Photos: 21 Photos: 21 Photos: 21 Photos: 21 Photos: 21 Photos: 21 Photos: 21 Photos: 21 Photos: 21 Photos: 21 Photos: 21 Photos: 21 Photos: 21 Photos: 21 Photos: 21 Photos: «Θα στοιχημάτιζα 100 ευρώ ότι η κρίση χρέους δεν θα επανέλθει στα επόμενα ένα ή δύο χρόνια», δήλωσε οικονομολόγος της ING, σημειώνοντας την πολύ ισχυρή πολιτική βούληση της Ευρωζώνης να αποφύγει μία τέτοια κρίση, όταν όλες οι οικονομίες της πλήττονται από την πανδημία. «Ωστόσο, θα στοιχημάτιζα πιθανόν άλλα 100 ευρώ ότι θα επανέλθει η υπαρξιακή κρίση της Ευρωζώνης. Σε κάποιο βαθμό, η  κρίση του  κορωνοϊού  την επιταχύνει. Θα επαναφέρει το θεμελιώδες ερώτημα για το ποια είναι η σωστή πολιτική και το πώς πρέπει να αντιμετωπιστεί το υψηλό δημόσιο χρέος», ανέφερε, προσθέτοντας: «Η τρέχουσα κρίση θα οδηγήσει σε νέα οικονομική απόκλιση μεταξύ του Βορρά και του Νότου. Ο Νότος θα πληγεί περισσότερο από την κρίση και ο Βορράς θα βγει ταχύτερα και ισχυρότερος από την κρίση». Το θέμα αυτό βρίσκεται στον πυρήνα των συζητήσεων που θα έχουν αύριο οι ηγέτες της ΕΕ σχετικά με το  πώς να διασφαλίσουν ίσες ευκαιρίες στις οικονομίες  για να ανακάμψουν, δεδομένων των διαφορετικών αφετηριών δημόσιου χρέους τους. Αυτό που διακυβεύεται είναι το μεγαλύτερο στοιχείο του ενεργητικού της ΕΕ - η ενιαία αγορά των 450 εκατομμυρίων καταναλωτών, η οποία δεν μπορεί να λειτουργεί καλά, αν οι διαφορές μεταξύ των χωρών είναι πολύ μεγάλες. «Υπάρχει κίνδυνος ότι η σημερινή κρίση θα οδηγήσει σε περαιτέρω  απόκλιση των θεμελιωδών μεγεθών  μεταξύ των χωρών της Ευρωζώνης», δήλωσε ο κορυφαίος οικονομικός σύμβουλος της  Morgan Stanley . Όπως είπε, οι λύσεις που έχουν υιοθετηθεί έως τώρα δεν έχουν καταφέρει να αντιμετωπίσουν το πρόβλημα της βιωσιμότητας του χρέους στις χώρες με υψηλό χρέος, όπως η Ιταλία, και του κατακερματισμού της Ευρωζώνης: των διαφορετικών ρυθμών ανάπτυξης, παραγωγικότητας, ανεργίας ή τραπεζικού δανεισμού. Για να αποτρέψει μία τέτοια απόκλιση, η ΕΕ ψάχνει ιδέες για να αποφύγει μία μεγάλη αύξηση του χρέους στον Νότο, αποφεύγοντας ταυτόχρονα μία αμοιβαιοποίηση του χρέους ή μεταβιβάσεις που δεν είναι αποδεκτές στο Βερολίνο, τη Χάγη, τη Βιέννη ή το Ελσίνκι. «Υπάρχει ασφαλώς ένας πολύ πραγματικός κίνδυνος σοβαρών πολιτικών εντάσεων μεταξύ του Βορρά και του Νότου, τόσο μεσοπρόθεσμα όσο και βραχυπρόθεσμα», δήλωσε υψηλόβαθμος αξιωματούχος της Ευρωζώνης. «Τα επίπεδα του χρέους είναι το κύριο θέμα εδώ, επειδή θα αυξηθούν αρκετά παντού, αλλά για τον Νότο η αύξηση θα είναι πιο σημαντική και έτσι θα περιορίσει το περιθώριο χειρισμών του για πολλά από τα επόμενα χρόνια», πρόσθεσε. Για να αποφευχθεί η διόγκωση του χρέους στον Νότο, ορισμένες χώρες, όπως η Ισπανία , ζητούν επιχορηγήσεις - χρήματα που θα δανεισθεί η ΕΕ ως σύνολο, αλλά στη συνέχεια θα μεταβιβασθούν σε όσους έχουν μεγαλύτερη ανάγκη, με τους τόκους των δανείων να εξυπηρετούνται μέσω, για παράδειγμα, ενός ευρωπαϊκού φόρου σε όσους ρυπαίνουν. «Αν έχουμε μία συμφωνία που θα δίνει μέρος της οικονομικής βοήθειας ως επιχορηγήσεις, αυτό θα καθιστούσε λιγότερο προβληματικό το θέμα του χρέους», σημείωσε ένας άλλος υψηλόβαθμος αξιωματούχος της Ευρωζώνης. Η ιδέα, όμως, των επιχορηγήσεων είναι το ίδιο προκλητική για κάποιους όσο και η αμοιβαιοποίηση του χρέους , ανέφεραν αξιωματούχοι. «Τέτοιες προτάσεις για μία ένωση μεταβιβαστικών πληρωμών δεν πρόκειται να προχωρήσουν, με ή χωρίς την κρίση του κορωνοϊού», είπε ο πρώτος αξιωματούχος, προσθέτοντας: «Και αυτό, φυσικά, θα στεναχωρήσει πολύ την Ιταλία, την Ισπανία, την Πορτογαλία και τη Γαλλία και τότε θα αυξηθούν και πάλι οι πολιτικές εντάσεις». Διαβάστε επίσης Ο Τσίπρας ζητάει την παραίτηση του Βρούτση για το «φιάσκο του Σκοιλ Ελικικου» Κορωνοϊός - Βεσυρόπουλος: Έρχεται ρύθμιση για φοιτητικά ενοίκια και ιδιοκτήτες ακινήτων Υπερπτήσεις τουρκικών μαχητικών πάνω από Οινούσσες και Παναγιά",https://www.cnn.gr/oikonomia/story/216391/analysi-reuters-o-koronoios-tha-dokimasei-tin-enotita-tis-eyrozonis
story,www.cnn.gr,Ξεκινά η 6η αξιολόγηση: «Αγκάθι» η προστασία της πρώτης κατοικίας ,"10:38 Τετάρτη, 22 Απριλίου 2020- ",,"Ξεκινά η  έκτη μεταμνημονιακή   αξιολόγηση  από τους θεσμούς στη σκιά της ύφεσης της   ελληνικής οικονομίας  λόγω της κρίσης της  πανδημίας . Τις προηγούμενες μέρες πραγματοποιήθηκαν  τηλεδιασκέψεις  των τεχνικών κλιμακίων με τα αντίστοιχα ελληνικά, ενώ στο τέλος εβδομάδας θα ξεκινήσουν οι διαβουλεύσεις με τους  επικεφαλής  των  θεσμών . Η παρούσα αξιολόγηση θα είναι διαφορετική από τις προηγούμενες, δεδομένων των  νέων συνθηκών  στην οικονομία που έχει δημιουργήσει η επέλαση του κορωνοιού. Στόχος του οικονομικού επιτελείου είναι μια θετική αξιολόγηση που θα  ξεκλειδώσει την δόση των 644 εκατ. ευρώ  από τα κέρδη των ελληνικών ομολόγων της Ευρωπαϊκής Κεντρικής Τράπεζας και των υπολοίπων τραπεζών του  ευρωσυστήματος  (ANFA’s, SMP’s). Μεγάλο « αγκάθι » στις συζητήσεις της ελληνικής πλευράς με τους  θεσμούς  παραμένει ο  νόμος Κατσέλη  για την προστασία της πρώτης κατοικίας, με τους δανειστές να παραμένουν αρνητικοί στην πρόταση της Αθήνας για παράταση της ισχύουσας πλατφόρμας μέχρι το τέλος του έτους. Μετά το « μπλόκο » των θεσμών στο συγκεκριμένο θέμα οι  συζητήσεις  μεταξύ των δύο πλευρών συνεχίζονται, με τον υπουργό Οικονομικών  Χρήστο Σταϊκούρα  να στέλνει μήνυμα σε  Φρανκφούρτη  και  Βρυξέλλες  πως δεν επιθυμεί η ελληνική κυβέρνηση δεν θα  κινηθεί μονομερώς . Για την προστασία της πρώτης κατοικίας και το νέο πτωχευτικό θα υπάρξει σήμερα τηλεδιάσκεψη με τα τεχνικά κλιμάκια και στο τέλος της εβδομάδας με τους  επικεφαλής  των  θεσμών . Αναφορικά με τις υπόλοιπες μεταρρυθμίσεις που είναι  συνδεμένες  με αυτή την  αξιολόγηση  (ιδιωτικοποιήσεις, εξίσωση αντικειμενικών με τις αγοραίες τιμές, αγορά ενέργειας, κα.) έχουν μπει στο « συρτάρι » και θα επανέλθουν όταν θα περάσει η κρίση του κορωνοϊού. Επομένως το « στοίχημα » για το οικονομικό επιτελείο είναι να βρεθεί η  χρυσή τομή  αναφορικά με τους πλειστηριασμούς και την πρόταση για αναστολή τους όσο διαρκεί η κρίση. Εάν υπάρξει συμφωνία των  θεσμών  για το συγκεκριμένο θέμα, τότε ουσιαστικά η 6η αξιολόγηση θα έχει ολοκληρωθεί με τον καλύτερο τρόπο και η έκθεση της  Ευρωπαϊκής Επιτροπής  που θα δημοσιοποιηθεί μέσα στο Μάιο αναμένεται να είναι θετική και να ανοίγει το δρόμο για την έγκριση της εκταμίευσης των κερδών από τα ομόλογα στο  Eurogroup της 11ης Ιουνίου. Διαβάστε επίσης Ανάλυση Reuters: Ο κορωνοϊός θα δοκιμάσει την ενότητα της Ευρωζώνης ΟΠΕΚΕΠΕ: Καταβλήθηκαν 3,7 εκατ. ευρώ σε δικαιούχους - Ποιοι πληρώθηκαν Η ΕΚΤ μπορεί να δεχτεί ως ενέχυρα ομόλογα-«σκουπίδια»",https://www.cnn.gr/oikonomia/story/216345/xekina-i-6i-axiologisi-agkathi-i-prostasia-tis-protis-katoikias
story,www.cnn.gr,Γ. Στουρνάρας: Διαχειρίσιμη η αύξηση των «κόκκινων» δανείων λόγω της κρίσης ,"07:23 Τετάρτη, 22 Απριλίου 2020- ",,"Αναπόφευκτη  χαρακτήρισε μια αύξηση των  « κόκκινων»   δανείων   λόγω της κρίσης που διανύουμε ο διοικητής της  Τράπεζας   της Ελλάδος , με τον οποίο επικοινώνησε το  CNN Greece , επισημαίνοντας ταυτόχρονα πως η κατάσταση που θα δημιουργηθεί θα είναι  διαχειρίσιμη . Επαναλαμβάνοντας  τα όσα είπε μιλώντας στην  ανοιχτή συζήτηση  που πραγματοποίησε το  Delphi Economic   Forum , ο κεντρικός τραπεζίτης, υποστήριξε πως ο πιο αποτελεσματικός τρόπος για να απαλλαγούν οι τράπεζες από τα κόκκινα δάνεια που θα δημιουργηθούν από την παρούσα οικονομική κρίση λόγω της πανδημίας, είναι η δημιουργία μιας  «bad   bank », με την μορφή μιας « Asset Management Company ». O κ.  Στουρνάρας  επισήμανε πως η δημιουργία μιας « bad bank » είναι μια παλιά καλή ιδέα ειδικά στην  παρούσα   φάση  που οι αγορές λειτουργούν. Με την αγορά των τιτλοποιήσεων να έχει παγώσει και τους επενδυτές να εμφανίζονται απρόθυμοι να αναλάβουν ρίσκο, ενισχύεται η παραπάνω ιδέα σύμφωνα με τον διοικητή της  ΤτΕ . Αν και σε  ευρωπαϊκό επίπεδο , η ιδέα μιας bad bank έχει  απορριφθεί , τα δεδομένα τώρα έχουν αλλάξει και οι τράπεζες θα πρέπει να λειτουργήσουν με διαφάνεια για να προσελκύσουν επενδυτικό ενδιαφέρον όταν επανέλθει η κανονικότητα στις  αγορές . Ο κεντρικός τραπεζίτης στην επικοινωνία που είχε μαζί του το  CNN Greece  εμφανίστηκε  συγκρατημένα   αισιόδοξος  αναφορικά με τις επιπτώσεις της κρίσης στην οικονομία, εκτιμώντας πως η ύφεση φέτος θα διαμορφωθεί στο - 4%. Μάλιστα, χαρακτήρισε  ακραία  τα  σενάρια  για  πτώση του ΑΕΠ κατά 10%. Όσον αφορά στον αντίκτυπο της κρίσης στις τράπεζες, ο κ. Στουρνάρας επεσήμανε πως  ξεκάθαρη εικόνα  θα υπάρξει με τη δημοσίευση των ισολογισμών για το  δεύτερο εξάμηνο του έτους.    Εν τω μεταξύ, στην ανοιχτή συζήτηση που πραγματοποίησε το Delphi Economic Forum κ, Στουρνάρας αναφέρθηκε μεταξύ άλλων και στην θετική  παρενέργεια  της  κρίσης , την επιτάχυνση της  ψηφιοποίησης  των  τραπεζών . Ανακοίνωσε, μάλιστα, ότι μέσα στις  επόμενες ημέρες , οι τράπεζες θα δίνουν τη δυνατότητα και  ανοίγματος   λογαριασμού  χωρίς  φυσική παρουσία του πελάτη στο κατάστημα.  Διαβάστε επίσης Κορωνοϊός - Στουρνάρας: Ύφεση 4% φέτος, πολύ μικρότερη των «ακραίων» σεναρίων Κορωνοϊός: Απορρίπτει η Κομισιόν την πρόταση για πανευρωπαϊκή «bad bank» Ανάλυση Reuters: Ο κορωνοϊός θα δοκιμάσει την ενότητα της Ευρωζώνης",https://www.cnn.gr/oikonomia/story/216319/g-stoyrnaras-diaxeirisimi-i-ayxisi-ton-kokkinon-daneion-logo-tis-krisis
story,www.cnn.gr,"Πρωτογενή πλεονάσματα 29,484 δισ. ευρώ κατέγραψε η Ελλάδα στο διάστημα 2016-2019 ","12:36 Τετάρτη, 22 Απριλίου 2020- ","Newsroom, CNN Greece","Στο 4,4% του ΑΕΠ ή στα 8,25 δισ. ευρώ διαμορφώθηκε το  πρωτογενές πλεόνασμα  του  κρατικού Προϋπολογισμού  το 2019, ξεπερνώντας κατά 1,7 δισ. ευρώ περίπου το στόχο του προγράμματος  ενισχυμένης εποπτείας  (3,5% του ΑΕΠ). H Ελληνική Στατιστική Αρχή (ΕΛΣΤΑΤ)  ανακοινώσε  σήμερα τα δημοσιονομικά στοιχεία των ετών 2016-2019, τα οποία καταρτίστηκαν στο πλαίσιο της πρώτης κοινοποίησης  Διαδικασίας Υπερβολικού Ελλείμματος  (ΔΥΕ) του 2020 και τα οποία υποβλήθηκαν ως εκπλήρωση των υποχρεώσεων της χώρας στην  Eurostat . Από αυτά προκύπτει πως το πλεόνασμα της  Γενικής   Κυβέρνησης  για το έτος 2019, σύμφωνα με το ESA 2010, ήταν στα 2,7 δισ. ευρώ (1,5% επί του Ακαθάριστου Εγχώριου Προϊόντος), το πρωτογενές πλεόνασμα στα 8,25 δισ. ευρώ ή στο 4,4% του ΑΕΠ και το ακαθάριστο χρέος της Γενικής Κυβέρνησης 331,1 δισ. ευρώ (176,6% επί του  ΑΕΠ ). Τα  αθροιστικά πρωτογενή   πλεονάσματα  της περιόδου 2016-2019 διαμορφώθηκαν σε 29,484 δισ. ευρώ. Το  πρωτογενές πλεόνασμα  ήταν στο 3,7% του ΑΕΠ το 2016, στο 3,8% το 2017, στο 4,3% το 2018 και στο 4,4% του ΑΕΠ το 2019. Το χρέος της γενικής κυβέρνησης από τα 315 δισ. ευρώ το 2016 ανήλθε στα 331 δισ. ευρώ το 2019, όταν το 2018 ήταν 334,7 δισ. ευρώ. Το  ΑΕΠ  αυξήθηκε μεταξύ 2016 και 2019 κατά 11 δισ. ευρώ  περίπου . Από τα 176,488 δισ. ευρώ το 2016, στα 180,218 δισ. ευρώ το 2017, στα 184,714 δισ. ευρώ το 2018 και στο 187,456 δισ. ευρώ το 2019. Διαβάστε επίσης Κορωνοϊός: Σε αναστολή λειτουργίας 205.984 επιχειρήσεις σε όλη την Ελλάδα Ανάλυση Reuters: Ο κορωνοϊός θα δοκιμάσει την ενότητα της Ευρωζώνης ΟΠΕΚΕΠΕ: Καταβλήθηκαν 3,7 εκατ. ευρώ σε δικαιούχους - Ποιοι πληρώθηκαν",https://www.cnn.gr/oikonomia/story/216366/protogeni-pleonasmata-29-484-dis-eyro-kategrapse-i-ellada-sto-diastima-2016-2019
