subtopic,website,title,date,author,text,url
agores,www.cnn.gr,Χρηματιστήριο: Άνοδος στη σημερινή συνεδρίαση ,"19:25 Δευτέρα, 26 Νοεμβρίου 2018","Newsroom, CNN Greece","Σε  ελαφρώς υψηλότερα επίπεδα  έκλεισε η χρηματιστηριακή αγορά στη συνεδρίαση της Δευτέρας, καθώς δεν κατόρθωσε να διατηρήσει τα αρχικά της υψηλά (+2,72)% στα οποία την είχε ωθήσει το  deal της Eurobank με την Grivalia Properties. Η Eurobank ανακοίνωσε ότι θα συγχωνευτεί, δια της απορροφήσεως, με την Grivalia, φέρνοντας με αυτόν τον τρόπο την υλοποίηση του πλάνου μείωσης των NPEs της Eurobank από τα τέλη του 2021 στα τέλη του 2019 και ανοίγοντας τον δρόμο για μονοψήφιο ποσοστό NPEs νωρίτερα από την τριετία. Η εξέλιξη αυτή έδωσε την αφορμή να κινηθεί ο τραπεζικός κλάδος έντονα ανοδικά και η Eurobank κατέγραψε ενδοσυνεδριακά κέρδη έως και 24,89%. Στη συνέχεια όμως υποχώρησε ο αρχικός ενθουσιασμός και επανήλθαν οι πωλητές στις τραπεζικές μετοχές, καθώς υπάρχει έντονη η ανησυχία για εκροές άνω των 100 εκατ. ευρώ από τις τράπεζες λόγω των αλλαγών στο δείκτη MSCI Greece (εξέρχονται η Εθνική, Πειραιώς και Eurobank), αλλαγές που θα πραγματοποιηθούν στις 30 Νοεμβρίου. O Γενικός Δείκτης Τιμών έκλεισε τελικά στις 603,43 μονάδες , σημειώνοντας άνοδο 0,14%. Ενδοσυνεδριακά κατέγραψε υψηλότερη τιμή στις 618,97 μονάδες (+2,72%). Η αξία των συναλλαγών ανήλθε στα 66,620 εκατ. ευρώ, ενώ διακινήθηκαν 64.278.229 μετοχές. Ο  δείκτης υψηλής κεφαλαιοποίησης  σημείωσε άνοδο σε ποσοστό 0,25%, ενώ ο δείκτης της μεσαίας κεφαλαιοποίησης υποχώρησε σε ποσοστό 0,72%. Από τις  μετοχές της υψηλής κεφαλαιοποίησης , άνοδο κατέγραψαν οι μετοχές της Grivalia Properties (+6,28% στα 7,620 ευρώ), της Eurobank (+4,31% στα 0,4886 ευρώ), του ΟΛΠ (+2,38% στα 15,460 ευρώ), της Πειραιώς (+1,98% στα 0,980 ευρώ) και του ΟΠΑΠ (+1,24% στα 8,150 ευρώ). Αντιθέτως, τη  μεγαλύτερη πτώση  σημείωσαν οι μετοχές της ΔΕΗ (-3,54% στα 1,200 ευρώ), της Εθνικής (-3,05% στα 1,0180 ευρώ), της Fourlis (-2,02% στα 4,370 ευρώ), της Alpha Bank (-1,67% στα 1,200 ευρώ) και της Τιτάν (-1,22% στα 19,500 ευρώ). Από τους επιμέρους δείκτες, τη μεγαλύτερη άνοδο σημείωσαν οι δείκτες της Ακίνητης Περιουσίας (+4,56%) και των Πρώτων Υλών (+2,92%), ενώ τις μεγαλύτερες απώλειες σημείωσαν οι δείκτες των Κατασκευών (-1,335) και των Υπηρεσιών Κοινής Ωφέλειας (-0,69%). Τον  μεγαλύτερο όγκο συναλλαγών  παρουσίασαν η Eurobank και η Alpha Bank διακινώντας 46.913.950 και 4.006.162 μετοχές, αντιστοίχως. Τη μεγαλύτερη αξία συναλλαγών σημείωσαν η Eurobank με 24,162 εκατ. ευρώ και η Grivalia Properties με 15,105 εκατ. ευρώ. Ανοδικά κινήθηκαν 65 μετοχές, 40 πτωτικά και 29 παρέμειναν σταθερές. Τη μεγαλύτερη άνοδο σημείωσαν οι μετοχές: ΑΕΓΕΚ +18,37%, Προοδευτική +14,42%, Τζιρακιάν+11,93% και Αλουμύλ+10,22%. Τη μεγαλύτερη πτώση κατέγραψαν οι μετοχές: Frigoglass-10,00%, Μοτοδυναμική-8,62%, Νηρεύς-4,32% και ΔΕΗ -3,54%. Οι μετοχές του δείκτη υψηλής κεφαλαιοποίησης έκλεισαν, ως εξής: Διαβάστε επίσης Σε ιστορικά χαμηλά οι αποδόσεις των ελληνικών ομολόγων - Στο 0,295% το πενταετές",https://www.cnn.gr/oikonomia/agores/story/156092/xrimatistirio-anodos-sti-simerini-synedriasi
agores,www.cnn.gr,Χρηματιστήριο: Με άνοδο έκλεισε η σημερινή συνεδρίαση,"19:32 Πέμπτη, 29 Νοεμβρίου 2018","Newsroom, CNN Greece","Έντονες ανοδικές τάσεις  επικράτησαν στη σημερινή συνεδρίαση του  χρηματιστηρίου   με μοχλό το  επενδυτικό ενδιαφέρον  για τις  τραπεζικές μετοχές , στον απόηχο της θετικής έκθεση της  Moodys   για το σχέδιο της ΤτΕ για την αντιμετώπιση των  κόκκινων δανείων . O  Γενικός Δείκτης Τιμών  έκλεισε στις 618,16 μονάδες, σημειώνοντας άνοδο 2,50%. Η  αξία των συναλλαγών  ανήλθε στα 62,035 εκατ. ευρώ, ενώ διακινήθηκαν 49.033.800 μετοχές. Ο  δείκτης υψηλής κεφαλαιοποίησης  σημείωσε άνοδο σε ποσοστό 2,20%, ενώ ο δείκτης της μεσαίας κεφαλαιοποίησης ενισχύθηκε σε ποσοστό 2,75%. Από τις  μετοχές της υψηλής κεφαλαιοποίησης , τη μεγαλύτερη άνοδο κατέγραψαν οι μετοχές της Eurobank (+13,03%), της Grivalia Properties (+11,07%), της Μυτιληναίος (+8,21%) και της Alpha Bank (+7,59%). Αντιθέτως, τη  μεγαλύτερη πτώση  σημείωσαν οι μετοχές της Motor Oil (-0,49%) και της Τιτάν (-0,41%). Από τους  επιμέρους δείκτες  τη μεγαλύτερη άνοδο σημείωσαν οι δείκτες των Τραπεζών (+8,10%) και των Χρηματοοικονομικών Υπηρεσιών (+6,12%), ενώ τις μεγαλύτερες απώλειες σημείωσαν οι δείκτες των Πρώτων Υλών (-3,02%) και της Υγείας (-1,65%). Τον  μεγαλύτερο όγκο συναλλαγών  παρουσίασαν η Eurobank και η Εθνική με 26.854.153 και 7.749.966 μετοχές, αντιστοίχως. Τη  μεγαλύτερη αξία συναλλαγών  σημείωσαν η Εurobank με 14,579 εκατ. Ευρώ και η Εθνική με 7,645 εκατ. Ευρώ. Ανοδικά  κινήθηκαν 72 μετοχές, 38 πτωτικά και 21 παρέμειναν σταθερές. Τη  μεγαλύτερη άνοδο  σημείωσαν οι μετοχές: Fieratex +29,21% και Τζιαρκιάν +28,92%, ενώ τη μεγαλύτερη πτώση κατέγραψαν οι μετοχές: REDS -9,68% και Μedicon -5,83%. Οι  μετοχές του δείκτη υψηλής κεφαλαιοποίησης  έκλεισαν, ως εξής: Διαβάστε επίσης Σε ιστορικά χαμηλά οι αποδόσεις των ελληνικών ομολόγων - Στο 0,295% το πενταετές",https://www.cnn.gr/oikonomia/agores/story/156477/xrimatistirio-me-anodo-ekleise-i-simerini-synedriasi
story,www.cnn.gr,Θεοχάρης: Σε τουριστική περίοδο τριών μηνών βαδίζει ο ελληνικός τουρισμός ,"13:05 Τρίτη, 21 Απριλίου 2020","Newsroom, CNN Greece","Σε τουριστική περίοδο  3 μηνών  φαίνεται πως βαδίζει ο ελληνικός τουρισμός, όπως τόνισε σε τηλεοπτική του παρέμβαση στο Σκάι, ο υπουργός Τουρισμού,  Χάρης Θεοχάρης , επισημαίνοντας ότι ο Ιούλιος, ο Αύγουστος και ο Σεπτέμβριος, θα σηκώσουν το βάρος της τουριστικής χρονιάς φέτος. Βέβαια, συμπλήρωσε ότι υπάρχουν βάσιμες ενδείξεις και για επέκταση της περιόδου τον Οκτώβριο και το Νοέμβριο. Προϋπόθεση των παραπάνω είναι φυσικά να μην υπάρξουν απρόοπτες εξελίξεις στο μέτωπο του  κορωνοϊού . Το μεγάλο, ωστόσο, στοίχημα της εξέλιξης της τουριστικής χρονιάς είναι η ασφαλής  είσοδος και έξοδος  των επισκεπτών μας στην Ελλάδα και για το λόγο αυτό προωθείται το  «υγειονομικό διαβατήριο» , όπως ανάφερε ο υπουργός, προκειμένου να περιγράψει μια μεθοδολογία «ασφαλούς εισόδου», όπως είπε. Προς την κατεύθυνση αυτή, ο κ. Θεοχάρης ανάφερε ότι γίνεται διαβούλευση στην ΕΕ προκειμένου σε κάθε ευρωπαίο πολίτη που θα θέλει να ταξιδεύσει να του γίνεται ένα  αξιόπιστο τεστ  για την  ανίχνευση  του κορωνοϊού. Μάλιστα, εξήγησε ότι αυτό θα πρέπει να γίνεται στη χώρα εκκίνησης των διακοπών. Αν, για παράδειγμα, πρόκειται για έναν Γερμανό επισκέπτη, αυτό το τεστ θα γίνεται στη Γερμανία προτού έλθει στην Ελλάδα. Στην Ελλάδα, τον πρώτο λόγο στο μέτωπο των τεστ θα έχει ο  ΕΟΔΥ , όπως αναφέρθηκε. Ο υπουργός, αφού ανάφερε ότι ένα από τα μοντέλα πρόβλεψης της εξέλιξης της τουριστικής χρονιάς φέτος κάνει λόγο και για  πτώση κατά 50% , συμπλήρωσε ότι οι ελεύσεις τουριστών από χώρες πέραν της Ευρώπης δεν αναμένονται στην Ελλάδα. Στον αντίποδα, η  Ελλάδα  διατηρεί το πλεονέκτημα της ασφαλούς υγειονομικής χώρας στη Μεσόγειο, στοιχείο ιδιαίτερα θετικό, υπό το πρίσμα των «νέων πραγμάτων». Ο κ. Θεοχάρης ανάφερε ότι ο ίδιος βρίσκεται σε συνεχή επικοινωνία με τους μεγάλους διοργανωτές ταξιδίων (Tour Operators) του εξωτερικού, οι οποίοι εκφράζουν το  έντονο ενδιαφέρον  τους για την  Ελλάδα  και περιμένουν πως θα ξεδιπλωθούν τα μέτρα υγειονομικής προστασίας σε ξενοδοχεία κλπ. Τέλος, στο μέτωπο του  εγχώριου τουρισμού  επισήμανε ότι έχει εισηγηθεί στο οικονομικό επιτελείο κίνητρα για ενίσχυσή του. Διαβάστε επίσης Ανάλυση Reuters: Ο κορωνοϊός θα δοκιμάσει την ενότητα της Ευρωζώνης Ο Τσίπρας ζητάει την παραίτηση του Βρούτση για το «φιάσκο του Σκοιλ Ελικικου» Κορωνοϊός - Βεσυρόπουλος: Έρχεται ρύθμιση για φοιτητικά ενοίκια και ιδιοκτήτες ακινήτων",https://www.cnn.gr/oikonomia/story/216194/theoxaris-se-toyristiki-periodo-3-minon-vadizei-o-ellinikos-toyrismos
story,www.cnn.gr,Κορωνοϊός: H διαδικασία καταβολής των 600 ευρώ στους επιστήμονες,"19:50 Τετάρτη, 15 Απριλίου 2020",,"Τη διαδικασία πληρωμής των ωφελουμένων και των παρόχων κατάρτισης της πρόσκλησης εκδήλωσης ενδιαφέροντος, με αρ. πρωτ. 286/2.4.2020, για τη συμμετοχή στη δράση « ειδικό πρόγραμμα τηλεκατάρτισης με πιστοποίηση για επιστήμονες  πληττόμενους από τον covid-19, που εντάσσονται στους έξι βασικούς επιστημονικούς κλάδους της χώρας, βάσει Κωδικών Αριθμών Δραστηριότητας (ΚΑΔ), οριζομένων από το υπουργείο Οικονομικών», καθορίζει η  Κοινή Υπουργική Απόφαση (ΚΥΑ) , την οποία υπογράφουν ο υπουργός Οικονομικών,  Χρήστος Σταϊκούρας , ο υπουργός Ανάπτυξης και Επενδύσεων 'Αδωνις Γεωργιάδης, ο υπουργός Εργασίας και Κοινωνικών Υποθέσεων  Γιάννης Βρούτσης  και ο υφυπουργός Ανάπτυξης και Επενδύσεων  Ιωάννης Τσακίρης . Όροι και διαδικασία πληρωμής ωφελουμένων Η καταβολή του εκπαιδευτικού επιδόματος στους ωφελούμενους γίνεται, ως εξής: Το εκπαιδευτικό επίδομα είναι αξίας 600 ευρώ (100 ώρες x 6 ευρώ ανά ώρα κατάρτισης) και καταβάλλεται σε δύο δόσεις, ως ακολούθως: Α. Αμέσως μετά την ενεργοποίηση της επιταγής κατάρτισης, καταβάλλεται προκαταβολή εκπαιδευτικού επιδόματος, ύψους 400 ευρώ. Συγκεκριμένα: www.elearning.yeka.gr www.elearning.yeka.gr www.elearning.yeka.gr Β. Μετά την ολοκλήρωση του προγράμματος κατάρτισης, καταβάλλεται η δεύτερη δόση του εκπαιδευτικού επιδόματος, ύψους 200 ευρώ, ως εξής: www.elearning.yeka.gr www.elearning.yeka.gr Το επίδομα θα καταβάλλεται στον τραπεζικό λογαριασμό που κάθε καταρτιζόμενος έχει δηλώσει κατά την αίτηση συμμετοχής στο Μητρώο με ευθύνη του και στην οποία θα πρέπει να αναφέρεται ως δικαιούχος. Το επίδομα κατάρτισης είναι αφορολόγητο, ακατάσχετο και μη συμψηφιστέο. Σύμφωνα με την ΚΥΑ, οι ωφελούμενοι ουδεμία άλλη απαίτηση έχουν από την ΕΥ ΕΔ ΕΣΠΑ ΥΠΕΚΥΠ και το υπουργείο Εργασίας και Κοινωνικών Υποθέσεων, πέραν του ποσού που θα πιστωθεί στους τραπεζικούς λογαριασμούς τους. Η καταβολή στους παρόχους κατάρτισης του αντιτίμου των επιταγών κατάρτισης για τις υπηρεσίες κατάρτισης και πιστοποίησης γίνεται, ως εξής: Το ποσό που αντιστοιχεί στην πληρωμή κάθε επιταγής κατάρτισης είναι έως 470 ευρώ (420 ευρώ για την κατάρτιση και έως 50 ευρώ για την πιστοποίηση), το οποίο καταβάλλεται σε τρεις δόσεις, ως εξής: 1.  Ποσό, ύψους 20 ευρώ , ανά ωφελούμενο καταβάλλεται με την ενεργοποίηση της επιταγής κατάρτισης (α' δόση). 2.  Ποσό, ύψους 400 ευρώ , ανά ωφελούμενο καταβάλλεται με την ολοκλήρωση του προγράμματος κατάρτισης.Στην περίπτωση που ο ωφελούμενος δεν ολοκληρώσει το πρόγραμμα κατάρτισης, το ποσό της αμοιβής του παρόχου μειώνεται αναλογικά ως προς τις ώρες που δεν υλοποιήθηκαν (β΄ δόση). 3.  Ποσό, ύψους έως 50 ευρώ , ανά ωφελούμενο καταβάλλεται με την ολοκλήρωση της διαδικασίας πιστοποίησης (γ΄ δόση). Διαβάστε επίσης Κορωνοϊός: Πώς θα καταβληθούν τα 600 ευρώ στους επιστήμονες Κορωνοϊός: Πώς θα καταβληθούν τα 600 ευρώ στους επιστήμονες Ανάλυση Reuters: Ο κορωνοϊός θα δοκιμάσει την ενότητα της Ευρωζώνης",https://www.cnn.gr/oikonomia/story/215519/koronoios-h-diadikasia-katavolis-ton-600-eyro-stoys-epistimones
agores,www.cnn.gr,Χρηματιστήριο: Με πτώση έκλεισε η σημερινή συνεδρίαση,"20:10 Τετάρτη, 12 Σεπτεμβρίου 2018","Newsroom, CNN Greece","Σε  ελαφρώς χαμηλότερα επίπεδα  έκλεισε η  χρηματιστηριακή αγορά  στη σημερινή συνεδρίαση, καθώς οι τιμές των μετοχών δεν κατόρθωσαν να διατηρήσουν τα ενδοσυνεδριακά τους κέρδη τα οποία ξεπερνούσαν το 1,40%. Στο επίκεντρο των ρευστοποιήσεων βρέθηκαν και σήμερα οι  τραπεζικές μετοχές. O  Γενικός Δείκτης Τιμών  έκλεισε στις 690,27 μονάδες, σημειώνοντας πτώση 0,26%. Η  αξία των συναλλαγών  ανήλθε στα 43,083 εκατ. ευρώ, ενώ διακινήθηκαν 20.767.987 μετοχές. Ο  δείκτης υψηλής κεφαλαιοποίησης  σημείωσε πτώση σε ποσοστό 0,20%, ενώ ο δείκτης της μεσαίας κεφαλαιοποίησης υποχώρησε σε ποσοστό 0,91%. Από τις  μετοχές της υψηλής κεφαλαιοποίησης , τη μεγαλύτερη άνοδο κατέγραψαν οι μετοχές της Fourlis (+2,78%), της Viohalco(+2,77%) και της Grivalia Properties(+2,33%). Αντιθέτως, τη  μεγαλύτερη πτώση  σημείωσαν οι μετοχές της Eurobank(-4,48%), της ΔΕΗ (-2,65%) και της Motor Oil(-2,65%). Από τους  επιμέρους δείκτες  τη μεγαλύτερη άνοδο σημείωσαν οι δείκτες της Ακίνητης Περιουσίας+1,67% και των Τηλεπικοινωνιών +1,21%, ενώ τις μεγαλύτερες απώλειες σημείωσαν οι δείκτες Των  Τραπεζών  -2,39% και των  Πρώτων Υλών  -1,90%. Τον μεγαλύτερο όγκο  συναλλαγών παρουσίασαν η Eurobank και η Alpha Bank διακινώντας 7.463.581 και 3.539.780 μετοχές αντιστοίχως. Τη  μεγαλύτερη αξία  συναλλαγών σημείωσαν η Εθνική με 5,679 εκατ. Ευρώ και η Eurobank με 4,877 εκατ. Ευρώ. Ανοδικά  κινήθηκαν 44 μετοχές, 60 πτωτικά και 27 παρέμειναν σταθερές. Τη  μεγαλύτερη άνοδο  σημείωσαν οι μετοχές: Εκδόσεις Λιβάνη +19,74% και Sato+17,46%. Τη  μεγαλύτερη πτώση  κατέγραψαν οι μετοχές: ΑΝΕΚ(πο)-20,00% και Pasal-19,10%. Οι  μετοχές του δείκτη υψηλής κεφαλαιοποίησης  έκλεισαν, ως εξής: Διαβάστε επίσης Σε ιστορικά χαμηλά οι αποδόσεις των ελληνικών ομολόγων - Στο 0,295% το πενταετές",https://www.cnn.gr/oikonomia/agores/story/146509/xrimatistirio-me-ptosi-ekleise-i-simerini-synedriasi
agores,www.cnn.gr,Χρηματιστήριο: Ισχυρές πιέσεις στις τραπεζικές μετοχές ,"18:58 Πέμπτη, 13 Σεπτεμβρίου 2018","Newsroom, CNN Greece","Νέες ισχυρές πιέσεις δέχθηκαν οι τραπεζικές μετοχές οδηγώντας τη  χρηματιστηριακή αγορά   σε νέα πτώση, υποχωρώντας κάτω από τα επίπεδα των 680 μονάδων. O Γενικός Δείκτης Τιμών έκλεισε στις 678,83 μονάδες , σημειώνοντας πτώση 1,66 %. Η αξία των συναλλαγών ανήλθε στα 68,375 εκατ. ευρώ, ενώ διακινήθηκαν 36,625.105 μετοχές. Ο δείκτης υψηλής κεφαλαιοποίησης σημείωσε πτώση σε ποσοστό 1,39%%, ενώ ο δείκτης της μεσαίας κεφαλαιοποίησης υποχώρησε σε ποσοστό 1,31%. Από τις  μετοχές της υψηλής κεφαλαιοποίησης , τη μεγαλύτερη άνοδο κατέγραψαν οι μετοχές της Coca Cola (+0,84% ), της Motor Oil (+0,74%) και της Μυτιληναίος (+0,71%). Αντιθέτως, τη μεγαλύτερη πτώση σημείωσαν οι μετοχές της Eurobank -7,03%, της Alpha Bank -6,51%,της Πειραιώς -6,47% και της Εθνικής -5,89%. Από τους επιμέρους δείκτες τη μεγαλύτερη άνοδο σημείωσε ο δείκτης των Τροφίμων +0,84%, ενώ τις μεγαλύτερες απώλειες σημείωσαν οι δείκτες των Τραπεζών -6,65% και των ΠρώτωνΥλών -2,19%, Τον μ εγαλύτερο όγκο συναλλαγών  παρουσίασαν η Eurobank και η Alpha διακινώντας 10.566.373 και 8.341.555 μετοχές, αντιστοίχως. Τη μεγαλύτερη αξία συναλλαγών σημείωσαν η Alpha Bank με 10,48 εκατ. ευρώ και η Εθνική με 8,831 εκατ. ευρώ. Ανοδικά κινήθηκαν 39 μετοχές, 70 πτωτικά και 16 παρέμειναν σταθερές. Τη μεγαλύτερη άνοδο σημείωσαν οι μετοχές: Δομική Κρήτης +19,64% και Γ.Ε.Δημητρίου +18,18%. Τη μεγαλύτερη πτώση κατέγραψαν οι μετοχές: Aκρίτας -19,14% και Μπουτάρης -19,05%. Οι μετοχές του δείκτη υψηλής κεφαλαιοποίησης έκλεισαν, ως εξής: Διαβάστε επίσης Σε ιστορικά χαμηλά οι αποδόσεις των ελληνικών ομολόγων - Στο 0,295% το πενταετές",https://www.cnn.gr/oikonomia/agores/story/146647/xrimatistirio-isxyres-pieseis-stis-trapezikes-metoxes
