subtopic,website,title,date,author,text,url
agores,www.cnn.gr,Χρηματιστήριο: Πτώση για έκτη συνεχή συνεδρίαση,"18:37 Τρίτη, 11 Δεκεμβρίου 2018","Newsroom, CNN Greece","Με ήπια πτώση έκλεισε η  χρηματιστηριακή  αγορά,  καθώς δεν απέδωσε η ενδοσυνεδριακή προσπάθεια ανάκαμψης των τιμών των μετοχών, κλείνοντας σε πτωτική τροχιά για έκτη συνεχή συνεδρίαση. O Γενικός Δείκτης Τιμών έκλεισε στις 635,84 μονάδες, σημειώνοντας ήπια πτώση 0,37%. Ενδοσυνεδριακά κατέγραψε υψηλότερη τιμή στις 642,37 μονάδες (+0,65%). Η αγορά έκλεισε με αρνητικό πρόσημο για έκτη συνεδρίαση, με τον βασικό δείκτη να καταγράφει συνολικές απώλειες 3,62%. Η αξία των συναλλαγών ανήλθε στα 45,442 εκατ. ευρώ, ενώ διακινήθηκαν 14.440.554 μετοχές. Ο δείκτης υψηλής κεφαλαιοποίησης σημείωσε πτώση σε ποσοστό 0,41%, ενώ ο δείκτης της μεσαίας κεφαλαιοποίησης ενισχύθηκε σε ποσοστό 0,66%. Από τις μετοχές της υψηλής κεφαλαιοποίησης, άνοδο κατέγραψαν οι μετοχές της Πειραιώς (+2,94% στα 0,9450 ευρώ), της ΕΧΑΕ(+1,52% στα 4,000 ευρώ), της Viohalco(+0,75% στα 2,670 ευρώ) και της Εθνικής (+0,54% στα 1,1270 ευρώ). Αντιθέτως, τη μεγαλύτερη πτώση σημείωσαν οι μετοχές της Motor Oil(-2,66% στα 20,100 ευρώ), του ΟΠΑΠ (-2,24% στα 8,310 ευρώ), της ΓΕΚ ΤΕΡΝΑ (-2,21% στα 4,430 ευρώ) και της Alpha Bank(-1,60% στα 1,2300 ευρώ). Από τους επιμέρους δείκτες, τη μεγαλύτερη άνοδο σημείωσαν οι δείκτες των Χρηματοοικονομικών Υπηρεσιών (+1,43%) και της Υγείας (+1,14%), ενώ τις μεγαλύτερες απώλειες σημείωσαν οι δείκτες του Πετρελαίου (-1,98%) και των Ταξιδιών (-1,94%). Τον μεγαλύτερο όγκο συναλλαγών παρουσίασαν η Eurobank και η Grivalia Properties διακινώντας 3.543.335 και 2.315.460 μετοχές, αντιστοίχως. Τη μεγαλύτερη αξία συναλλαγών σημείωσαν η Grivalia Properties με 19,681 εκατ. ευρώ και ο ΟΤΕ με 3,393 εκατ. ευρώ. Ανοδικά κινήθηκαν 40 μετοχές, 44 πτωτικά και 39 παρέμειναν σταθερές. Τη μεγαλύτερη άνοδο σημείωσαν οι μετοχές: Χαϊδεμένος+9,44%, Τζιρακιάν Προφίλ+7,14%, Αλουμύλ+4,18% και Λεβεντέρης(π) +4,17%. Τη μεγαλύτερη πτώση κατέγραψαν οι μετοχές: Forthnet -20,00%, Μπήτρος Συμμετοχών-18,67%, ΑΝΕΚ -13,33% και Fieratex-12,84%. Οι μετοχές του δείκτη υψηλής κεφαλαιοποίησης έκλεισαν, ως εξής: ALPHA BANK:1,2300 ευρώ(-1,60%) EUROBANK:0,5145 ευρώ(+0,10%) FOURLIS:4,580 ευρώ(+0,33%) VIOHALCO:2,670 ευρώ(+0,75%) ΓΕΚ ΤΕΡΝΑ:4,300 ευρώ(-2,21%) ΕΥΔΑΠ:5,0700 ευρώ(αμετάβλητη) ΔΕΗ:1,3440 ευρώ(+0,30%) ΑΔΜΗΕ:1,5900 ευρώ(+0,25%) COCA COLA HBC:26,500 ευρώ(+0,38%) ΕΛΠΕ:7,6300 ευρώ(-0,26%) ΕΘΝΙΚΗ:1,1270 ευρώ(+0,54%) ΣΑΡΑΝΤΗΣ:6,8000 ευρώ(-0,29%) JUMBO: 13,5400 ευρώ(-0,15%) ΤΕΡΝΑ ΕΝΕΡΓΕΙΑΚΗ:6,0400 ευρώ(-0,17%) ΜΥΤΙΛΗΝΑΙΟΣ:7,7500 ευρώ(-1,02%) MOTOR OIL:20,100 ευρώ(-2,66%) ΟΠΑΠ:8,310 ευρώ(-2,24%) ΟΤΕ:10,680 ευρώ(-0,09%) ΠΕΙΡΑΙΩΣ:0,9450 ευρώ(+2,94%) ΤΙΤΑΝ:19,4600 ευρώ(-0,41%) LAMDA DEVELOPMENT:6,0900 ευρώ(+0,33%) ΟΛΠ:15,400 ευρώ(αμετάβλητη) ΕΧΑΕ:4,000 ευρώ(+1,52%) GRIVALIA PROPERTIES:8,5000 ευρώ(+0,47%) AEGEAN AIRLINES: 7,5600 ευρώ(αμετάβλητη) Διαβάστε επίσης Σε ιστορικά χαμηλά οι αποδόσεις των ελληνικών ομολόγων - Στο 0,295% το πενταετές",https://www.cnn.gr/oikonomia/agores/story/157897/xrimatistirio-me-ipia-ptosi-ekleise-i-agora
story,www.cnn.gr,"ΟΠΕΚΕΠΕ: Καταβλήθηκαν 3,7 εκατ. σε 9.585 δικαιούχους - Πότε θα καταβληθούν τα επιδόματα από ΟΠΕΚΑ","14:03 Πέμπτη, 16 Απριλίου 2020","Newsroom, CNN Greece","Το ποσό των  3,7 εκατ. ευρώ  κατέβαλε ο Οργανισμός Πληρωμών και Ελέγχου Κοινοτικών Ενισχύσεων Προσανατολισμού και Εγγυήσεων σε 9.585 δικαιούχους. Συγκεκριμένα, από τις 14/04/2020 έως τις 15/04/2020 ο  ΟΠΕΚΕΠΕ  πλήρωσε συνολικά 3.714.952,40 ευρώ. Μεταξύ άλλων, οι πιστώσεις αφορούν το ΚΟΜΦΟΥΖΙΟ και την πρόωρη συνταξιοδότηση. Στις 13/04/2020 ο ΟΠΕΚΕΠΕ πραγματοποίησε πληρωμές ύψους 79.202.295,74 ευρώ,ενώ από τις 09/04/2020 έως τις 10/04/2020 ο οργανισμός πραγματοποίησε πληρωμές ύψους 1.899.074,92 ευρώ. Την Πέμπτη 30 Απριλίου, θα καταβληθούν από τον Οργανισμό Προνοιακών Επιδομάτων και Κοινωνικής Αλληλεγγύης ( ΟΠΕΚΑ ) τα παρακάτω  επιδόματα και παροχές:  επίδομα γέννησης, προνοιακά αναπηρικά και διατροφικά επιδόματα, Ελάχιστο Εγγυημένο Εισόδημα (πρώην ΚΕΑ), επίδομα στέγασης, στεγαστική συνδρομή, Επίδομα Κοινωνικής Αλληλεγγύης Ανασφάλιστων Υπερηλίκων, σύνταξη υπερηλίκων και επίδομα ομογενών, όπως ανακοίνωσε η διοίκηση του Οργανισμού. Διευκρινίζεται ότι η καταβολή του επιδόματος γέννησης αφορά στους δικαιούχους, των οποίων οι αιτήσεις εγκρίθηκαν έως τις 31 Μαρτίου 2020. Για το επίδομα παιδιού, η 2η δόση θα καταβληθεί στις 29 Μαΐου. Τέλος, υπενθυμίζεταιότι η καταβολή των επιδομάτων, παροχών, οικονομικών και εισοδηματικών ενισχύσεων του ΟΠΕΚΑ, θα πραγματοποιείται την τελευταία εργάσιμη ημέρα του μήνα. Διαβάστε επίσης ΟΠΕΚΕΠΕ: Καταβλήθηκαν 3,7 εκατ. ευρώ σε δικαιούχους - Ποιοι πληρώθηκαν Ανάλυση Reuters: Ο κορωνοϊός θα δοκιμάσει την ενότητα της Ευρωζώνης Η ΕΚΤ μπορεί να δεχτεί ως ενέχυρα ομόλογα-«σκουπίδια»",https://www.cnn.gr/oikonomia/story/215614/opekepe-katavlithikan-3-7-ekat-se-9-585-dikaioyxoys-pote-tha-katavlithoyn-ta-epidomata-apo-opeka
agores,www.cnn.gr,Χρηματιστήριο: Με ήπια άνοδο έκλεισε η τελευταία συνεδρίαση του μήνα,"18:23 Τετάρτη, 31 Οκτωβρίου 2018","Newsroom, CNN Greece","Με  ήπια άνοδο  έκλεισε η  χρηματιστηριακή αγορά  στην τελευταία συνεδρίαση του Οκτωβρίου, ο οποίος έκλεισε με  σημαντικές απώλειες 7,45% . O  Γενικός Δείκτης Τιμών  έκλεισε στις 640,15 μονάδες, σημειώνοντας ήπια άνοδο 0,55%. Ενδοσυνεδριακά κατέγραψε  υψηλότερη τιμή  στις 643,05 μονάδες (+1,01%) και κατώτερη τιμή στις 635,36 μονάδες (-0,20%). Η  αξία των συναλλαγών  παρουσιάσθηκε αυξημένη και ανήλθε στα 66,115 εκατ. ευρώ, ενώ διακινήθηκαν 30.506.964 μετοχές. Ο  δείκτης υψηλής κεφαλαιοποίησης  σημείωσε άνοδο σε ποσοστό 0,94%, ενώ ο δείκτης της μεσαίας κεφαλαιοποίησης υποχώρησε σε ποσοστό 0,14%. Από τις  μετοχές της υψηλής κεφαλαιοποίησης , τη μεγαλύτερο άνοδο κατέγραψαν οι μετοχές της ΓΕΚ ΤΕΡΝΑ (+5,29% στα 4,6750 ευρώ), της Σαράντης (+2,93% στα 7,0200 ευρώ), της Μυτιληναίος(+2,76% στα 7,810 ευρώ), της Εθνικής (+2,75% στα 1,530 ευρώ), της Coca Cola HBC (+2,45% στα 26.310 ευρώ) και της Lamda Development (+2,35% στα 6,100 ευρώ). Αντιθέτως, τη  μεγαλύτερη πτώση  σημείωσαν οι μετοχές της Motor Oil (-4,57% στα 20, 900 ευρώ), της Fourlis (-3,35% στα 4,330 ευρώ), της ΑΔΜΗΕ (-1,94% στα 1,6140 ευρώ) και της ΑΔΜΗΕ (-1,04% στα 6,680 ευρώ). Από τους  επιμέρους δείκτες , τη μεγαλύτερη άνοδο σημείωσαν οι δείκτες του Εμπορίου (+3,20%) και των Τροφίμων (+2,41%), ενώ τις μεγαλύτερες απώλειες σημείωσαν οι δείκτες του Πετρελαίου (-3,50%) και των Προσωπικών Προϊόντων (-0,72%). Τον  μεγαλύτερο όγκο συναλλαγών  παρουσίασαν η Eurobank και η Alpha Bank, διακινώντας 13.536.055 και 4.337.707 μετοχές, αντιστοίχως. Τη  μεγαλύτερη αξία συναλλαγών  σημείωσαν η Motor Oil με 13,855 εκατ. ευρώ και η Eurobank με 8,036 εκατ. ευρώ. Ανοδικά  κινήθηκαν 58 μετοχές, 37 πτωτικά και 30 παρέμειναν σταθερές. Τη  μεγαλύτερη άνοδο  σημείωσαν οι μετοχές: Audiovisual +9,57%, Fieratex +7,69%, Νάκας +5,63% και Alpha Trust +5,63%. Τη  μεγαλύτερη πτώση  κατέγραψαν οι μετοχές: ΑΕΓΕΚ -19,54%, Forthnet -16,93%, Βιοκαρπέτ -9,84% και Lavipharm -9,60%. Οι  μετοχές του δείκτη υψηλής κεφαλαιοποίησης  έκλεισαν, ως εξής: Διαβάστε επίσης Σε ιστορικά χαμηλά οι αποδόσεις των ελληνικών ομολόγων - Στο 0,295% το πενταετές",https://www.cnn.gr/oikonomia/agores/story/152864/xrimatistirio-me-ipia-anodo-ekleise-i-teleytaia-synedriasi-toy-mina
story,www.cnn.gr,Κορωνοϊός: Πώς θα καταβληθούν τα 600 ευρώ στους επιστήμονες,"02:00 Παρασκευή, 17 Απριλίου 2020","Newsroom, CNN Greece","Τη διαδικασία πληρωμής των ωφελουμένων και των παρόχων κατάρτισης της πρόσκλησης εκδήλωσης ενδιαφέροντος, με αρ. πρωτ. 286/2.4.2020, για τη συμμετοχή στη δράση « ειδικό πρόγραμμα τηλεκατάρτισης με πιστοποίηση για επιστήμονες  πληττόμενους από τον covid-19, που εντάσσονται στους έξι βασικούς επιστημονικούς κλάδους της χώρας, βάσει Κωδικών Αριθμών Δραστηριότητας (ΚΑΔ), οριζομένων από το υπουργείο Οικονομικών», καθορίζει η  Κοινή Υπουργική Απόφαση (ΚΥΑ) , την οποία υπογράφουν ο υπουργός Οικονομικών,  Χρήστος Σταϊκούρας , ο υπουργός Ανάπτυξης και Επενδύσεων 'Αδωνις Γεωργιάδης, ο υπουργός Εργασίας και Κοινωνικών Υποθέσεων  Γιάννης Βρούτσης  και ο υφυπουργός Ανάπτυξης και Επενδύσεων  Ιωάννης Τσακίρης . Όροι και διαδικασία πληρωμής ωφελουμένων Η καταβολή του εκπαιδευτικού επιδόματος στους ωφελούμενους γίνεται, ως εξής: Το εκπαιδευτικό επίδομα είναι αξίας 600 ευρώ (100 ώρες x 6 ευρώ ανά ώρα κατάρτισης) και καταβάλλεται σε δύο δόσεις, ως ακολούθως: Α. Αμέσως μετά την ενεργοποίηση της επιταγής κατάρτισης, καταβάλλεται προκαταβολή εκπαιδευτικού επιδόματος, ύψους 400 ευρώ. Συγκεκριμένα: www.elearning.yeka.gr www.elearning.yeka.gr www.elearning.yeka.gr Β. Μετά την ολοκλήρωση του προγράμματος κατάρτισης, καταβάλλεται η δεύτερη δόση του εκπαιδευτικού επιδόματος, ύψους 200 ευρώ, ως εξής: www.elearning.yeka.gr www.elearning.yeka.gr Το επίδομα θα καταβάλλεται στον τραπεζικό λογαριασμό που κάθε καταρτιζόμενος έχει δηλώσει κατά την αίτηση συμμετοχής στο Μητρώο με ευθύνη του και στην οποία θα πρέπει να αναφέρεται ως δικαιούχος. Το επίδομα κατάρτισης είναι αφορολόγητο, ακατάσχετο και μη συμψηφιστέο. Σύμφωνα με την ΚΥΑ, οι ωφελούμενοι ουδεμία άλλη απαίτηση έχουν από την ΕΥ ΕΔ ΕΣΠΑ ΥΠΕΚΥΠ και το υπουργείο Εργασίας και Κοινωνικών Υποθέσεων, πέραν του ποσού που θα πιστωθεί στους τραπεζικούς λογαριασμούς τους. Η καταβολή στους παρόχους κατάρτισης του αντιτίμου των επιταγών κατάρτισης για τις υπηρεσίες κατάρτισης και πιστοποίησης γίνεται, ως εξής: Το ποσό που αντιστοιχεί στην πληρωμή κάθε επιταγής κατάρτισης είναι έως 470 ευρώ (420 ευρώ για την κατάρτιση και έως 50 ευρώ για την πιστοποίηση), το οποίο καταβάλλεται σε τρεις δόσεις, ως εξής: 1.  Ποσό, ύψους 20 ευρώ , ανά ωφελούμενο καταβάλλεται με την ενεργοποίηση της επιταγής κατάρτισης (α' δόση). 2.  Ποσό, ύψους 400 ευρώ , ανά ωφελούμενο καταβάλλεται με την ολοκλήρωση του προγράμματος κατάρτισης.Στην περίπτωση που ο ωφελούμενος δεν ολοκληρώσει το πρόγραμμα κατάρτισης, το ποσό της αμοιβής του παρόχου μειώνεται αναλογικά ως προς τις ώρες που δεν υλοποιήθηκαν (β΄ δόση). 3.  Ποσό, ύψους έως 50 ευρώ , ανά ωφελούμενο καταβάλλεται με την ολοκλήρωση της διαδικασίας πιστοποίησης (γ΄ δόση). Διαβάστε επίσης Κορωνοϊός: Πώς θα καταβληθούν τα 600 ευρώ στους επιστήμονες Κορωνοϊός: H διαδικασία καταβολής των 600 ευρώ στους επιστήμονες Ανάλυση Reuters: Ο κορωνοϊός θα δοκιμάσει την ενότητα της Ευρωζώνης",https://www.cnn.gr/oikonomia/story/215663/koronoios-pos-tha-katavlithoyn-ta-600-eyro-stoys-epistimones
agores,www.cnn.gr,Χρηματιστήριο: Ανοδικές τάσεις στην πρώτη συνεδρίαση της εβδομάδας ,"18:18 Δευτέρα, 29 Οκτωβρίου 2018","Newsroom, CNN Greece","Ανοδικές τάσεις επικράτησαν στην πρώτη συνεδρίαση του  Χρηματιστηρίου   της εβδομάδος, με την αγορά να  επανέρχεται στα επίπεδα των 640 μονάδων . Όμως η συναλλακτική δραστηριότητας κυμάνθηκε σε χαμηλά επίπεδα, κάτω από τα 30 εκατ. ευρώ. Στο επίκεντρο του ενδιαφέροντος βρέθηκαν οι τραπεζικές μετοχές και η μετοχή της ΔΕΗ. O Γενικός Δείκτης Τιμών έκλεισε στις 640,07 μονάδες,  σημειώνοντας άνοδο 1,07%. Ενδοσυνεδριακά κατέγραψε υψηλότερη τιμή στις 644,50 μονάδες (+1,77%). Η αξία των συναλλαγών ανήλθε στα 28,697 εκατ. ευρώ, ενώ διακινήθηκαν 14.386.406 μετοχές. Ο δείκτης υψηλής κεφαλαιοποίησης σημείωσε άνοδο σε ποσοστό 1,21%, ενώ ο δείκτης της μεσαίας κεφαλαιοποίησης ενισχύθηκε σε ποσοστό 0,92%. Από τις  μετοχές της υψηλής κεφαλαιοποίησης, ά νοδο κατέγραψαν οι μετοχές της ΔΕΗ (+6,53% στα 1,3050 ευρώ), της Eurobank(+6,16% στα 0,5860 ευρώ), της Πειραιώς (+4,92% στα 1,280 ευρώ), της Fourlis (+3,37% στα 4,600 ευρώ), της Εθνικής(+2,88% στα 1,500 ευρώ) και της Alpha Bank (+2,82% στα 1,3130 ευρώ). Αντιθέτως, τη  μεγαλύτερη πτώση  σημείωσαν οι μετοχές της ΓΕΚ ΤΕΡΝΑ (-1,60% στα 4,300 ευρώ), του ΟΛΠ (-1,13% στα 15,720 ευρώ) και του ΟΤΕ(-1,01% στα 9,760 ευρώ). Από τους επιμέρους δείκτες, τη μεγαλύτερη άνοδο σημείωσαν οι δείκτες των Τραπεζών (+3,88%) και των Χρηματοοικονομικών Υπηρεσιών(+2,27%), ενώ τις μεγαλύτερες απώλειες σημείωσαν οι δείκτες των Τηλεπικοινωνιών (-1,01%) και των Κατασκευών (-0,61%). Τον μεγαλύτερο όγκο συναλλαγών παρουσίασαν η Eurobank και η Alpha Bank διακινώντας 3.463.000 και 2.716.780 μετοχές, αντιστοίχως. Τη μεγαλύτερη αξία συναλλαγών σημείωσαν η Motor Oil με 4,743 εκατ. ευρώ και η Alpha Bank με 3,583 εκατ. ευρώ. Ανοδικά κινήθηκαν 55 μετοχές, 44 πτωτικά και 29 παρέμειναν σταθερές. Τη μεγαλύτερη άνοδο σημείωσαν οι μετοχές: Μαθιός Πυρίμαχα+29,73%, Attica Bank+10,55%, CPI+9,39% και Ιατρικό Αθηνών +7,54%. Τη μεγαλύτερη πτώση κατέγραψαν οι μετοχές: Δομική Κρήτης -20,00%, ΑΝΕΚ -12,12%, Ιντεάλ(κ) -9,83% και F.G. Europe-9,19%. Οι μετοχές του δείκτη υψηλής κεφαλαιοποίησης έκλεισαν, ως εξής: Διαβάστε επίσης Σε ιστορικά χαμηλά οι αποδόσεις των ελληνικών ομολόγων - Στο 0,295% το πενταετές",https://www.cnn.gr/oikonomia/agores/story/152599/xrimatistirio-anodikes-taseis-stin-proti-synedriasi-tis-evdomadas
agores,www.cnn.gr,Χρηματιστήριο: Ισχυρή άνοδος στη σημερινή συνεδρίαση,"18:21 Τετάρτη, 24 Οκτωβρίου 2018","Newsroom, CNN Greece","Με ισχυρή άνοδο, πάνω από τα επίπεδα των 630 μονάδων, έκλεισε η  χρηματιστηριακή αγορά , με μοχλό το υψηλό αγοραστικό ενδιαφέρον για τις τραπεζικές μετοχές. O Γενικός Δείκτης Τιμών έκλεισε στις 632,56 μονάδες, σημειώνοντας άνοδο 2,11%. Η αξία των συναλλαγών ανήλθε στα 46,057 εκατ. ευρώ, ενώ διακινήθηκαν 25.415.689 μετοχές. Ο δείκτης υψηλής κεφαλαιοποίησης σημείωσε άνοδο σε ποσοστό 2,21%, ενώ ο δείκτης της μεσαίας κεφαλαιοποίησης ενισχύεται σε ποσοστό 1,93%. Από τις μετοχές της υψηλής κεφαλαιοποίησης, άνοδο κατέγραψαν οι μετοχές της Πειραιώς (+12,71% στα 1,2060 ευρώ), της alpha Bank(+9,73% στα 1,2630 ευρώ), της Eurobank(+9,27% στα 0,560 ευρώ), της Σαράντης (+8,96% στα 7,300 ευρώ) και της Εθνικής(+7,86% στα 1,510 ευρώ). Αντιθέτως, τη μεγαλύτερη πτώση σημείωσαν οι μετοχές της Motor Oil(-4,44% στα 20,450 ευρώ), της Τιτάν(-1,02% στα 19,340 ευρώ) και της ΓΕΚ ΤΕΡΝΑ(-0,67% στα 4,450 ευρώ). Από τους επιμέρους δείκτες, τη μεγαλύτερη άνοδο σημείωσαν οι δείκτες των Τραπεζών (+9,45%), της Υγείας (+3,14%) και των Πρώτων Υλών (+3,01%), ενώ τις μεγαλύτερες απώλειες σημείωσαν οι δείκτες του Πετρελαίου (-3,06%) και του Εμπορίου(-2,75%) Τον μεγαλύτερο όγκο συναλλαγών παρουσίασαν η Eurobank και η Alpha Bank διακινώντας 7.014.904 και 5.352.993 μετοχές, αντιστοίχως. Τη μεγαλύτερη αξία συναλλαγών σημείωσαν η Alpha Bank με 6,582 εκατ. ευρώ και η Motor Oil με 5,664 εκατ. ευρώ. Ανοδικά κινήθηκαν 70 μετοχές, 39 πτωτικά και 24 παρέμειναν σταθερές. Τη μεγαλύτερη άνοδο σημείωσαν οι μετοχές: Τζιρακιάν +15,71%, Πειραιώς+12,71%, Αλουμύλ+11,76% και Lavipharm+10,71%. Τη μεγαλύτερη πτώση κατέγραψαν οι μετοχές: Κρητών 'Αρτος -10,16%, Λεβεντέρης(π)-10,00%, Paperpack-7,41% και Audiovisual -6,25%. Οι μετοχές του δείκτη υψηλής κεφαλαιοποίησης έκλεισαν, ως εξής: ALPHA BANK:1,2630 ευρώ(+9,73%) EUROBANK:0,560 ευρώ(+9,27%) FOURLIS:4,470 (+0,11%) VIOHALCO:2,495 ευρώ(+1,22%) ΓΕΚ ΤΕΡΝΑ:4,450 ευρώ(-0,67%) ΕΥΔΑΠ:4,920 ευρώ(+0,82%) ΔΕΗ:1,240 ευρώ(+2,90%) ΑΔΜΗΕ:1,5820 ευρώ(+0,13%) COCA COLA HBC:26,540 ευρώ(+1,30%) ΕΛΠΕ:7,050 ευρώ(+0,86%) ΕΘΝΙΚΗ:1,510 ευρώ(+7,86%) ΣΑΡΑΝΤΗΣ:7,300 ευρώ(+8,96%) JUMBO: 12,940 ευρώ(+1,89%) ΤΕΡΝΑ ΕΝΕΡΓΕΙΑΚΗ: 6,180 ευρώ(-0,32%) ΜΥΤΙΛΗΝΑΙΟΣ:7,880 ευρώ(+2,87%) MOTOR OIL:20,450 ευρώ(-4,44%) ΟΠΑΠ:8,500 ευρώ(-0,47%) ΟΤΕ:9,730 ευρώ(+1,67%) ΠΕΙΡΑΙΩΣ:1,2060 ευρώ(+12,71%) ΤΙΤΑΝ:19,340 ευρώ(-1,02%) LAMDA DEVELOPMENT:5,940 ευρώ(-0,50%) ΟΛΠ:15,820 ευρώ(+0,38%) ΕΧΑΕ:3,920 ευρώ(+0,26%) GRIVALIA PROPERTIES:7,710 ευρώ(+0,52%) AEGEAN AIRLINES: 6,850 ευρώ(αμετάβλητη) Διαβάστε επίσης Σε ιστορικά χαμηλά οι αποδόσεις των ελληνικών ομολόγων - Στο 0,295% το πενταετές",https://www.cnn.gr/oikonomia/agores/story/151966/xrimatistirio-isxyri-anodos-sti-simerini-synedriasi
