subtopic,website,title,date,author,text,url
agores,www.cnn.gr,Χρηματιστήριο: Σε υποτονικό κλίμα οι συναλλαγές ,"18:10 Δευτέρα, 06 Αυγούστου 2018","Newsroom, CNN Greece","Σε υποτονικό κλίμα πραγματοποιήθηκαν οι  συναλλαγές  στην πρώτη συνεδρίαση της εβδομάδας, με την αγορά να κλείνει σε  ελαφρώς χαμηλότερα επίπεδα,  εν μέσω χαμηλής συναλλακτικής δραστηριότητας. O  Γενικός Δείκτης Τιμών έκλεισε στις 759,63 μονάδες , σημειώνοντας μικρή πτώση 0,27%. Ενδοσυνεδριακά κατέγραψε κατώτερη τιμή στις 758,22 μονάδες (-0,46%). Η αξία των συναλλαγών ανήλθε στα 13,444 εκατ. ευρώ, ενώ διακινήθηκαν 6.934.199 μετοχές. Ο  δείκτης υψηλής κεφαλαιοποίησης  σημείωσε πτώση σε ποσοστό 0,37%, ενώ ο δείκτης της μεσαίας κεφαλαιοποίησης υποχώρησε σε ποσοστό 0,54%. Από τις  μετοχές της υψηλής κεφαλαιοποίησης , άνοδο κατέγραψαν οι μετοχές της Σαράντης (+4,86% στα 7,340 ευρώ), της ΔΕΗ (+1,55% στα 1,8360 ευρώ), της Lamda Development(+1,29% στα 6,260 ευρώ), του ΟΤΕ (+1,27% στα 11,140 ευρώ), του ΟΠΑΠ (+1,21% στα 9,650 ευρώ), της ΑΔΜΗΕ (+1,17% στα 1,7360 ευρώ) και της ΓΕΚ ΤΕΡΝΑ(+1,15% στα 5,270 ευρώ). Αντιθέτως, τη  μεγαλύτερη πτώση  σημείωσαν οι μετοχές της ΕΧΑΕ (-2,77% στα 4,570 ευρώ), της Jumbo(-2,70% στα 13,680 ευρώ), της Eurobank(-2,33% στα 0,8400 ευρώ), της Πειραιώς (-1,70% στα 2,6620 ευρώ), του ΟΛΠ (-1,63% στα 16,900 ευρώ) και της Εθνικής (-1,08% στα 0,2750 ευρώ). Από τους επιμέρους δείκτες, τη μεγαλύτερη άνοδο σημείωσαν οι δείκτες του Εμπορίου(+2,14%), των Τηλεπικοινωνιών (+1,27%), των Υπηρεσιών Κοινής Ωφέλειας(+0,84%) και των Ταξιδιών (+0,81%), ενώ τις μεγαλύτερες απώλειες σημείωσαν οι δείκτες των Προσωπικών Προϊόντων (-1,43%) και των Τραπεζών (-1,03%). Τον  μεγαλύτερο όγκο συναλλαγών  παρουσίασαν η Εθνική και η Eurobank διακινώντας 1.924.455 και 748.940 μετοχές, αντιστοίχως. Τη μεγαλύτερη αξία συναλλαγών σημείωσαν ο ΟΤΕ με 1,955 εκατ. ευρώ και η Grivalia Properties με 1,388 εκατ. ευρώ. Ανοδικά κινήθηκαν 50 μετοχές, 40 πτωτικά και 28 παρέμειναν σταθερές. Τη μεγαλύτερη άνοδο σημείωσαν οι μετοχές:Κυριακούλης+24,19%, Σφακιανάκης+16,46%, Χαϊδεμένος+8,33% και Ακρίτας+6,67%. Τη μεγαλύτερη πτώση κατέγραψαν οι μετοχές: Γ.Ε. Δημητρίου -12,00%, Forthnet-10,00% Fieratex-6,88% και Centric Συμμετοχών -6,64%. Οι μετοχές του δείκτη υψηλής κεφαλαιοποίησης έκλεισαν, ως εξής: Διαβάστε επίσης Σε ιστορικά χαμηλά οι αποδόσεις των ελληνικών ομολόγων - Στο 0,295% το πενταετές",https://www.cnn.gr/oikonomia/agores/story/141679/xrimatistirio-se-ypotoniko-klima-oi-synallages
agores,www.cnn.gr,Χρηματιστήριο: Ανοδικές τάσεις χωρίς αύξηση τζίρου ,"18:24 Δευτέρα, 15 Οκτωβρίου 2018","Newsroom, CNN Greece","Ανοδικές τάσεις επικράτησαν στη σημερινή συνεδρίαση του  Χρηματιστηρίου . Η άνοδος των τιμών των μετοχών  δεν συνοδεύθηκε από αύξηση του τζίρου,  ενδεικτικό της επιφυλακτικότητας των επενδυτών. O Γενικός Δείκτης Τιμών έκλεισε στις 634,47 μονάδες , σημειώνοντας άνοδο 0,98%. Ενδοσυνεδριακά κατέγραψε υψηλότερη τιμή στις 640,81 μονάδες (+1,99%). Η αξία των συναλλαγών ανήλθε στα 39,926 εκατ. ευρώ, ενώ διακινήθηκαν 15.260.506 μετοχές. Ο  δείκτης υψηλής κεφαλαιοποίησης  σημείωσε άνοδο σε ποσοστό 0,69%, ενώ ο δείκτης της μεσαίας κεφαλαιοποίησης ενισχύθηκε σε ποσοστό 0,94%. Από τις  μετοχές της υψηλής κεφαλαιοποίησης , τη μεγαλύτερη άνοδο κατέγραψαν οι μετοχές της Eurobank(+4,54% στα 0,5300 ευρώ), της Aegean Airlines(+4,48% στα 7,000 ευρώ), της ΔΕΗ (+4,19% στα 1,2420 ευρώ), της Viohalco(+2,69% στα 2,670 ευρώ), της Jumbo(+2,61% στα 12,560 ευρώ) και του ΟΤΕ (+2,43% στα 9,900 ευρώ). Αντιθέτως, τη μεγαλύτερη πτώση σημείωσαν οι μετοχές της Εθνικής (-2,60% στα 1,500 ευρώ), της Σαράντης(-2,33% στα 6,720 ευρώ), της Coca Cola HBC (-1,39% στα 26,260 ευρώ) και της Τέρνα Ενεργειακή (-0,99% στα 6,0100 ευρώ). Από τους επιμέρους δείκτες, τη  μεγαλύτερη άνοδο  σημείωσαν οι δείκτες των Τηλεπικοινωνιών (+2,43%) και του Εμπορίου(+2,01%), ενώ τις μεγαλύτερες απώλειες σημείωσαν οι δείκτες των τροφίμων (-1,37%) και της Υγείας (-0,66%). Τον  μεγαλύτερο όγκο συναλλαγών  παρουσίασαν η Eurobank και η Εθνική διακινώντας 5.355.863 και 1.758.872 μετοχές, αντιστοίχως. Τη μεγαλύτερη αξία συναλλαγών σημείωσαν ο ΟΠΑΠ με 14,296 εκατ. ευρώ και ο ΟΤΕ με4,262 εκατ. ευρώ. Ανοδικά κινήθηκαν 60 μετοχές, 28 πτωτικά και 26 παρέμειναν σταθερές. Τη μεγαλύτερη άνοδο σημείωσαν οι μετοχές: Τζιρακιάν+20,00%, Κυριακούλης+19,37%, Ίλυδα+14,13% και ΒΙΣ+10,00%. Τη μεγαλύτερη πτώση κατέγραψαν οι μετοχές: ΓΕΚΕ -3,92%, Μύλοι Κεπενού -3,85%, Αφοί Καράτζη -3,23% και J&P 'Αβαξ -3,14%. Οι μετοχές του δείκτη υψηλής κεφαλαιοποίησης έκλεισαν, ως εξής: Διαβάστε επίσης Σε ιστορικά χαμηλά οι αποδόσεις των ελληνικών ομολόγων - Στο 0,295% το πενταετές",https://www.cnn.gr/oikonomia/agores/story/150796/xrimatistirio-anodikes-taseis-xoris-ayxisi-tziroy
agores,www.cnn.gr,Χρηματιστήριο: Με πτώση έκλεισε η σημερινή συνεδρίαση,"18:14 Τρίτη, 23 Οκτωβρίου 2018","Newsroom, CNN Greece","Πιέσεις  δέχθηκαν οι τιμές των  μετοχών  στη σημερινή συνεδρίαση, με την αγορά να υποχωρεί  κάτω από τις 620 μονάδες , εν μέσω αρνητικού διεθνούς κλίματος. Η αγορά  υποχώρησε στα χαμηλότερα επίπεδα  από τη συνεδρίαση της 9ης Φεβρουαρίου 2017, ενώ σε χαμηλά επίπεδα, κάτω από τα 30 εκατ. ευρώ, υποχώρησε ο τζίρος. O  Γενικός Δείκτης Τιμών  έκλεισε στις 619,47 μονάδες, σημειώνοντας πτώση 1,14%. Ενδοσυνεδριακά  κατέγραψε κατώτερη τιμή στις 615,28 μονάδες (-1,81%). Η  αξία των συναλλαγών  ανήλθε στα 28,775 εκατ. ευρώ, ενώ διακινήθηκαν 13.945.143 μετοχές. Ο  δείκτης υψηλής κεφαλαιοποίησης  σημείωσε πτώση σε ποσοστό 1,38%, ενώ ο δείκτης της μεσαίας κεφαλαιοποίησης υποχώρησε σε ποσοστό 1,12%. Από τις  μετοχές της υψηλής κεφαλαιοποίησης , τη μεγαλύτερη άνοδο κατέγραψαν οι μετοχές της ΔΕΗ (+3,61% στα 1,2050 ευρώ),της Alpha Bank (+0,88% στα 1,1510 ευρώ) και της ΑΔΜΗΕ (+0,77% στα 1,580 ευρώ). Αντιθέτως, τη  μεγαλύτερη πτώση  σημείωσαν οι μετοχές της ΓΕΚ ΤΕΡΝΑ (-3,34% στα 4,480 ευρώ), της ΕΥΔΑΠ (-3,17% στα 4,880 ευρώ), της Motor Oil (-3,17% στα 21,400 ευρώ), της Πειραιώς (-2,995 στα 1,0700 ευρώ), της Eurobank (-2,75% στα 0,5125 ευρώ) και της Coca Cola HBC (-2,67% στα 26,200 ευρώ). Από τους  επιμέρους δείκτες , τη μεγαλύτερη άνοδο σημείωσαν οι δείκτες της Υγείας (+1,11%) και της Τεχνολογίας (+0,54%), ενώ τις μεγαλύτερες απώλειες σημείωσαν οι δείκτες των Πρώτων Υλών (-4,61%) και των Τροφίμων (-2,64%). Τον  μεγαλύτερο όγκο συναλλαγών  παρουσίασαν η Eurobank και η Εθνική, διακινώντας 3.965.549 και 1.828.273 μετοχές, αντιστοίχως. Τη  μεγαλύτερη αξία συναλλαγών  σημείωσαν ο ΟΠΑΠ με 4,093 εκατ. ευρώ και ο ΟΤΕ με 2,940 εκατ. ευρώ. Ανοδικά  κινήθηκαν 30 μετοχές, 65 πτωτικά και 33 παρέμειναν σταθερές. Τη  μεγαλύτερη άνοδο  σημείωσαν οι μετοχές: Αλουμύλ +10,39%, Ιντεάλ(κ) +9,49%, Inform Λύκος +6,98% και Audiovisual +6,67%. Τη  μεγαλύτερη πτώση  κατέγραψαν οι μετοχές: Fieratex -12,50%, Προοδευτική -8,90%, ΕΛΒΕ -7,06% και Έλαστρον -6,05%. Οι  μετοχές του δείκτη υψηλής κεφαλαιοποίησης  έκλεισαν, ως εξής: Διαβάστε επίσης Σε ιστορικά χαμηλά οι αποδόσεις των ελληνικών ομολόγων - Στο 0,295% το πενταετές",https://www.cnn.gr/oikonomia/agores/story/151834/xrimatistirio-me-ptosi-ekleise-i-simerini-synedriasi
agores,www.cnn.gr,Χρηματιστήριο: Με άνοδο - «ανάσα» έκλεισε η τελευταία συνεδρίαση του μήνα,"20:25 Παρασκευή, 30 Νοεμβρίου 2018","Newsroom, CNN Greece","Με  μεγάλη άνοδο  έκλεισε η  χρηματιστηριακή αγορά , ενώ σημαντική αύξηση κατέγραψε ο όγκος συναλλαγών λόγω της  αναδιάρθρωσης των δεικτών MSCI . Υπενθυμίζεται πως οι  μετοχές  των Εθνική, Eurobank και Πειραιώς διαγράφονται από τον δείκτη MSCI Standard Greece και δεν υπάρχουν προσθήκες. Οι μετοχές των τριών τραπεζών θα προστεθούν στον δείκτη MSCI Small Cap από τον οποίο θα αφαιρεθεί η Ελλάκτωρ. O  Γενικός Δείκτης Τιμών  έκλεισε στις 630,23 μονάδες, σημειώνοντας κέρδη σε ποσοστό 1,95%. Σε εβδομαδιαία βάση κατέγραψε  άνοδο  σε ποσοστό 4,59%, έκλεισε το Νοέμβριο με απώλειες 1,55%, ενώ από τις αρχές του έτους σημειώνει πτώση σε ποσοστό 21,45%. Η  αξία των συναλλαγών  ανήλθε στα 255,433 εκατ. ευρώ, ενώ διακινήθηκαν 262.307.471 μετοχές. Ο  δείκτης υψηλής κεφαλαιοποίησης  σημείωσε άνοδο σε ποσοστό 1,46%, ενώ ο δείκτης της μεσαίας κεφαλαιοποίησης ενισχύθηκε σε ποσοστό 1,96%. Από τις  μετοχές της υψηλής κεφαλαιοποίησης , άνοδο κατέγραψαν οι μετοχές της ΔΕΗ (+8,11%, στο 1,3190 ευρώ), των ΕΛΠΕ (+5,13%, στα 7,380 ευρώ), της Alpha Bank (+5,04%, στο 1,250 ευρώ), της Εθνικής (+3,43%, στο 1,0240 ευρώ) και της Grivalia Properties (+3,36%, στα 8,920 ευρώ). Αντιθέτως, τη  μεγαλύτερη πτώση  σημείωσαν οι μετοχές της Τέρνα Ενεργειακή (-2,44%, στα 6,000 ευρώ), της Coca Cola HBC (-2,19%, στα 26,350 ευρώ) και της Aegean Airlines(-0,68%, στα 7,350 ευρώ). Από τους  επιμέρους δείκτες , τη μεγαλύτερη άνοδο σημείωσαν οι δείκτες των Τραπεζών (+3,48%) και των Τηλεπικοινωνιών (+3,16%), ενώ τις μεγαλύτερες απώλειες σημείωσαν οι δείκτες των Τροφίμων (-2,17%) και του Εμπορίου (-0,72%). Τον  μεγαλύτερο όγκο συναλλαγών  παρουσίασαν η Eurobank και η Εθνική διακινώντας 156.799.622 και 52.640.161 μετοχές, αντιστοίχως. Τη  μεγαλύτερη αξία συναλλαγών  σημείωσαν η Eurobank με 88,444 εκατ. ευρώ και η Εθνική με 53,579 εκατ. ευρώ. Ανοδικά  κινήθηκαν 62 μετοχές, 38 πτωτικά και 37 παρέμειναν σταθερές. Τη  μεγαλύτερη άνοδο  σημείωσαν οι μετοχές: ΑΝΕΚ +18,75%, Προοδευτική (+17,50%), Παπουτσάνης (+15,12%) και Τρία Αλφα(κ) (+10,00%). Τη  μεγαλύτερη πτώση  κατέγραψαν οι μετοχές: Τζιρακιάν Προφίλ (-25,23%), Δομική Κρήτης (-19,20%), Μαθιός Πυρίμαχα (-14,50%) και Βογιατζόγλου Systems (-9,52%). Οι  μετοχές του δείκτη υψηλής κεφαλαιοποίησης  έκλεισαν, ως εξής: Διαβάστε επίσης Σε ιστορικά χαμηλά οι αποδόσεις των ελληνικών ομολόγων - Στο 0,295% το πενταετές",https://www.cnn.gr/oikonomia/agores/story/156613/xrimatistirio-me-anodo-anasa-i-teleytaia-synedriasi-toy-mina
agores,www.cnn.gr,Χρηματιστήριο: Πτωτικά κινήθηκε η αγορά,"18:10 Πέμπτη, 02 Αυγούστου 2018","Newsroom, CNN Greece","Πτωτικά κινήθηκε η  χρηματιστηριακή   αγορά στη σημερινή συνεδρίαση, εν μέσω αρνητικού κλίματος στις ευρωπαϊκές αγορές και επιδείνωσης του κλίματος στην αγορά ομολόγων. Κάτω από τα 20 εκατ. ευρώ διαμορφώθηκε ο τζίρος. O Γενικός Δείκτης Τιμών έκλεισε στις 755,93 μονάδες, σημειώνοντας πτώση 0,75%. Ενδοσυνεδριακά κατέγραψε κατώτερη τιμή στις 752,47 μονάδες (-1,21%). Η αξία των συναλλαγών ανήλθε στα 19,425 εκατ. ευρώ, ενώ διακινήθηκαν 11.672.824 μετοχές. Ο δείκτης υψηλής κεφαλαιοποίησης σημείωσε πτώση σε ποσοστό 0,82%, ενώ ο δείκτης της μεσαίας κεφαλαιοποίησης ενισχύθηκε σε ποσοστό 1,15%. Από τις μετοχές της υψηλής κεφαλαιοποίησης, άνοδο κατέγραψαν οι μετοχές του ΟΛΠ (+1,65% στα 17,280 ευρώ), της Lamda Development (+1,63% στα 6,220 ευρώ), της Τέρνα Ενεργειακή (+1,61% στα 5,690 ευρώ), της Τιτάν (+1,47% στα 20,750 ευρώ0 και της Μυτιληναίος (+1,41% στα 8,620 ευρώ). Αντιθέτως, τη μεγαλύτερη πτώση σημείωσαν οι μετοχές της Eurobank (-3,32% στα 0,8435 ευρώ), της Alpha Bank (-2,34% στα 1,8360 ευρώ), της ΕΥΔΑΠ (-2,29% στα 5,550 ευρώ), της Πειραιώς (-2,20% στα 2,6620 ευρώ), του ΟΠΑΠ (-1,79% στα 9,350 ευρώ), της Σαράντης (-1,73% στα 6,800 ευρώ) και της Εθνικής (-1,71% στα 0,2752 ευρώ). Από τους επιμέρους δείκτες, τη μεγαλύτερη άνοδο σημείωσαν οι δείκτες των Πρώτων Υλών (+2,46%) και του Εμπορίου (+2,09%), ενώ τις μεγαλύτερες απώλειες σημείωσαν οι δείκτες των Τραπεζών (-2,41%) και των Τηλεπικοινωνιών (-1,35%). Το μεγαλύτερο όγκο συναλλαγών παρουσίασαν η Εθνική και η Ιντραλότ, διακινώντας 4.381.140 και 1.634.421 μετοχές, αντιστοίχως. Τη μεγαλύτερη αξία συναλλαγών σημείωσαν η Motor Oil με 2,415 εκατ. ευρώ και ο ΟΠΑΠ με 2,318 εκατ. ευρώ. Ανοδικά κινήθηκαν 48 μετοχές, 50 πτωτικά και 24 παρέμειναν σταθερές. Τη μεγαλύτερη άνοδο σημείωσαν οι μετοχές: Τζιρακιάν +18,00%, Κυριακούλης +12,73%, Ευρωσύμβουλοι +8,67% και Lavipharm +6,67%. Τη μεγαλύτερη πτώση κατέγραψαν οι μετοχές: Fieratex -20,59%, Μπήτρος -19,66%, Ακρίτας -17,50% και Ειδησεοφωνική Ελλάς -10,71%. Οι μετοχές του δείκτη υψηλής κεφαλαιοποίησης έκλεισαν, ως εξής: ALPHA BANK: 1,8360 ευρώ (-2,34%) EUROBANK: 0,8435 ευρώ (-3,32%) FOURLIS: 5,8300 ευρώ (+0,52%) VIOHALCO: 3,1300 ευρώ (-0,63%) ΓΕΚ ΤΕΡΝΑ: 5,220 ευρώ (-1,14%) ΕΥΔΑΠ: 5,550 ευρώ (-2,29%) ΔΕΗ: 1,7990 ευρώ (+0,39%) ΑΔΜΗΕ: 1.7300 ευρώ (-0,57%) COCA COLA HBC: 30,660 ευρώ (+0,52%) ΕΛΠΕ: 7,1400 ευρώ (-0,83%) ΕΘΝΙΚΗ: 0,2752 ευρώ (-1,71%) ΣΑΡΑΝΤΗΣ: 6,800 ευρώ (-1,73%) JUMBO: 13,840 ευρώ (-0,86%) ΤΕΡΝΑ ΕΝΕΡΓΕΙΑΚΗ: 5,6900 ευρώ (+1,61%) ΜΥΤΙΛΗΝΑΙΟΣ: 8,620 ευρώ (+1,41%) MOTOR OIL: 18,080 ευρώ (-0,88%) ΟΠΑΠ: 9,3500 ευρώ (-1,79%) ΟΤΕ: 10,990 ευρώ (-1,35%) ΠΕΙΡΑΙΩΣ: 2,662 ευρώ (-2,20%) ΤΙΤΑΝ: 20,750 ευρώ (+1,47%) LAMDA DEVELOPMENT: 6,220 ευρώ (+1,63%) ΟΛΠ: 17,280 ευρώ (+1,65%) ΕΧΑΕ: 4,670 ευρώ (-1,27%) GRIVALIA PROPERTIES: 8,4900 ευρώ (-0,70%) AEGEAN AIRLINES: 8,180 ευρώ (+0,12%) Διαβάστε επίσης Σε ιστορικά χαμηλά οι αποδόσεις των ελληνικών ομολόγων - Στο 0,295% το πενταετές",https://www.cnn.gr/oikonomia/agores/story/141216/xrimatistirio-ptotika-kinithike-i-agora
agores,www.cnn.gr,Χρηματιστήριο: Μικρά κέρδη στη σημερινή συνεδρίαση ,"17:59 Τρίτη, 07 Αυγούστου 2018","Newsroom, CNN Greece","Με  μικρά κέρδη και σταθερά πέριξ των 760 μονάδων  έκλεισε σήμερα το  Χρηματιστήριο Αθηνών , το οποίο στην καρδιά του θέρους παραμένει σε ένα στενό εύρος διακύμανσης με ελάχιστες κινήσεις σε επιλεγμένες μετοχές. O  Γενικός Δείκτης Τιμών έκλεισε στις 761,29 μονάδες , σημειώνοντας άνοδο 0,22%. Η αξία των συναλλαγών ανήλθε στα 51,6 εκατ. ευρώ, ενώ διακινήθηκαν 11,6 εκατ. μετοχές. Ο δείκτης υψηλής κεφαλαιοποίησης σημείωσε κέρδη 0,13%, ενώ ο δείκτης της μεσαίας κεφαλαιοποίησης υποχώρησε σε ποσοστό 0,27%. Από τις  μετοχές της υψηλής κεφαλαιοποίησης , άνοδο κατέγραψαν οι μετοχές της ΔΕΗ (+2,29%) και της ΕΥΔΑΠ (+2,19%), ενώ, αντιθέτως, πτώση σημείωσαν οι μετοχές του ΟΠΑΠ (-1,55%) και της Motor Oil (-0,65%). Από τους επιμέρους δείκτες, κέρδη σημείωσαν οι δείκτες των Μέσων Ενημέρωσης (+7,14%) και του Εμπορίου (+3,91%), ενώ, αντιθέτως, απώλειες σημείωσαν οι δείκτες Χημικών (-1,73%) και Ταξιδίων (-1,24%). Το μεγαλύτερο όγκο συναλλαγών παρουσίασαν οι μετοχές του ΟΤΕ (3,2 εκατ. μετοχές) και της Εθνικής (1,8 εκατ. μετοχές). Τη  μεγαλύτερη αξία συναλλαγών  σημείωσαν οι μετοχές του ΟΤΕ (36,6 εκατ. ευρώ) και της Jumbo (2,2 εκατ. ευρώ). Ανοδικά κινήθηκαν 58 μετοχές, πτωτικά 39 και 144 παρέμειναν σταθερές. Τη  μεγαλύτερη άνοδο  κατέγραψαν οι μετοχές: Φιερατέξ +27,27%, Revoil +9,85% και AudioVisual +7,14%. Τη  μεγαλύτερη πτώση  σημείωσαν οι μετοχές: Μινέρβα -13,18%, Λόγος -10% και Χαϊδεμένος -5,98%. Οι μετοχές του δείκτη υψηλής κεφαλαιοποίησης έκλεισαν, ως εξής: Διαβάστε επίσης Σε ιστορικά χαμηλά οι αποδόσεις των ελληνικών ομολόγων - Στο 0,295% το πενταετές",https://www.cnn.gr/oikonomia/agores/story/141812/xrimatistirio-mikra-kerdi-sti-simerini-synedriasi
