subtopic,website,title,date,author,text,url
Sports,tanea.gr,Παναθηναϊκός : Ο Γιώργος Δώνης είναι η καλύτερη λύση,6 Απριλίου 2020 | 09:29,tanea.gr,"Αν και με τον Γιάννη Αλαφούζο ποτέ δεν μπορείς να είσαι σίγουρος, οι ενδείξεις συγκλίνουν ότι ο Γιώργος Δώνης θα είναι και τη νέα χρονιά προπονητής του Παναθηναϊκού. Στο βαθμό βέβαια που το επιθυμεί και ο ίδιος. Η απόφαση αυτή σημαίνει ανάμεσα σε άλλα ότι ο ιδιόκτητης του Παναθηναϊκού συμβιβάζεται με την ιδέα ότι θα αμείψει για μια χρονιά τον προπονητή του με ποσό ίσως και μεγαλύτερο από τις συνολικές αποδοχές του τα δυο προηγούμενα χρόνια. Όποιος νομίζει ότι ο κ. Αλαφούζος δεν… κοντοστάθηκε και στη λεπτομέρεια αυτή όταν σκεφτόταν τη λύση της συνεργασίας κάνει λάθος. Με την περιοριστική οικονομική πολιτική που ακολουθούν οι πράσινοι όλα ζυγίζονται και παίζουν το ρόλο τους. Μπορεί η σχέση μεταξύ των δυο ανδρών να υπήρξε πολυκύμαντη και αρκετές φορές τα αισθήματα που διατηρούσε ο ένας για τον άλλο να μην ήταν τα καλύτερα δυνατά, αλλά όταν έρχεται η ώρα να γίνει το κοντρόλ, υπάρχουν κι άλλα πράγματα που βαραίνουν. Ένα από αυτά είναι οπωσδήποτε ότι ο Γιώργος Δώνης ανταποκρίθηκε και με το παραπάνω στην αρχική επιδίωξη του ιδιοκτήτη. Έχτισε με λίγα λεφτά μια σχετικά ανταγωνιστική ομάδα, ανέδειξε νέους παίκτες και έχει τα περιθώρια και νέας αγωνιστικής βελτίωσης την επόμενη χρονιά. Υπάρχει και κάτι ακόμα. Ο Δώνης και η ομάδα που δημιούργησε κατάφεραν να λειτουργήσουν ως ασπίδα προστασίας για τον ιδιοκτήτη. Πολλές φορές το ενδιαφέρον στράφηκε στην ομάδα και τις επιτυχίες της μακριά από την δικαιολογημένη δυσφορία για την οικονομική λιτότητα και τις αλλοπρόσαλλες συμπεριφορές του Γιάννη Αλαφούζου. Δεν είναι καιροί να χαθεί τώρα ένα αλεξικέραυνο και να βρεθεί ο Παναθηναϊκός με έναν προπονητή που θα πασχίσει να κατακτήσει την εκτίμηση των οπαδών και θα έχει την προσωπικότητα εκείνη για να σκεπάζει όποτε χρειάζεται τις γκρίνιες κατά του μεγαλομετόχου. Το αλεξικέραυνο χρειάζεται περισσότερο από κάθε άλλη φορά. Πολύ περισσότερο που φέτος ο κόσμος θα έχει μεγαλύτερες απατήσεις, ενώ από την πλευρά της ιδιοκτησίας, ειδικά μετά την κρίση της πανδημίας, δεν πρόκειται να αυξηθεί το μπάτζετ για να γίνουν σπουδαίες μεταγραφές. Με αυτά τα δεδομένα ο Γιώργος Δώνης είναι η καλύτερη λύση. Προσφέρει, γνώση, σιγουριά, είναι μαθημένος να βγάζει από τη μύγα ξύγκι κι έχει την έξωθεν καλή μαρτυρία. Όσα λείπουν από τον ιδιοκτήτη, περισσεύουν στον προπονητή. Η αντικατάστασή του θα άνοιγε νωρίς ένα ακόμα μέτωπο ανάμεσα στους οπαδούς και τον Γιάννη Αλαφούζο. Για ποιο λόγο λοιπόν να μη ρίξει ο mister ΣΚΑΪ λίγο νερό στο κρασί του διατηρώντας έναν πολύ καλό προπονητή και ταυτόχρονα (σε μεγάλο βαθμό) την ησυχία του;  ",https://www.tanea.gr/2020/04/06/sports/football/panathinaikos-o-giorgos-donis-einai-i-kalyteri-lysi/
Sports,tanea.gr,{T16}Το spacing και η άμυνα man to man{T16}!,29 Απριλίου 2020 | 05:00,tanea.gr,"Το μπάσκετ είναι ένα κλασικό άθλημα (σωματικών) επαφών, αλλά ακόμη κι όταν ανοίξουν τα γήπεδα του ΝΒΑ και επιτραπούν οι (ανά γκρουπ τεσσάρων παικτών) προπονήσεις, ο συγχρωτισμός θα απαγορεύεται διά ροπάλου! «Don't touch» όπως λένε και οι Αμερικανοί, τουλάχιστον μέχρι νεωτέρας και βλέπουμε... Οι χθεσινές οδηγίες του ΝΒΑ που τίθενται σε εφαρμογή από τις 8 Μαΐου (με το άνοιγμα των γηπέδων) είναι σαφείς: οι παίκτες θα φορούν μάσκες και γάντια κατά την είσοδό τους, θα προπονούνται ταυτόχρονα σε γκρουπ των τεσσάρων και μάλιστα τηρώντας τις αποστάσεις, δεν επιτρέπεται να έρχονται σε επαφή και επίσης απαγορεύεται να γυμνάζονται σε δημόσιους χώρους εκτός των εγκαταστάσεων των ομάδων. Ποτέ άλλοτε στην ιστορία, το περιβόητο spacing που αποτελεί μια εκ των ων ουκ άνευ αγωνιστική συνθήκη δεν είχε τέτοια πέραση στο μπάσκετ: αυτό θα πει τήρηση των αποστάσεων και μένει να φανεί μέχρι πότε θα εφαρμόζεται με θρησκευτική ευλάβεια... «Τι να κάνουμε δηλαδή; Να απαγορεύσουμε την άμυνα man to man και να υποχρεώσουμε όλες τις ομάδες να παίζουν παθητική ζώνη;» αναρωτήθηκε δίκην αυτοσαρκασμού μιλώντας προς «ΤΑ ΝΕΑ» ο Γιώργος Βασιλακόπουλος. Προφανώς το μπάσκετ ως ομαδικό άθλημα κλειστού χώρου και αλλεπάλληλων επαφών έχει τις δικές του ιδιαιτερότητες, ενώ ακόμη και η κεκλεισμένων των θυρών διεξαγωγή των αγώνων απαιτεί την παρουσία περίπου εκατό ανθρώπων σε αναπόφευκτες οργανικές θέσεις. Τη στιγμή που ο ΕΣΑΚΕ έχει αποφασίσει εδώ και έναν μήνα να βάλει οριστικά λουκέτο στην Basket League και αναμένει τη νομοθετική ρύθμιση, η Ομοσπονδία τηρεί στάση αναμονής, με το επιπρόσθετο βάρος της προαγωγής δυο ομάδων από το (δικό της) πρωτάθλημα της Α2. Τι μέλλει γενέσθαι σε αυτή την υπόθεση; «Εφόσον οι υγειονομικές Αρχές και η επιστημονική επιτροπή που έχει συσταθεί ανάψουν το πράσινο φως και αναλάβουν την ευθύνη, εμείς δεν είμαστε αρνητικοί στη συνέχιση και στην ολοκλήρωση των πρωταθλημάτων» απαντά ο πρόεδρος της ΕΟΚ. Σε κάθε περίπτωση, σε όλο τον κόσμο και όχι μονάχα στα ελληνικά πρωταθλήματα, μια λέξη κυριαρχεί και προσδιορίζει την κατάσταση... Αβεβαιότης!",https://www.tanea.gr/print/2020/04/29/sports/t16to-spacing-lfkai-i-amyna-man-to-mant16/
Sports,tanea.gr,Ολυμπιακός : Αυτοσχέδιο γυμναστήριο με θέα για τον Γκασπάρ,29 Απριλίου 2020 | 11:13,tanea.gr,Οι ποδοσφαιριστές του Ολυμπιακού συνεχίζουν τις ατομικές προπονήσεις στο σπίτι ώστε να διατηρούνται σε καλή φυσική κατάσταση ενόψει της επανέναρξης του πρωταθλήματος. Αυτό έκανε ο Μπρούνο Γκασπάρ που έβγαλε όλα τα όργανα στο μπαλκόνι και συνέχισε εκεί το καθημερινό του πρόγραμμα. Δείτε τη φωτογραφία που ανάρτησε ο ίδιος στο instagram:  ,https://www.tanea.gr/2020/04/29/sports/football/olympiakos-aytosxedio-gymnastirio-me-thea-gia-ton-gkaspar/
Sports,tanea.gr,Φάρμακο ή ματαίωση,29 Απριλίου 2020 | 05:00,tanea.gr,"Από την αναβολή των Ολυμπιακών Αγώνων του Τόκιο στη ματαίωσή τους ένα φάρμακο δρόμος. Η 32η Ολυμπιάδα ίσως γίνει η πρώτη διοργάνωση μετά τον Β' Παγκόσμιο Πόλεμο που θα ματαιωθεί. Σε αντίθεση με ό,τι υποστήριζαν οι ιάπωνες διοργανωτές μέχρι τον περασμένο μήνα, πριν αναγκαστούν να αναβάλουν για έναν χρόνο τους Αγώνες, σήμερα εμφανίζονται απαισιόδοξοι για το μέλλον τους στην περίπτωση που μέχρι το επόμενο καλοκαίρι δεν βρεθεί αποτελεσματικό φάρμακο για τον Covid-19. Ο επικεφαλής της οργανωτικής επιτροπής Γιοσίρο Μόρι δεν δίστασε να δηλώσει πως οι Ολυμπιακοί Αγώνες θα ματαιωθούν αν δεν μπορούν να διεξαχθούν και το 2021. «Στο παρελθόν, όταν υπήρχαν τέτοια προβλήματα, όπως τα χρόνια του πολέμου, ματαιώνονταν οι Αγώνες. Αυτή τη φορά πολεμάμε έναν αόρατο εχθρό». Ο Μόρι πρόσθεσε: «Πρόκειται για ένα στοίχημα της ανθρωπότητας. Αν ο κόσμος θριαμβεύσει ενάντια στον ιό και μπορούμε να διοργανώσουμε τους Αγώνες, τότε αυτοί θα είναι πιο πολύτιμοι σε σχέση με τις προηγούμενες διοργανώσεις». Ο εκπρόσωπος του Τόκιο 2020 Μάσα Τακάγια αρνήθηκε να σχολιάσει την πιθανότητα ματαίωσης των Αγώνων και περιορίστηκε να πει πως οι δηλώσεις του Μόρι εκφράζουν προσωπικές απόψεις. Με τις θέσεις του Μόρι ταυτίζεται ωστόσο ο επικεφαλής της Ιατρικής Ενωσης της Ιαπωνίας, Γιοσιτάκε Γιοκομούρα, ο οποίος επισήμανε πως θα είναι πολύ δύσκολο να φιλοξενήσει τους Αγώνες το Τόκιο αν δεν βρεθεί ένα αποτελεσματικό φάρμακο για τον νέο κορωνοϊό. «Τα κρούσματα σε όλο τον κόσμο στη συγκεκριμένη στιγμή θα είναι βασικό ζήτημα. Θα είναι δύσκολο ακόμα κι αν η κατάσταση στην Ιαπωνία βελτιωθεί αλλά στον υπόλοιπο κόσμο συνεχίζεται η διασπορά», υπογράμμισε ο ιάπωνας επιστήμονας.",https://www.tanea.gr/print/2020/04/29/sports/farmako-i-mataiosi/
Sports,tanea.gr,Σαραβάκος : Ένα βήμα μπροστά ο ΠΑΟ – Ο Δώνης μοχθεί για το καλύτερο της ομάδας,17 Απριλίου 2020 | 12:45,tanea.gr,"Συνέντευξη στην εφημερίδα «Πράσινη» παραχώρησε ο Δημήτρης Σαραβάκος και μεταξύ άλλων αναφέρθηκε στο φετινό Παναθηναϊκό, ενώ μίλησε με τα καλύτερα λόγια για τον Γιώργο Δώνη και τα όσα πέτυχε με την ομάδα. Απόσπασμα από όσα είπε: Αγωνιστικά για την ομάδα πώς είδες τη σεζόν; «Ανάλογα και με τις συνθήκες, εμένα μου είναι δύσκολο να πω πως ήταν επιτυχημένη χρονιά. Δεν ξέρω ποια θέση θα παίρναμε, αλλά έχω στο μυαλό μου τον Παναθηναϊκό σε άλλα επίπεδα. Ξέρω βέβαια πως τώρα οι συνθήκες είναι πιο δύσκολες. Γενικά νομίζω πως η ομάδα ήταν μέσα στους στόχους της». Τι ήταν αυτό που σου άρεσε; «Ήμασταν βελτιωμένοι σε σχέση με την περσινή σεζόν. Κάναμε ένα βήμα μπροστά, αν και δεν είχαμε καλό ξεκίνημα. Το καλύψαμε λίγο πριν ξεκινήσει ο δεύτερος γύρος και μετά». Αν γίνουν σωστές κινήσεις θεωρείς πως η ομάδα την ερχόμενη σεζόν μπορεί να είναι ένα… κλικ καλύτερη; «Εξαρτάται… Οι επιλογές παίζουν μεγάλο ρόλο σε μια ομάδα. Να είναι στοχευμένες και να σου φέρουν το καλύτερο αποτέλεσμα, άρα να πας έτσι ένα σκαλοπάτι πιο πάνω». Άρα πρέπει να γίνουν σωστές επιλογές και κυρίως στους ξένους; «Εννοείται. Όταν έχεις κι ένα μπάτζετ μέτριο, μιλάμε πάντα για τον Παναθηναϊκό, δεν πρέπει να έχεις πολλές αποτυχίες στις επιλογές σου. Να είναι στοχευμένες και με μεγάλο ποσοστό επιτυχίας». Ποιος πιστεύεις πως πρέπει να είναι ο στόχος την επόμενη περίοδο; «Εξαρτάται. Όπως είναι η πραγματικότητα, μόνο οι στοχευμένες επιλογές μετρούν. Αυτή τη στιγμή δεν ξέρω αν μπορούμε να διεκδικήσουμε κάτι άλλο. Αν καταφέρουμε να βελτιωθούμε, μπορούμε να κυνηγήσουμε περισσότερα πράγματα βαθμολογικά. Εκεί που θα τερμάτιζες πέμπτος για παράδειγμα, να πας τρίτος ή δεύτερος». Είπες πως δεν μπορείς να είσαι ευχαριστημένος σύμφωνα με τον Παναθηναϊκό που εσύ ξέρεις… «Πρέπει να μιλάμε για το σήμερα. Εγώ επειδή υπήρξα ποδοσφαιριστής του Παναθηναϊκού, γνωρίζω την ιστορία και τις επιτυχίες, όχι μόνο τις δικές μου αλλά κι άλλων παικτών μετά από μένα. Έχουμε το μυαλό μας πίσω, αλλά δεν μπορούμε να το συνδυάζουμε με το τώρα. Ανάλογα με τις τωρινές συνθήκες ο Παναθηναϊκός είναι καλά. Δεν είναι αυτό που όλοι μας θέλουμε, αλλά είναι καλά». Σε «πονάει» η κατάσταση της ομάδας, που δεν μπορεί να διεκδικήσει πρωτάθλημα, δεν μπορεί να κάνει πορεία στην Ευρώπη; «Για μένα το μεγαλύτερο πλήγμα είναι πως δεν μπορούμε να παίξουμε στην Ευρώπη. Από εκεί και πέρα δεν είναι τι σκέφτομαι εγώ ή όποιος άλλος μετά από μένα που είχε επιτυχίες. Πρέπει να κοιτάξουμε το σήμερα. Να κοιτάμε την πραγματικότητα. Δηλαδή έχουμε δύο ομάδες οι οποίες έχουν τεράστιο μπάτζετ, όπως ο ΟΣΦΠ και ο ΠΑΟΚ, που για να μπορέσεις να τους αντιμετωπίσεις χρειάζεσαι κι εσύ περισσότερα… όπλα. Αν τα έχουμε αυτά, ίσως να μπούμε ανάμεσά τους. Αν δεν τα έχουμε, είναι πολύ δύσκολο». Ποια η άποψή σου για τον Δώνη; «Μέσα σε τόσο δύσκολες αγωνιστικές συνθήκες, το γεγονός πως η δεύτερη είναι καλύτερη απ’ την πρώτη σεζόν τα λέει όλα. Είναι ένα παιδί που αγαπά τον Παναθηναϊκό, είναι Παναθηναϊκός και κάνει κάθε προσπάθεια για το καλύτερο της ομάδας».  ",https://www.tanea.gr/2020/04/17/sports/football/saravakos-ena-vima-mprosta-o-pao-o-donis-moxthei-gia-to-kalytero-tis-omadas/
Sports,tanea.gr,Δύο τάσεις στη Λίγκα,29 Απριλίου 2020 | 05:00,tanea.gr,"Θα συνεχιστεί η αγωνιστική δράση στην Ελλάδα; Θα μπορέσουν οι ομάδες να επιστρέψουν άμεσα στην κανονικότητα διεκδικώντας το δικαίωμα της ολοκλήρωσης της φετινής αγωνιστικής σεζόν; Ή μήπως τελικά το lockdown έχει ήδη θέσει τέτοια δεδομένα που θα κρατήσει την μπάλα κλειδωμένη στα αποδυτήρια μέχρι τον Σεπτέμβρη; Βασικές ερωτήσεις με θέα στο χορτάρι του ελληνικού ποδοσφαίρου. Και δύο κυρίαρχες τάσεις λίγο πριν από τη σημερινή κρίσιμη τηλεδιάσκεψη της Σούπερ Λίγκας (12.00). Μια πολύ αισιόδοξη και μια πλασμένη για να πατά τα πόδια της στη Γη. Μεταξύ μας: Ευτυχώς από τη λίστα απουσιάζει η τρίτη εναλλακτική, εκείνη της απαισιοδοξίας. Διότι άπαντες έχουν πλέον καταλάβει το αυτονόητο. Πως πρέπει να εξαντληθούν όλα τα περιθώρια προκειμένου να ξαναρχίσει το παιχνίδι. Σήμερα λοιπόν τα σπουδαία. Με την τηλεδιάσκεψη του συνεταιρισμού να επιχειρεί να σχηματίσει ένα πλάνο για την επιστροφή στην αγωνιστική δράση. Χθες ο πρόεδρος της Σούπερ Λίγκας, Μηνάς Λυσσάνδρου, συμμετέχοντας σε άλλη τηλεδιάσκεψη (του υφυπουργού Λευτέρη Αυγενάκη με τους προέδρους των ομοσπονδιών, αλλά και των λιγκών) ζήτησε από τον υφυπουργό Αθλητισμού να προστεθεί και το ποδόσφαιρο στη λίστα με τα σπορ που θα μπορούν να ξαναπάρουν μπρος σύντομα. Από τις 4 Μαΐου, που όπως ανακοίνωσε χθες ο Πρωθυπουργός επιτρέπεται και πάλι η ατομική άθληση σε ανοιχτούς χώρους. Η Ελλάδα τα κατάφερε καλά στο... στοίχημα ζωής που επέβαλε αυτή η πανδημία. Θεωρείται παράδειγμα προς μίμηση ο χειρισμός της κατάστασης. Και προνόμιο ότι πριν φτάσουμε στον Μάη είμαστε πια σε περίοδο σταδιακής άρσης των μέτρων. Από τη στιγμή που η κυβέρνηση ξεκίνησε ήδη αυτή την προσπάθεια, και σε αυτή δεν σηκώθηκε απαγορευτικό για την επιστροφή στο ποδόσφαιρο, οι ομάδες έχουν την κατάσταση στα χέρια τους. Ισως θα χρειαστεί να περιμένουν και άλλο. Ισως ξεκινήσουν εκ νέου το πρωτάθλημα αργότερα σε σχέση με τα σενάρια που κυκλοφόρησαν τις τελευταίες εβδομάδες. Ακόμη όμως διατηρούν τον έλεγχο. Και αυτό στη δεδομένη χρονική στιγμή είναι αληθινό πλεονέκτημα. Για τη σημερινή τηλεδιάσκεψη έχουν ακουστεί πολλά. Οτι θα προταθεί η συνέχεια μόνο των πλέι οφ (για τις θέσεις 1-6) αλλά όχι και τα πλέι άουτ. Οτι μπορεί τα ματς των πλέι οφ να γίνουν μαζεμένα (κάθε τρεις ημέρες) στο σύμπλεγμα Λαμία, Βόλος, Λάρισα ώστε να μειωθούν οι μετακινήσεις των αποστολών. Οτι μπορεί κάλλιστα να προκύψει ως και πρόταση αναδιάρθρωσης (με τις ευλογίες του ΠΑΟΚ) ώστε του χρόνου το πρωτάθλημα να διεξαχθεί με 18 ομάδες. Τίποτε από όλα αυτά όμως δεν είναι κάτι παραπάνω από... σενάρια. Λογικά από το απόγευμα θα είμαστε σε θέση να πληροφορηθούμε και ποια ευσταθούν... n Χθες πάντως ο Λευτέρης Αυγενάκης σήμανε την επιστροφή σταδιακά στην αθλητική κανονικότητα, και για τα σπορ δηλαδή, εκτός ποδοσφαίρου.  ",https://www.tanea.gr/print/2020/04/29/sports/dyo-taseis-sti-ligka/
