subtopic,website,title,date,author,text,url
Sports,tanea.gr,Καραπαπάς: «Πανάξια πρώτος εναντίον όλων ο Ολυμπιακός»,29 Απριλίου 2020 | 13:45,tanea.gr,"Ο Κώστας Καραπαπάς αναφέρθηκε στο φετινό πρωτάθλημα και την πανάξια πρώτη θέση που βρίσκεται ο Ολυμπιακός, ο οποίος απέναντι σε όλους και σε όλα τερμάτισε στην κορυφή. Ο αντιπρόεδρος των ερυθρόλευκων εξέφρασε την περηφάνια του με ανάρτηση του στο Facebook για όσα πέτυχε και πετυχαίνει ο Ολυμπιακός τη φετινή σεζόν, τονίζοντας μεταξύ άλλων πως οι Πειραιώτες είναι «πρώτοι σε ένα πρωτάθλημα που είχε κόντρα τη διαιτησία και έπαιζε με ομάδες-καμικάζι που με άλλους έπαιζαν φιλικά!». Αναλυτικά όσα έγραψε ο Κώστας Καραπαπάς:ΕΠΕΙΔΗ ΜΑΛΛΟΝ ΔΕΝ ΤΟ ΕΧΟΥΝ ΚΑΤΑΛΑΒΕΙ ΚΑΠΟΙΟΙ: 1. Ο ΟΛΥΜΠΙΑΚΟΣ ΤΕΡΜΑΤΙΣΕ 1ος πανάξια με 7 βαθμούς διαφορά σε ένα Πρωτάθλημα που είχε κόντρα τη διαιτησία και έπαιζε με ομάδες-καμικάζι που με άλλους έπαιζαν φιλικά! Οι 7 βαθμοί έγιναν 14 λόγω της αποδεδειγμένης πλέον πολυιδιοκτησίας ΠΑΟΚ-Ξάνθης, υπόθεσης που κρίθηκε σε 2 βαθμούς της Ελληνικής Δικαιοσύνης και απο μια Ανεξάρτητη Αρχή. Κανονικά έπρεπε μα μείνουν 7 και οι δυο ομάδες να ΥΠΟΒΙΒΑΣΤΟΥΝ όπως προβλεπόταν. Αλλά τους έσωσε η κυβέρνηση και αυτό το ξέρουν και οι ίδιοι ότι και να λένε! 2. Ο ΟΛΥΜΠΙΑΚΟΣ τερμάτισε πρώτος ενώ ταυτόχρονα έδινε μάχες ΜΟΝΟΣ για το ελληνικό ποδόσφαιρο όταν οι άλλοι είχαν ξεκούραση ή πέρναγαν τις ώρες τους να αγοράσουν κάποιον βλαχοπρόεδρο ή να στήσουν καμμιά σκευωρία της πλάκας. Ο ΟΛΥΜΠΙΑΚΟΣ τσάκισε και απεκλεισε ομάδες που πρωταγωνιστούν σε πρωταθλήματα πιο πλούσια απο το ελληνικό όπως η Κράσνονταρ (Ρωσία) και η Μπασάκσεχίρ (Τουρκία) για να προκριθεί στους ομίλους του Champions League. Εκεί που άλλοι ΔΕΝ ΕΧΟΥΝ ΠΡΟΚΡΙΘΕΙ ΠΟΤΕ ΣΤΗ ΖΩΗ ΤΟΥΣ και ας παριστάνουν τη μεγάλη ομάδα. Στους ομίλους ο ΟΛΥΜΠΙΑΚΟΣ έπαιξε σαν ισάξιος θηρία όπως η Μπάγερν και η Τότεναμ και απέκλεισε τους Πρωταθλητες Σερβίας, τον Ερυθρό Αστέρα. Στην συνέχεια ήρθε το ΕΠΟΣ του Έμιρειτς παρά το κακό αποτέλεσμα στον Πειραιά. ΜΟΝΟ ο ΟΛΥΜΠΙΑΚΟΣ μπορούσε να κάνει αυτό το θαύμα και το έκανε! Έφτασε στους «16» και το ταξίδι συνεχίζεται… 3. Ο ΟΛΥΜΠΙΑΚΟΣ έκανε όλα τα παραπάνω την στιγμή που χτυπήθηκε απο μεγάλες ατυχίες με τραυματισμούς και απώλειες βασικών ποδοσφαιριστών! Κάποιοι έχουν ξεχάσει, αλλά να θυμίσουμε ότι το καλοκαίρι στην προετοιμασία έχασε τον αρχηγό του και καλύτερο Έλληνα ποδοσφαιριστή Κώστα Φορτούνη για όλη σχεδόν τη χρονιά. Ο ΟΛΥΜΠΙΑΚΟΣ ΕΙΝΑΙ ΠΡΩΤΟΣ ΣΤΗ ΣΥΝΕΙΔΗΣΗ ΟΛΩΝ ΤΩΝ ΕΛΛΗΝΩΝ ΦΙΛΑΘΛΩΝ, ΑΚΟΜΑ ΚΑΙ ΤΩΝ ΑΝΤΙΠΑΛΩΝ ΠΑΝΑΞΙΑ. ΚΑΙ εμάς, όλους τους ΟΛΥΜΠΙΑΚΟΥΣ μας γεμίζει υπερηφάνεια αυτή η χρονιά γιατί ξέρουμε ότι όλοι οι δρόμοι ήταν ΣΤΗΜΕΝΟΙ με μπλόκα, αλλά τα σπάσαμε, περάσαμε, θριαμβεύσαμε και θα θριαμβεύσουμε και στην συνέχεια. ΘΡΥΛΕ ΜΟΥ Η ΖΩΗ… Δείτε την ανάρτηση Καραπαπά: ΕΠΕΙΔΗ ΜΑΛΛΟΝ ΔΕΝ ΤΟ ΕΧΟΥΝ ΚΑΤΑΛΑΒΕΙ ΚΑΠΟΙΟΙ:1. Ο ΟΛΥΜΠΙΑΚΟΣ ΤΕΡΜΑΤΙΣΕ 1ος πανάξια με 7 βαθμούς διαφορά σε ένα… Δημοσιεύτηκε από  Konstantinos Karapapas  στις  Τετάρτη, 29 Απριλίου 2020",https://www.tanea.gr/2020/04/29/sports/football/karapapas-panaksia-protos-enantion-olon-o-olympiakos/
Sports,tanea.gr,Χασάν : Μου λείπει το ποδόσφαιρο,18 Απριλίου 2020 | 12:25,tanea.gr,"Ο κοροναϊός έχει παγώσει κάθε αθλητική δραστηριότητα στην Ελλάδα, αλλά και στις περισσότερες χώρες του κόσμου, με τις ομάδες να μην μπορούν να κάνουν ούτε προπόνηση λόγω της καραντίνας που έχει επιβληθεί. Πλέον οι ποδοσφαιριστές έχουν άπλετο χρόνο στα σπίτια τους, και ο Αχμέντ Χασάν βρήκε έναν τρόπο να σκοτώνει την ώρα του. Συγκεκριμένα, ο αιγύπτιος φορ του Ολυμπιακού δημιούργησε ένα βίντεο με τις καλύτερες στιγμές του με την ερυθρόλευκη φανέλα και το ανέβασε στο Instagram, γράφοντας πόσο του λείπει το ποδόσφαιρο. Δείτε το βίντεο: https://www.instagram.com/tv/B_GBi7igd1p/?igshid=q0a76wspkt2t&fbclid=IwAR0l9O5ozEgPJGCMczHubDdahgjbYcZ9LNWi4ejAZ85_l03WDp3nDndUFt4  ",https://www.tanea.gr/2020/04/18/sports/xasan-mou-leipei-to-podosfairo/
Sports,tanea.gr,Superleague: Εισήγηση των ομάδων στην ΕΠΟ για κατάργηση του -6 σε περίπτωση μη αδειοδότησης,29 Απριλίου 2020 | 15:53,tanea.gr,"Νωρίτερα ο Γιάννης Αλαφούζος ζήτησε πλήρη απάλειψη ποινών σε περίπτωση μη αδειοδοτημένων ΠΑΕ και έπειτα από ψηφοφορία, η Σούπερ Λίγκα αποφάσισε να εισηγηθεί στην ΕΠΟ να καταργηθεί το -6 στις ομάδες που δεν καταφέρνουν να πάρουν αδειοδότηση. Υπέρ ψήφισαν οι ΑΕΚ, ΑΕΛ, Άρης, Αστέρας, Παναθηναϊκός, Πανιώνιος, Λαμία, Ολυμπιακός. Αντίθετα, να υπάρχει μεν ποινή, αλλά μικρότερη απ’ αυτή που υπήρχε, δηλαδή το -6 να γίνει -3, πρότειναν οι ΠΑΟΚ, Ξάνθη, Παναιτωλικός, Βόλος, Ατρόμητος, ΟΦΗ. Λευκό ψήφισε η ΕΠΟ. Από ‘κει και πέρα, όσον αφορά τους περιορισμούς των μεταγραφών στις ομάδες που δεν παίρνουν αδειοδότηση, είχαμε… ντέρμπι στην ψηφοφορία και επί της ουσίας η ψήφος της ΕΠΟ έκρινε το αποτέλεσμα, το οποίο είναι πως παραμένουν οι περιορισμοί, αφού οι ομάδες ήταν χωρισμένες (7 υπέρ, 7 κατά). Υπέρ της ισχύς των περιορισμών ψήφισαν οι Αστέρας, Ατρόμητος, Βόλος, Ξάνθη, ΟΦΗ, Παναιτωλικός, ΠΑΟΚ, ΕΠΟ και κατά οι ΑΕΚ, ΑΕΛ, Άρης, Ολυμπιακός, Παναθηναϊκός, Πανιώνιος, Λαμία.  ",https://www.tanea.gr/2020/04/29/sports/football/superleague-eisigisi-ton-omadon-stin-epo-gia-katargisi-tou-6-se-periptosi-mi-adeiodotisis/
Sports,tanea.gr,Στο CAS για την πολυϊδιοκτησία ΠΑΟΚ - Ξάνθης,29 Απριλίου 2020 | 05:00,tanea.gr,"Οριστικό. Και κυρίως: Αληθινό. Μια υπόθεση που φτάνει ως το τέλος του δρόμου. Στην προκειμένη περίπτωση ως τη Λωζάννη και το Ανώτατο Αθλητικό Δικαστήριο. Σύμφωνα με πληροφορίες ο Ολυμπιακός έκανε πράξη το νόμιμο δικαίωμά του. Και πλέον το σκάνδαλο της πολυϊδιοκτησίας θα συζητηθεί στο CAS. Οι Ερυθρόλευκοι προσέφυγαν εις βάρος της απόφασης της ελληνικής αθλητικής Δικαιοσύνης, που ενώ διαπίστωσε πως ο ΠΑΟΚ και η Ξάνθη από το καλοκαίρι του '18 συμμετέχουν στη Σούπερ Λίγκα έχοντας τον ίδιο ιδιοκτήτη (Ιβάν Σαββίδη) καταπατώντας κάθε έννοια ανταγωνισμού, τιμωρήθηκαν μόνο με αφαίρεση επτά βαθμών. Τιμωρία που επί της ουσίας προέκυψε χαριστικά μέσα από την τροπολογία της κυβέρνησης της Νέας Δημοκρατίας, η οποία μετά τη διαπίστωση της παράβασης από την Επιτροπή Επαγγελματικού Αθλητισμού άλλαξε τον νόμο μετατρέποντας τη ποινή της πολυϊδιοκτησίας σε αφαίρεση βαθμών, από υποβιβασμό. Η κυβέρνηση άλλαξε τον νόμο στα τέλη Γενάρη, ενώ το πρωτάθλημα είχε φτάσει ήδη στα μισά του δρόμου. Και η τροπολογία ψηφίστηκε με αναδρομική ισχύ: φωτογραφικά για την περίπτωση. Το CAS δεν... ελέγχεται από καμία κυβέρνηση και καμία τροπολογία. Θα εξετάσει την υπόθεση με βάση τους κανόνες της UEFA. Και στη διεθνή ομοσπονδία κάθε κουβέντα πολυϊδιοκτησίας που αυτομάτως δημιουργεί... σκέψεις και άλλων παράνομων πράξεων (στοιχηματισμός) επισύρει την ποινή του υποβιβασμού. Ουσιαστικά λοιπόν καταλαβαίνει ο καθένας πως πλέον ο ΠΑΟΚ και η Ξάνθη πηγαίνουν στο CAS έχοντας απέναντί τους ακόμη και αυτό το ενδεχόμενο. Τον άμεσο υποβιβασμό τους στη δεύτερη κατηγορία. Για μια υπόθεση επιβεβαιωμένη από την ελληνική αθλητική Δικαιοσύνη και όχι μόνο (το Δικαστικό Εφετείο αλλά και το ΣτΕ αρνήθηκαν το παράνομο αίτημα του ΠΑΟΚ για «προσωρινή διαταγή» από τα πολιτικά δικαστήρια όπως ίσως θυμάστε).Κίνηση αλτρουισμού Την ίδια στιγμή και μια άλλη κίνηση των Πειραιωτών επιβεβαιώνει εμφατικά το ενδιαφέρον τους συνολικά για το ελληνικό ποδόσφαιρο. Ο Ολυμπιακός έστειλε χθες μια επιστολή προς τη Σούπερ Λίγκα με την οποία ζητά το ποσό των 4,3 εκατ. ευρώ που δίνει η UEFA ως βοήθεια στο ελληνικό ποδόσφαιρο να μην πάει στους... μισθούς των golden boys της ΕΠΟ, αλλά στις ομάδες που έχουν ανάγκη. Σε εκείνες που τερμάτισαν από την 5η ως τη 14η θέση στην τελική βαθμολογία της κανονικής περιόδου. Να μοιραστούν δηλαδή τα χρήματα σε όλες τις ομάδες πλην του Ολυμπιακού, του ΠΑΟΚ, της ΑΕΚ και του Παναθηναϊκού που έχουν το προνόμιο να διοικούνται από οικονομικά ισχυρούς ιδιοκτήτες. Η πρόταση του Ολυμπιακού θα προστεθεί στην ατζέντα της σημερινής τηλεδιάσκεψης της Σούπερ Λίγκας για την επανεκκίνηση του πρωταθλήματος.",https://www.tanea.gr/print/2020/04/29/sports/sto-cas-gia-lftin-polyidioktisia-lfpaok-ksanthis/
Sports,tanea.gr,Παναθηναϊκός : Το όνειρο του Γιασίν Αγιούμπ,18 Απριλίου 2020 | 15:40,tanea.gr,"Ο Γιασίν Αγιούμπ γεννήθηκε στην Αλ Χοσέιμα του Μαρόκο στις 6 Μαρτίου 1994, όμως το 2000 εγκαταστάθηκε στο Άμστερνταμ με τους γονείς του. Έχοντας τόσο την ολλανδική όσο και τη μαροκινή υπηκοότητα, ο Αγιούμπ είχε τη δυνατότητα να επιλέξει την εθνική του ομάδα. Κατά τη διάρκεια της ενηλικίωσής του ο Αγιούμπ φόρεσε τα χρώματα των «οράνιε». Στην κορύφωσή του, ο Αγιούμπ στέφθηκε πρωταθλητής Ευρώπης το 2011 με την Ολλανδία Κ17, έχοντας συμμετοχές σε όλη την πορεία εκτός από τον τελικό. Έπειτα από αυτήν τη διάκριση ο Αγιούμπ έπαιξε δύο φορές με την Ολλανδία Κ19 και άλλες δύο με την Ολλανδία Κ20. Κατόπιν, κλήθηκε να διαλέξει οριστικά πλέον ποια χώρα θα εκπροσωπήσει. Αφού διαπίστωσε ότι από τον ολλανδό ομοσπονδιακό τεχνικό δεν υπήρχε ενδιαφέρον, ο Αγιούμπ προτίμησε το Μαρόκο. Ο Αγιούμπ συνομίλησε με τον προπονητή της πατρίδας του, το γάλλο Χερβέ Ρενάρντ, ο οποίος ήθελε τις υπηρεσίες του. Εντέλει ο Ρενάρντ κάλεσε τον Αγιούμπ στην Εθνική ομάδα για την προετοιμασία για το Παγκόσμιο Κύπελλο του 2018, όμως ο ποδοσφαιριστής τραυματίστηκε και δεν αγωνίστηκε στη διοργάνωση. Ούτε καν το πρώτο φιλικό δεν πρόλαβε, ώστε να «γράψει» συμμετοχή με τη νέα Εθνική του. Ο Αγιούμπ είχε ως μεγάλο στόχο να καθιερωθεί στο Μαρόκο, αλλά δεν τα κατάφερε ως ποδοσφαιριστής της Φέγενορντ. Ο λόγος είναι απλός και ο ίδιος που οδήγησε στην αποδέσμευσή του τον Ιανουάριο του 2020. Ο Αγιούμπ δεν προσαρμόστηκε ποτέ στο Ρότερνταμ και δε θύμισε τον χαφ που εντυπωσίασε με την Ουτρέχτη. Πλέον ο Αγιούμπ έχει εγκατασταθεί στην Αθήνα και έχει ανοίξει ένα διαφορετικό κεφάλαιο στην καριέρα του. Όμως, το όνειρό του παραμένει: η καθιέρωση με το Μαρόκο και η παρουσία σε μεγάλες διεθνείς διοργανώσεις. Ο Αγιούμπ έχει τονίσει στον Τσάβι Ρόκα και στον Γιώργο Δώνη ότι επιθυμεί πάρα πολύ να τιμήσει τα χρώματα της πατρίδας του και θα επιδιώξει να το πετύχει μέσω του Παναθηναϊκού.",https://www.tanea.gr/2020/04/18/sports/panathinaikos-to-oneiro-tou-giasin-agioump/
Sports,tanea.gr,Τα δεδομένα για τον Χουλτ,29 Απριλίου 2020 | 05:00,tanea.gr,"Ο Νίκλας Χουλτ μετακόμισε από το Κορωπί στα Σπάτα τον Ιανουάριο του 2018, ύστερα από θητεία δύο χρόνων στον Παναθηναϊκό. Ο 30χρονος Σουηδός πήγε στην ΑΕΚ για το αριστερό άκρο της άμυνας,  υπογράφοντας συμβόλαιο 2,5 χρόνων, το οποίο λήγει το καλοκαίρι. Θα συνεχίσει στην ΑΕΚ; Αγνωστο προς το παρόν. Αρχικά, όλα έδειχναν πως η παραμονή του ήταν δύσκολη, καθώς δεν είχε γίνει καμία συζήτηση με τον Ιλια Ιβιτς για ενδεχόμενο ανανέωσης της συνεργασίας τους. Ο Χουλτ που έως τη διακοπή λόγω του κορωνοϊού είχε 13 συμμετοχές στη Σούπερ Λίγκα, θέλει να παραμείνει στην ΑΕΚ και η πρόθεσή του είναι να περιμένει. Ως εναλλακτική λύση έχει μία πρόταση από τον ΑΠΟΕΛ, καθώς στον πάγκο του είναι ο Μαρίνος Ουζουνίδης με τον οποίο είχαν συνεργαστεί στον Παναθηναϊκό. Μάλιστα, εκείνη την περίοδο ο Χουλτ δύσκολα έβγαινε από την ενδεκάδα. Από την άλλη πλευρά πάντως, στην ΑΕΚ δεν έχουν αποφασίσει ακόμα σχετικά με το μέλλον του σουηδού αμυντικού. Ολα θα κριθούν και από τη μεταγραφική αγορά και τη δυνατότητα να βρεθούν καλύτερες λύσεις. Ετσι, προς το παρόν ο Χουλτ δεν γνωρίζει ποιο θα είναι το μέλλον του στην ΑΕΚ, ωστόσο η ανανέωση της συνεργασίας τους είναι ένα σενάριο που «παίζει». Κατά συνέπεια το μόνο που μπορεί να κάνει είναι υπομονή. Θυμίζουμε ότι πριν έρθει στην Αθήνα, ο 30χρονος Σουηδός είχε δύο «γεμάτες» σεζόν στο γαλλικό πρωτάθλημα με τη φανέλα της Νις.  ",https://www.tanea.gr/print/2020/04/29/sports/ta-dedomena-gia-ton-xoult/
Sports,tanea.gr,Κόντρα κυβέρνησης - λίγκας στην Ιταλία,29 Απριλίου 2020 | 05:00,tanea.gr,"Στην Ιταλία ο υπουργός Αθλητισμού Βιτσέντζο Σπανταφόρα δήλωσε πως οι ομάδες μπορεί να αρχίσουν προπονήσεις στις 18 Μαΐου, αλλά αυτό δεν σημαίνει πως θα συνεχιστεί το πρωτάθλημα. Η λίγκα απάντησε ότι αν τα παιχνίδια δεν ξεκινήσουν στις 14 Ιουνίου, τότε η σεζόν θα διακοπεί οριστικά. Απειλεί επίσης την κυβέρνηση με μηνύσεις.",https://www.tanea.gr/print/2020/04/29/sports/kontra-kyvernisis-ligkas-stin-italia/
Sports,tanea.gr,Οι ποδοσφαιριστές στη Γαλλία φοβούνται να παίξουν χωρίς εγγυήσεις για την υγεία τους,18 Απριλίου 2020 | 13:25,tanea.gr,"Η συντριπτική πλειονότητα των επαγγελματιών ποδοσφαιριστών που αγωνίζονται στη Γαλλία αντιτίθεται στην επανέναρξη του σαμπιονά τον Ιούνιο, καθώς -όπως είναι φυσιολογικό- θέτουν σε προτεραιότητα την υγεία και την ασφάλειά τους. Αυτό προκύπτει μετά την τηλεδιάσκεψη που έγινε το τελευταίο διήμερο από τα μέλη της UNFP, η οποία συγκέντρωσε την -ανώνυμη- άποψη περίπου 1.000 συμμετεχόντων. Όπως έγινε γνωστό, ξεχωρίζουν δύο κύριες τάσεις. Περίπου το 75% προτάσσουν την υγεία και την ασφάλεια, απαντώντας στην ερώτηση για την επανέναρξη τον Ιούνιο, δηλώνοντας πως δε θέλουν να ξαναπαίξουν χωρίς εγγυήσεις. Παράλληλα, περίπου το 80% των ερωτηθέντων προτιμά να παραμείνουν ως έχουν οι βαθμολογίες που διαμορφώθηκαν μετά τη διεξαγωγή της 27ης αγωνιστικής του σαμπιονά.  ",https://www.tanea.gr/2020/04/18/sports/oi-podosfairistes-sti-gallia-fovountai-na-paiksoun-xoris-eggyiseis-gia-tin-ygeia-tous/
Sports,tanea.gr,Σουλούκου : «Τα χρήματα της UEFA να πάνε στις ομάδες και όχι σε μισθούς ημετέρων»,29 Απριλίου 2020 | 12:21,tanea.gr,"Η UEFA έχει κάνει γνωστό πως θα μοιράσει ισόποσα στις ομοσπονδίες της χρήματα για την ενίσχυσή τους λόγω του κορωνοϊού και στην ΕΠΟ αναμένεται να έρθουν 4,3 εκατομμύρια ευρώ. Ο Ολυμπιακός με επιστολή του χθες ζήτησε τα χρήματα αυτά να πάνε στις ομάδες από την 5η θέση και κάτω ως ενίσχυση και το ίδιο μετέφερε σήμερα στην τηλεδιάσκεψη της Superleague και η Λίνα Σουλούκου. Συγκεκριμένα η εκπρόσωπος του Ολυμπιακού τοποθετήθηκε στο ΔΣ της Λίγκας λέγοντας πως τα χρήματα αυτά πρέπει να πάνε απευθείας σε ενίσχυση των ομάδων. «Τα χρήματα της UEFA πρέπει να μπουν απευθείας σε ενίσχυση των ομάδων που αντιμετωπίζουν προβλήματα. Και όχι για κατασπατάληση των μισθών των ημετέρων. Όλα αυτά τα χρόνια το επαγγελματικό ποδόσφαιρο συντηρεί την ΕΠΟ, ματώνοντας και καταβάλλοντας χαράτσια», είπε μεταξύ άλλων η Σουλούκου. Με την εκπρόσωπο του Ολυμπιακού συμφώνησαν οι εκπρόσωποι της Λάρισας, του Ατρόμητου και του Άρη.  ",https://www.tanea.gr/2020/04/29/sports/football/souloukou-ta-xrimata-tis-uefa-na-pane-stis-omades-kai-oxi-se-misthous-imeteron/
Sports,tanea.gr,"ΑΕΚ : Πώς μπορεί να εξοικονομήσει 1,5 εκατ. ευρώ για το ρόστερ της",29 Απριλίου 2020 | 09:27,tanea.gr,"Το φετινό καλοκαίρι θα είναι ιδιαίτερο. Οι καταστάσεις που βιώνουμε είναι τέτοιες, ώστε κανείς να μην μπορεί να προδικάσει πως θα εξελιχθούν τα πράγματα. Όπως γίνεται αντιληπτό αυτό θα επηρεάσει και τις ομάδες. Μιας και ο μεταγραφικός χάρτης είναι πιθανό να διαφοροποιηθεί αρκετά. Η ΑΕΚ είναι από τις ομάδες που θα κινηθεί με στόχο τις αλλαγές στο ρόστερ της. Διαβάστε περισσότερα  εδώ",https://www.tanea.gr/2020/04/29/sports/football/aek-pos-mporei-na-eksoikonomiseis-15-ekat-eyro-gia-to-roster-tis/
