subtopic,website,title,date,author,text,url
Food,iefimerida.gr,"Μένουμε σπίτι: 4+1 συνταγές για υπέροχα, γευστικά και αρωματικά κέικ",28 03 2020,iefimerida.gr,"Στα newsfeed του instagram, της γιαγιάς ή της μαμάς, το  κέικ  είναι ένα γλυκό που πάντα λαχταράμε.  Σοκολατένιο, με γλάσο ή με σιρόπι, είναι το τέλειο πρωινό, απογευματινό με τον καφέ ή και επιδόρπιο. Και τώρα που χρόνος υπάρχει αφού μένουμε σπίτι παίρνουμε τις κουτάλες μας και μαγειρεύουμε σπιτικές συνταγές κέικ που κάνουν το σπίτι να μυρίζει υπέροχα! Υλικά Για το γλάσο Εκτέλεση Βουτυρώνουμε μια φόρμα του κέικ με τρύπα και την αλευρώνουμε. Χτυπάμε στο μίξερ το βούτυρο με τη ζάχαρη μέχρι να αφρατέψει. Ρίχνουμε ένα-ένα τα αυγά και στο τέλος το λικέρ. Σε ένα μπολ ανακατεύουμε το αλεύρι, το μπέικιν πάουντερ, τη σόδα, τη βανίλια  Ρίχνουμε στον κάδο του μίξερ το 1/3 του αλευριού, συνεχίζουμε με το ½ του γιαουρτιού, ακόμα 1/3 αλευριού, ½ γιαουρτιού και τέλος το υπόλοιπο αλεύρι. Σταματάμε το μίξερ και με μια σπάτουλα σιλικόνης ανακατεύουμε απαλά το τριμμένο φουντούκι και την τεμαχισμένη κουβερτούρα. Ρίχνουμε το μείγμα στη φόρμα του κέικ και ψήνουμε σε προθερμασμένο φούρνο στους 170 βαθμούς αέρα για 60-70’. Τσεκάρουμε με οδοντογλυφίδα, αν βγαίνει στεγνή είναι έτοιμο. Αφού κρυώσει καλά το κέικ, φτιάχνουμε το γλάσο. Σε ένα μπολ ανακατεύουμε την άχνη ρίχνοντας σιγά σιγά το νερό για να πάρουμε ένα παχύρρευστο γλάσο.  Στρώνουμε στην επιφάνεια του κέικ και πασπαλίζουμε με φουντούκια ή και ψιλοκομμένη κουβερτούρα. Υλικά Για το σιρόπι Εκτέλεση Προθερμαίνουμε το φούρνο στους 175 βαθμούς. Βουτυρώνουμε και αλευρώνουμε τη φόρμα του κέικ.  Σε ένα μπολ ανακατεύουμε το αλεύρι, το baking powder, τη σόδα και το αλάτι και σε ένα δεύτερο μπολ το χυμό πορτοκαλιού με το αριάνι.  Χτυπάμε στο μίξερ το βούτυρο με τη ζάχαρη για λίγα λεπτά μέχρι να αφρατέψουν. Προσθέτουμε τα αυγά ένα-ένα και έπειτα το ξύσμα του πορτοκαλιού. Ρίχνουμε εναλλάξ σε τρεις δόσεις τα δύο μείγματα των στερεών και υγρών υλικών ανακατεύοντας συνεχώς.  Τέλος, παίρνουμε τα κομματάκια σοκολάτας, τα ανακατεύουμε με τις 2 κουταλιές αλεύρι για να μην κολλήσουν στην φόρμα και τα προσθέτουμε στο μείγμα του κέικ.  Ψήνουμε για 50 λεπτά περίπου μέχρι μια οδοντογλυφίδα να βγαίνει στεγνή από το εσωτερικό του κέικ.  Όσο το κέικ ψήνεται, ετοιμάζουμε το σιρόπι, ζεσταίνοντας λίγο το χυμό του πορτοκαλιού με τη ζάχαρη ίσα ίσα μέχρι να διαλυθεί. Μόλις το κέικ κρυώσει, ρίχνουμε από πάνω το σιρόπι με ένα κουτάλι. Υλικά  Για το σιρόπι Εκτέλεση Σε ένα μπολ κοσκινίζουμε το αλεύρι με το μπέικιν πάουντερ και ανακατεύουμε. Χτυπάμε στον κάδο του μίξερ το βούτυρο με τη ζάχαρη μέχρι να αφρατέψουν. Στη συνέχεια ρίχνουμε ένα ένα τα αυγά και προσθέτουμε το ξύσμα και το παπαρουνόσπορο. Σταδιακά ρίχνουμε τα στερεά υλικά και απαλά ανακατεύουμε. Αδειάζουμε στη φόρμα και ψήνουμε για περίπου 50′ στις αντιστάσεις. Στο μεταξύ ζεσταίνουμε σε χαμηλή φωτιά τη ζάχαρη με τον χυμό και το ξύσμα για να γίνουν σιρόπι . Όπως βγάζουμε καυτό το κέικ, το τρυπάμε σε διάφορα σημεία με οδοντογλυφίδα και το ραντίζουμε με το σιρόπι. Αφήνουμε να κρυώσει καλά και σερβίρουμε. Υλικά Εκτέλεση Βουτυρώνουμε ένα βαθύ ταψάκι και προθερμαίνουμε τον φούρνο στους 180οC. Σε μεγάλο μπολ αναμειγνύουμε το αλεύρι, τη ζάχαρη, 50 γρ. κακάο, το μπέικιν πάουντερ, το ξύσμα πορτοκαλιού και μια πρέζα αλάτι. Σε ξεχωριστό μπολ αναμειγνύουμε τα αυγά, το γάλα, το λιωμένο βούτυρο και τον χυμό πορτοκαλιού. Ενώνουμε το μείγμα στερεών υλικών με το μείγμα υγρών και ανακατεύουμε μέχρι να σχηματιστεί ένα απαλό μείγμα. Ρίχνουμε τα κομμάτια κουβερτούρας γάλακτος και ανακατεύουμε απαλά. Προσεκτικά ρίχνουμε το μείγμα στο ταψάκι. Σε μπολ ανακατεύουμε το βραστό νερό, με την καστανή ζάχαρη και 25 γρ. κακάο. Περιχύνουμε το μείγμα στο ταψί με το σοκολατένιο σιρόπι. Ψήνουμε στη μεσαία σχάρα του φούρνου για 30 λεπτά, μέχρι να σταθεροποιηθεί η επιφάνεια του κέικ. Σερβίρεται ζεστό για να ρέει η σοκολάτα από το εσωτερικό του κέικ.  Υλικά Εκτέλεση ﻿ Ανακατεύουμε με σύρμα το ταχίνι με το χυμό πορτοκαλιού. Προσθέτουμε τα υπόλοιπα υλικά εκτός από τις σταφίδες. Όταν η ζύμη μας είναι κάπως πηχτή αλευρώνουμε ελαφρά τις σταφίδες, τις προσθέτουμε στη ζύμη και ανακατεύουμε. Αλείφουμε με ελαιόλαδο μια φόρμα κέικ και πασπαλίζουμε με λίγο αλεύρι. Ρίχνουμε στο ταψί την ζύμη, να έχει πάχος περίπου 3 εκατοστά. Ψήνουμε σε προθερμασμένο φούρνο στους 160 C για περίπου 50 λεπτά στις αντιστάσεις.  Πασπαλίζουμε με άχνη ζάχαρη προαιρετικά και σερβίρουμε. Φωτογραφίες: Shutterstock",https://www.iefimerida.gr/gastronomie/5-syntages-gia-keik
subtopic,website,title,date,author,text,url
Food,iefimerida.gr,Συνταγή για σπιτικό γύρο -Εύκολος και πεντανόστιμος,29 04 2020,iefimerida.gr,"Με την καραντίνα να συνεχίζεται, η κουζίνα και οι  συνταγές  παραμένουν αγαπημένη δημιουργική απασχόληση. Παρακάτω βλέπουμε μια υπέροχη συνταγή για σπιτικό γύρο.  Μια λιχουδιά που σίγουρα θα λατρέψει όλη η οικογένεια και θα την φέρει και πιο κοντά μιας και η... συναρμολόγηση του τελικού πιάτου μοιάζει με παιχνίδι. Μια σχετικά εύκολη συνταγή η οποία απλά απαιτεί λίγο χρόνο για το μαρινάρισμα. Κατά τα άλλα διασκεδαστική. Ετοιμάστε παράλληλα  σπιτικές πίτες, για τις οποίες είδαμε πρόσφατα συνταγή , φτιάξετε μια  τηγανιά πατάτε ς, λίγο τζατζίκι, κόψτε κρεμμύδι, ντομάτα, λίγο μαϊντανό και ετοιμάστε ένα δείπνο που σίγουρα θα σας ξετρελάνει.  ΣΧΕΤΙΚΑ ΑΡΘΡΑ Υλικά συνταγής για σπιτικό γύρο 1 κιλό χοιρινή πανσέτα ψιλοκομμένο σε μικρά μικρά φετάκια Λίγο λάδι 2 κρεμμύδια 1 κουταλιά της σούπας ρίγανη 1 κουταλιά της σούπας πάπρικα 1 κουταλιά της σούπας μπαχάρι  1 κουταλιά της σούπας πικάντικη μουστάρδα 1 κουταλιά της σούπας μαϊντανός ψιλοκομμένος αλάτι πιπέρι  λίγο ξύδι ή λίγο τσίπουρο, αναλόγως τι προτιμάτε Εκτέλεση συνταγής για σπιτικό γύρο Περνάτε στο μπλέντερ το κρεμμύδι με το λάδι και το τσίπουρο ή το ξύδι Σε μια λεκανίτσα βάζετε το ψιλοκομμένο κρέας, όλα τα υπόλοιπα υλικά και το λιωμένο κρεμμύδι με το λάδι και το τσίπουρο ή το ξύδι για να μαριναριστούν.  Αφήνουμε το κρέας με τη μαρινάρα του για 2,5 με 3 ώρες στο ψυγείο.  Βγάζουμε το κρέας, το βάζουμε για λίγο σε απορροφητικό χαρτί.  Ζεσταίνουμε το τηγάνι μας σε μέτρια φωτιά.  Βάζουμε σταγόνες λάδι και στη συνέχεια το γύρο μας.  Προσοχή μην τον βάλετε όλο με τη μία.  Βάλτε τον σε δόσεις, για να τον ψήσετε καλά.  Ανακατεύετε συνεχώς το κρέας, χρειάζεται 10 λεπτά για να ψηθεί.  ﻿",https://www.iefimerida.gr/gastronomie/syntagi-gia-spitiko-gyro-eykolos-kai-pentanostimos
Food,iefimerida.gr,"Συνταγή για oreo cheesecake -Χωρίς ψήσιμο, με «τρελή» γεύση",29 04 2020,iefimerida.gr,"Η αλήθεια είναι πως το Cheesecake στην Ελλάδα έχει ταυτιστεί με  συνταγές  που δεν χρειάζονται ψήσιμο. Ωστόσο, αυτό το δροσερό γλυκό συνδυάζει δύο γλυκές αμαρτίες σε μία. Από τη μίαέχουμε την απόλυτη γεύση τυριού στηνκρέμα ενός γλυκού που έχει γίνει από ταδιασημότερα στον κόσμο και από την άλλη,το κλασικό μπισκότο oreo που προσφέρειμια γλυκιά (έχετε προσέξει τις αλμυρέςνότες που αφήνει;) αφορμή για δεκάδεςσυνταγές.Βίντεο: Δείτετη συνταγή για το απολαυστικό Cheesecakeoreo Όταν είδαμετην παρακάτω συνταγή κάτι μέσα μας είπεπως αυτό το γλυκό πρέπει να το δοκιμάσουμε.Δείτε την εικόνα και θα καταλάβετε.Υλικά ΣΧΕΤΙΚΑ ΑΡΘΡΑ 36 μπισκότα oreo  5 κ.σ. βούτυρο λιωμένο  800 γρ τυρί κρέμα  65 γρ ζάχαρη  1 βανίλια  1 φλιτζάνι γάλα (240ml)  1 κουταλιά ζελατίνη σε σκόνη (ή δυο φύλλα μουλιασμένα σε κρύο νερό) Εκτέλεση Χωρίζουμε τα μπισκότα από την κρέμα και κρατάμε στην άκρη. Βάζουμε τα μπισκότα σε σακούλα τροφίμων και θρυμματίζουμε με τη βοήθεια ενός πλάστη ή κάποιου γυάλινου μπουκαλιού. Κρατάμε 1/2 φλιτζάνι τριμμένο μπισκότο στην άκρη  Βάζουμε το υπόλοιπο μπισκότο σε ένα μπολ, αναμειγνύουμε με το λιωμένο βούτυρο και ανακατεύουμε καλά να νοτίσει. Μεταφέρουμε σε στρογγυλή φόρμα με αποσπώμενα πλαϊνά και πιέζουμε με το πίσω μέρος ενός κουταλιού να διαμορφώσουμε τη βάση  Σε ένα κατσαρολάκι προσθέτουμε το τυρί κρέμα, την κρέμα από τα μπισκότα, τη ζάχαρη, τη βανίλια και ανακατεύουμε να ενωθούν  Βάζουμε την ζελατίνη στο γάλα, που είναι χλιαρό – αν χρησιμοποιείτε φύλα, στραγγίζεται πρώτα καλά από το νερό – ανακατεύουμε καλά να διαλυθεί και προσθέτουμε στο μείγμα του τυριού. Αφού αρχίσει να κάνει φουσκάλες, αφαιρούμε από τη φωτιά.Γυρίζουμε την κρέμα τυριού, αφού κρυώσει ελαφρά πάνω από τη βάση μπισκότου και στρώνουμε με σπάτουλα. Αφήνουμε λίγο ακόμη να κρυώσει και να σταθεί  Πασπαλίζουμε το υπόλοιπο τριμμένο μπισκότο, μέσα από κόσκινο πάνω από την επιφάνεια του γλυκού.  ",https://www.iefimerida.gr/gastronomie/syntagi-gia-oreo-cheesecake
Food,iefimerida.gr,Συνταγή για εύκολο σοκολατένιο γλυκό ψυγείου ,29 04 2020,iefimerida.gr,"Είμαστε ακόμη σε καραντίνα και συνεχίζουμε να μαγειρεύουμε μανιωδώς. Μια πανεύκολη  συνταγή  για ένα διαφορετικό, σοκολατένιο γλυκό ψυγείου.  Τα γλυκά  ψυγείου η ελληνική οικογένεια τα λατρεύει και τώρα που ανοίγει ο καιρός δεν λείπουν από κανένα ψυγείο! Από εδώ έχουμε δει πολλές συνταγές για γλυκά ψυγείου, το  κλασικό με την φρυγανιά και το ζελέ , άλλα λίγο πιο πρωτότυπα όπως η  συνταγή  για τη χειμωνιάτικη εκδοχή του γλυκού ψυγείου με φρυγανιές.  Τώρα ήρθε η ώρα να δούμε ένα διαφορετικό γλυκό ψυγείου, μια συνταγή σχετικά εύκολη, με μόλις 5 υλικά. Σκέτη απόλαυση! ΣΧΕΤΙΚΑ ΑΡΘΡΑ Υλικά συνταγής για σοκολατένιο γλυκό ψυγείου 2 πακέτο μπισκότα σοκολάτας (πτι μπερ, μιράντα, ή κάποιο άλλο που προτιμάτε) 200 γραμμάρια βούτυρο λιωμένο 400 γραμμάρια τυρί κρέμα 500 γραμμάρια σοκολάτα 400 ml κρέμα γάλακτος Αυτή είναι η δόση για ένα κλασικό ορθογώνιο ταψί. Αν θέλετε να κάνετε μια στρογγυλή μέτρια φόρμα, μπορείτε να κάνετε τη συνταγή με τη μισή δόση.  Εκτέλεση συνταγής για σοκολατένιο γλυκό ψυγείου Ξεκινάμε τη συνταγή μας λιώνοντας σε μπεν μαρί τη σοκολάτα μας.  Σπάμε τα μπισκότα βάζοντάς τα σε ένα σακουλάκι και πιέζοντάς τα με τα χέρια μας.  Σε ένα τετράγωνο ταψάκι βάζουμε το μπισκότο μας προσθέτουμε και το λιωμένο βούτυρο και με ένα κουτάλι το ανακατεύουμε αρχικά για να ποτίσει με βούτυρο το μπισκότο και στη συνέχεια το απλώνουμε με τη βοήθεια του κουταλιού ομοιόμορφα στο ταψί μας.  Συνεχίζουμε τη συνταγή μας χτυπώντας στο μίξερ την κρέμα γάλακτος, η οποία πρέπει απαραιτήτως να είναι παγωμένη από το ψυγείο, σε σαντιγί.  Μόλις αφρατέψει η σαντιγί προσθέτουμε το τυρί κρέμα.  Με απαλές κινήσεις ενσωματώνουμε την λιωμένη σοκολάτα η οποία πρέπει να είναι χλιαρή προς κρύα.  Απλώνουμε την μους πάνω από το στρωμένο μπισκότο και το βάζουμε στο ψυγείο μέχρι να παγώσει.  Από πάνω ή τρίβουμε λίγο μπισκότο με λίγη άχνη ζάχαρη, ή κόβουμε μερικές φράουλες, ή κάποιο ξηρό καρπό που προτιμάμε όπως αμύγδαλο ή φουντούκι. ",https://www.iefimerida.gr/gastronomie/syntagi-gia-eykolo-sokolatenio-glyko-psygeioy
Food,iefimerida.gr,"Συνταγή για πίτα βουτύρου στο τηγάνι, με 3 υλικά -Ινδική Παράθα",28 04 2020,iefimerida.gr,"Οι πίτες αποτελούν αγαπημένο φαγητό όλων. Ξεφεύγοντας από τα συνηθισμένα βλέπουμε εδώ μια υπέροχη  συνταγή  για μια πίτα από την Ινδία. Παράθα λοιπόν.  Πρόκειται για μια συνταγή που βασίζεται στο αλεύρι και στο βούτυρο και μια συνταγή που μπορεί σαν παρασκευή να είναι εύκολη έχει κάποια δυσκολία στο άνοιγμα της πίτας.  ΣΧΕΤΙΚΑ ΑΡΘΡΑ Το βίντεο που συνοδεύει τη συνταγή λύνει όλες τις απορίες για να φτιάξετε την πίτα σας η οποία μπορεί να συνοδεύσει την αφράτη ομελέτά σας (δείτε μια  συνταγή  εδώ) ή τις υπέροχες και δυναμωτικές φακές (πρόσφατα είδαμε μια  συνταγή για φακές όπως τις φτιάχνουν στο Μαρόκο ).  Υλικά συνταγής για Παράθα, πίτα βουτύρου 3 κούπες αλεύρι για όλες τις χρήσεις +έξτρα για το άνοιγμα  1 αυγό βούτυρο  αλάτι νερό σε θερμοκρασία δωματίου Εκτέλεση συνταγής για Παράθα, Πίτα Βούτυρου Ξεκινάμε τη συνταγή βάζοντας σε ένα μπολ βάζουμε το αλεύρι με το αλάτι.  Προσθέτουμε το αυγό και ρίχνουμε σιγά σιγά νερό, όσο χρειαστεί για να φτιάξουμε μια εύπλαστη ζύμη. Ούτε μαλακή, ούτε σκληρή.  Αφήστε τη ζύμη να ξεκουραστεί για μισή ώρα στο ψυγείο.Στη συνέχεια μοιράστε την σε κομμάτια 4 ή 5.  Στη συνέχεια της συνταγής μας ζυμώνουμε λίγο ακόμη τα κομμάτια που κόψατε και μετά ανοίξτε τα με έναν από τους τρεις τρόπους που θα δείτε στο παρακάτω βίντεο.  Απαραίτητο καθώς ανοίγετε το φύλλο θα βάζετε αρκετό βούτυρο στη ζύμη.  Την ψήνετε σε ένα τηγάνι, σε μέτρια φωτιά και αφού την έχετε περάσει με βούτυρο -και μετά το άνοιγμα- και από τις δύο πλευρές.  ﻿",https://www.iefimerida.gr/gastronomie/syntagi-gia-pita-boytyroy-sto-tigani-indiki-paratha
Food,iefimerida.gr,"Συνταγή για σιμιγδαλένιο χαλβά -Η αλάνθαστη αναλογία «1, 2, 3, 4»",22 04 2020,iefimerida.gr,"Αποτελεί μια από τις πιο παραδοσιακές  συνταγές  στην Ελλάδα και το μυστικό του περιορίζεται σε απλή αριθμητική. Αρκεί κανείς να γνωρίζει να μετρά ως το… 4. Ο σιμιγδαλένιοςχαλβάς έρχεται με μια συμβουλή που περνάμέσα στα χρόνια από στόμα σε στόμα.Χρειάζεστε ένα συγκεκριμένο φλιτζάνιή ποτήρι, στο οποίο θα μετρήσετε όλα ταυλικά και λίγη υπομονή πάνω από τηνκατσαρόλα.Ο κανόνας«1,2,3,4» στη συνταγή για τον χαλβά Εκείνο που πρέπει να θυμάστε, είναι πως ξεκινώντας με την σειρά, ελαιόλαδο, σιμιγδάλι, ζάχαρη και νερό, εφαρμόζετε στη συνταγή τον κανόνα «1,2,3,4». Από εκεί και πέρα είστε έτοιμοι για τη συνταγή.  Να θυμίσουμε πως ο χαλβάς αυτός είναι και το γλυκό που κέρδισε τις εντυπώσεις στην τελευταία ομαδική του  MasterChef 4 , όπου ο Σταυρής τον ετοίμασε για να ταιριάξει με τα κρασιά των καλεσμένων του διαγωνισμού.Υλικά 1 φλιτζάνι ελαιόλαδο  2 φλιτζάνια σιμιγδάλι (1 χοντρό και 1 ψιλό)  3 φλιτζάνια ζάχαρη  4 φλιτζάνια νερό  Για το σιρόπι: 1 ξυλάκι κανέλας  4-5 καρφάκια γαρίφαλο  Τη φλούδα από ένα λεμόνι  Προαιρετικά: Σταφίδες, αμύγδαλα, καρύδια (περίπου μισό φλιτζάνι) Εκτέλεση Βάζουμε σε μια κατσαρόλα τη ζάχαρη, το νερό, την κανέλα, τα γαρίφαλα, το λεμόνι. Σε άλλο σκεύος προσθέτουμε το ελαιόλαδο και το σιμιγδάλι  Καβουρντίζουμε το σιμιγδάλι σε μέτρια φωτιά, γυρίζοντας με ξύλινη κουτάλα να πάρει χρώμα. Όσο περισσότερο το καβουρντίσουμε, τόσο πιο έντονο χρώμα θα πάρει ο χαλβάς  Παράλληλα, ανάβουμε τη φωτιά για το σιρόπι και μόλις πάλη βράση, χαμηλώνουμε τη φωτιά και σκεπάζουμε για 5΄ λεπτά την κατσαρόλα. Αφαιρούμε λεμόνι, κανέλα και γαρίφαλα και αφήνουμε να πάρει μια ακόμη βράση σε μέτρια φωτιά  Αφού το σιμιγδάλι πάρει το επιθυμητό χρώμα, αποσύρουμε από τη φωτιά και με πολύ προσοχή ρίχνουμε το ζεστό σιρόπι. Υπάρχει κίνδυνος να πιτσιλίσει και ο χαλβάς είναι καυτός, οπότε χρειάζεται μεγάλη προσοχή.Γυρίζουμε τον χαλβά ξανά στο μάτι, ανακατεύοντας ώσπου να φουσκώσει και να μαζεύει γύρω από την κουτάλα. Στο σημείο αυτό προσθέτουμε, αν το επιθυμούμε, τους ξηρούς καρπούς.Μεταφέρουμε τον χαλβά σε στρογγυλή φόρμα για κέικ και αφήνουμε να κρυώσει για μισή ώρα. Ξεφορμάρουμε και σερβίρουμε",https://www.iefimerida.gr/gastronomie/syntagi-simigdalenio-halba-1-2-3-4
