subtopic,website,title,date,author,text,url
Food,iefimerida.gr,"Εύκολη συνταγή για πίτσα, σε 4 βήματα",30 08 2019,iefimerida.gr,"Σαββατοκύριακο ενόψει τι ωραιότερο, γευστικότερο και δημοφιλέστερο σνακ από την  πίτσα ;  Παρακάτω ακολουθεί μια εύκολη συνταγή για σπιτική πίτσα, σε μόλις 4 βήματα.  Υλικά για σπιτική πίτσα 300 γραμμάρια αλεύρι για όλες τις χρήσεις 1 κουταλάκι του γλυκού μαγιά Λίγο αλάτι Μια κουταλιά της σούπας ελαιόλαδο﻿﻿ 100 γραμμάρια ντομάτα συμπηκνωμένη.  Λίγο λάδι Μια χούφτα φρέσκο βασιλικό ή ένα κουταλάκι του γλυκού αποξηραμένο 1 σκελίδα σκόρδο, θρυμματισμένη 125 γρ. Μοτσαρέλα Μια χούφτα τριμμένη παρμεζάνα Λίγη φρέσκια ντομάτα Ενα καλό αλλαντικό της αρεσκείας σας  Μια κουταλιά λάδι  Λίγο φρέσκο βασιλικό.Εκτέλεση συνταγή για σπιτική πίτσα Βάλτε το αλεύρι σε ένα μεγάλο μπολ, τη μαγιά, το αλάτι και ανακατέψτε.  Ρίξτε 200ml ζεστό νερό και το ελαιόλαδο και ανακατέψτε με μια κουτάλα μέχρι να φτιάξετε μια μαλακή, αρκετά υγρή ζύμη.  Αλευρώστε τον πάγκο, ρίξτε το μείγμα και ζυμώστε για 5 λεπτά.  Καλύψτε τη ζύμη με μια πετσέτα και αφήστε την στην άκρη.  Μπορείτε να αφήσετε τη ζύμη να φουσκώσει, αν θέλετε, αλλά δεν είναι απαραίτητο αν σκοπεύετε να κάνετε μια πίτσα με λεπτή ζύμη.  Σωτάρετε λίγο σκόρδο στο τηγάνι, προσθέστε τη συμπηκνωμένη ντομάτα και λίγο βασιλικό, ρίξτε νερό και αφήστε να πάρει μια βράση.  Κατεβάστε τη σάλτσα από τη φωτιά και αφήστε την να έρθει σε θερμοκρασία δωματίου.  Ζυμώστε τη ζύμη ελαφρά μια φορά ακόμη και χωρίστε την σε δύο μέρη.  Με έναν πλάστη ανοίξτε την σε δύο «φύλλα». Το πάχος εξαρτάται από τι είδους βάση πίτσας προτιμάτε.Προθερμάνετε το φούρνο στους  220C.  Βάλτε πάνω στη ζύμη που έχετε ανοίξει σάλτσα και στη συνέχεια τα υλικά προτίμησής σας. Ενα αλλαντικό, λίγη ντομάτα και μετά μπόλικη μοτσαρέλα.  Ψήστε την για 8 με 10 λεπτά.  Πριν τη σερβίρετε ρίξτε από πάνω λίγο ελαιόλαδο και φρέκα φύλλα βασιλικού.  Επίσης εύκολο σνακ για το ΣΚ τα  μακαρόνια με σάλτσα τυριού (η συνταγή εδώ ), ενώ τέλεια μετά την πίτσα, θα πήγαινε ένα ωραίο δροσιστικό  σορμπέ νεκταρίνι. Δείτε εδώ τη συνταγή . ",https://www.iefimerida.gr/gastronomie/eykoli-syntagi-gia-pitsa-se-4-bimata
Food,iefimerida.gr,Με αυτή τη συνταγή για σουβλάκια κοτόπουλο θα απογειώσεις το street food από την κουζίνα σου,28 04 2020,iefimerida.gr,"Είναι το ελληνικό παραδοσιακό street food που λατρεύουν μικροί και μεγάλοι. Ενα φαγητό γρήγορο, εύκολο που ικανοποιεί πάντα την πείνα χωρίς περιττά λιπαρά. Το  σουβλάκι  κοτόπουλο. Τρυφερά και ζουμερά κομματάκια κρέας περασμένα σε καλαμάκι με τη νοστιμιά τους να οφείλεται εν μέρει στη μαρινάδα μέσα στην οποία έχουν ξεκουραστεί. Τα σουβλάκια κοτόπουλο θέλουν την τέχνη τους, δηλαδή τα σωστά υλικά για να απογειωθούν και να γίνουν ένα πιάτο που μπορείτε να προσφέρετε σε όλους. Με αυτή τη συνταγή είναι βέβαιο ότι θα θέλετε να κάνετε μπάρμπεκιου κάθε μέρα. Η απίθανη μαρινάδα του chef Αλέξανδρου Παπανδρέου δίνει στο κοτόπουλο μια απερίγραπτη νοστιμιά, ενώ το κάνει πολύ τρυφερό. Το αγαπημένο πιάτο ολόκληρης της οικογένειας θα γίνει ακόμη πιο λαχταριστό... Δείτε τη συνταγή στο Bovary.gr",https://www.iefimerida.gr/gastronomie/syntagi-soyblakia-kotopoylo-alexandros-papandreoy
Food,iefimerida.gr,"Συνταγή για τσουρέκι με ζαχαρούχο, του Βασίλη Καλλίδη -Ενας αφρός",10 04 2020,iefimerida.gr,"Η  συνταγή  για το τσουρέκι με το ζαχαρούχο γάλα έκανε την εμφανίση του πέρυσι και έκανε θραύση.  Ο Βασίλης Καλλίδης μέσα από το Πρωινό έδειξε τη δική του εκδοχή, τη δική του συνταγή για τσουρέκι με ζαχαρούχο, συνταγή εγγύηση για πετυχημένο αποτέλεσμα.Μάλιστα, πέρα από τη συνταγή, έδωσε και πολύτιμες συμβουλές σχετικά με το ποια πρέπει να είναι η θερμοκρασία των υλικών για να πετύχει η συνταγή, ενώ εξήγησε και τι να κάνουμε σε περίπτωση που δεν φουσκώσει το ζυμάρι. Τιπς συνταγής για τσουρέκια Ολα τα υλικά πρέπει να είναι σε θερμοκρασία δωματίου.  Τα αβγά και τα πορτοκάλια που συνήθως είναι στο ψυγείο, ή στο μπαλκόνι, θα πρέπει αποβραδίς να τα έχουμε στον πάγκο της κουζίνας για να πάρουν τη θερμοκρασία του δωματίου.  Οπως εξήγησε ο Βασίλης Καλλίδης, αν είναι έστω και λίγο παγωμένα, τότε η ζύμη μας θα χαλάσει.  Σε καμία περίπτωση δεν βάζουμε κάτι καυτό στη ζύμη. Το βάζουμε απλά ζεστό, για να μην κάψει τη μαγιά.  Αν τα τσουρέκια περάσει η μισή, μια ώρα και δεν φουσκώσουν, τότε αφήστε τη ζύμη όλο το βράδυ στον πάγκο της κουζίνας σκεπασμένη, και φτιάξτε τα τσουρέκια το επόμενο πρωί.  Για να φουσκώσει πιο εύκολα η ζύμη, προθερμάνετε το φούρνο στους 40 βαθμούς, κλείστε τον και βάλτε μέσα τη ζύμη να φουσκώσει.  Υλικά συνταγής για τσουρέκι με ζαχαρούχο γάλα Για τη ζύμη 3 κιλά αλεύρι για τσουρέκι  1 ζαχαρούχο γάλα  3 κουτάκια ζαχαρούχου νερό (ζεστό)  8 φακελάκια μαγιά  1 μπέκιν πάουντερ  1 βανίλια  6 αυγά  2,5 φλ. ζάχαρη  2 φλ. λιωμένο βούτυρο  2 φακελάκια μαχλέπι  2 φακελάκια κακουλέ η καρδάμωμο  χυμός και ξύσμα από 1 πορτοκάλι Για το άλειμμα 2 κρόκους αυγών για το άλειμμα 1 φλ. αμύγδαλο φιλέ η σουσάμι Για τη γέμιση 1 φλ. τσιπς σοκολάτας  1 φλ. γλυκό πορτοκάλι  1 φλ. καρύδια Για το γλάσο σοκολάτας 400 γρ. κουβερτούρα  50 γρ. βούτυρο Εκτέλεση συνταγής για τσουρέκι με ζαχαρούχο Λιώνουμε τη μαγιά στο ζεστό νερό.  Βάζουμε σε μια λεκάνη τα υγρά υλικά και το μισό βούτυρο.  Προσθέτουμε τα μπαχαρικά, το ξύσμα, το μπέκιν πάουντερ και τη ζάχαρη. Ανακατεύουμε καλά.  Προσθέτουμε το αλεύρι σε δυο δόσεις.  Ζυμώνουμε καλά.  Μόλις σχηματισθεί η ζύμη περιχύνουμε με το υπόλοιπο λιωμένο βούτυρο. Σκεπάζουμε με μεμβράνη. Αφήνουμε την λεκάνη με τη ζύμη να σταθεί για μια ώρα η μέχρι να διπλασιαστεί σε όγκο.  Ζυμώνουμε ξανά για 5 λεπτά και κόβουμε τη ζύμη σε κομμάτια.  Πλάθουμε τα σχέδια που θέλουμε και τα αραδιάζουμε σε ταψιά αλειμμένα με βούτυρο. Αλείφουμε τα τσουρέκια με τους κρόκους αραιωμένους με μισό φλιτζάνι γάλα και πασπαλίζουμε με το αμύγδαλο.  Αφήνουμε να φουσκώσουν για μια ώρα. Ψήνουμε στους 180 βαθμούς για 30 λεπτά.",https://www.iefimerida.gr/gastronomie/syntagi-tsoyrekia-me-zaharoyho-basilis-kallidis
Food,iefimerida.gr,Φτιάχνουμε πασχαλινά σοκολατένια αυγά στο σπίτι -Με τη βοήθεια μπαλονιών [βίντεο],17 04 2020,iefimerida.gr,"Το Πάσχα φέτος είναι διαφορετικό για όλους μας. Ας κάνουμε λοιπόν και διαφορετικά πράγματα όπως το να φτιάξουμε σοκολατένια  αυγά , μόνοι μας στο σπίτι.  Αφού λοιπόν βάψαμε και φέτος τα αυγά, είδαμε άλλωστε και διάφορες πρωτότυπες ιδέες, όπως τη  βαφή αυγών  με καλσόν και λουλούδια, ή τη  βαφή αυγών με κλωστές , ήρθε η ώρα να φτιάξουμε και τα σοκολατένια μας αυγά.  Η διαδικασία δεν είναι δύσκολη για πασχαλινά αυγά στο σπίτι, μοιάζει με παιχνίδι και σίγουρα θα αποτελέσει μια ευχάριστη δημιουργική απασχόληση για τα παιδιά. Υλικά για σοκολοτένια αυγά στο σπίτι  Σοκολάτα, υγείας, γάλακτος, λευκή, ανάλογα με την προτίμηση Μπαλόνια Φόρμες για αυγά  Θήκες από αυγά kider  Μαγειρικό πινέλο σιλικόνης Ο, τι τραβάει η καρδιά σας, από καρεμελίτσες, τρούφες, ξηρούς καρπούς.  Οπως θα δείτε και στα παρακάτω βίντεο οι τρόποι για να φτιάξει κανείς σοκολατένια πασχαλινά αυγά στο σπίτι του είναι πολλοί.  ΣΧΕΤΙΚΑ ΑΡΘΡΑ Σε κάθε περίπτωση θα χρειαστείτε σοκολάτα, συνήθως υγείας, την οποία θα λιώσετε σε μπεν μαρί και εν συνεχεία, ανάλογα με τη μέθοδο που θα διαλέξετε θα «στρώσετε» με ένα πινέλο είτε πάνω στο μπαλόνι, είτε στη φόρμα σας. Δείτε λεπτομέρειες στα παρακάτω βίντεο. Αυγά σε φόρμα  Βασική τεχνική των πασχαλινών σοκολατένιων αυγών σε φόρμα είναι ότι περνάμε τη σοκολάτα σε στρώσεις στη φόρμα μας, αν μας είναι δύσκολο μετακινώντας τη φόρμα, τότε με τη βοήθεια ενός πινέλου.  Στο παρακάτω βίντεο θα δείτε πώς μπορείτε να φτιάξετε αυγά σοκολατένια τύπου Kider, με δύο στρώσεις σοκολάτας, γάλακτος και λευκή:  Στο παρακάτω βίντεο θα δείτε ακόμη πώς μπορείτε να φτιάξετε αυγά, πάντα με τη βοήθεια φόρμας, με σχέδια:  Για πιο επαγγελματικό αποτέλεσμα:  Πασχαλινά αυγά με τη βοήθεια μπαλονιού  Σε αυτή την περίπτωση θα χρειαστείτε μπαλόνια. Βασική προϋποθεση να πλύνετε πολύ πολύ πολύ πολύ καλά το μπαλόνι και από τις δύο πλευρές, πριν το φουσκώσετε.  Ενδιαφέρον έχει και αυτή η τεχνική κατά την οποία δεν χτίζετε το αυγό σας εξωτερικά του μπαλονιού, αλλά απλά, γεμίζετε το εσωτερικό του!  Με θήκες από αυγά Kider  Στο παρακάτω βίντεο σίγουρα θα πάρετε πολλές ιδέες:",https://www.iefimerida.gr/gastronomie/pos-ftiahnoyme-pashalina-sokolatenia-ayga
Food,iefimerida.gr,"Συνταγή για την πιο αφράτη, αέρινη ομελέτα -Το «τρικ» που σαρώνει στο διαδίκτυο [βίντεο]",21 01 2020,iefimerida.gr,"Υπάρχουν  συνταγές  και συνταγές για να ετοιμάσετε στα γρήγορα μια ομελέτα. Αυτή όμως η συνταγή θα δώσει την πιο αφράτη ομελέτα που έχετε δοκιμάσει ποτέ. Τα μυστικά για αφράτη, πεντανόστιμη ομελέτα είναι πολλά και οι συνταγές ακόμη περισσότερες. Παλιότερα σας είχαμε γράψει πως  με λίγο ανθρακούχο νερό , θα δώσετε πιο αέρινη υφή στις ομελέτες σας. Σήμερα, το μυστικό για αυγά που λιώνουν στο στόμα κρύβεται στο σκεύος που θα χρησιμοποιήστε, πριν ρίξετε τα αυγά στο τηγάνι.Μην πάει ονους σας σε κάποιο ειδικό εργαλείο! Ένασουρωτήρι είναι ό, τι χρειάζεστε. Το«τρικ» που σαρώνει το youtubeγια την πιο αφράτη ομελέτα σε χρόνομηδέν.Υλικά 3 αυγά  3 κουταλιές ελαιόλαδο  Αλάτι και πιπέρι  2-3 κρεμμυδάκια φρέσκα  ½ κόκκινη γλυκιά πιπερι Εκτέλεση Βάζουμε το ελαιόλαδο στο τηγάνι να ζεσταθεί καλά  Χτυπάμε τα αυγά καλά σε ένα μπολ, αν θέλετε κάντε το ακόμη και με τη βοήθεια ενός μίξερ για να αφρατέψουν. Αλατοπιπερώνουμε  Παίρνουμε ένα σουρωτήρι (ιδανικά μεταλλικό) και το κρατάμε πάνω από το ζεστό τηγάνι. Γυρίζουμε το μείγμα των αυγών στο σουρωτήρι και με τη βοήθεια μιας κουτάλας πιέζουμε να βγει το αυγό στο τηγάνι  Το αυγό σχηματίζει αφράτες κορυφές στο καυτό λάδι. Περιστρέφουμε ελαφρά την ομελέτα στο τηγάνι και αφαιρούμε, όσο έχει ακόμη ελαφρύ κίτρινο χρώμα  Ψιλοκόβουμε τα κρεμμυδάκια και τις πιπεριές σε κυβάκια και πασπαλίζουμε την ομελέτα πριν τη σερβίρουμε Βίντεο: Το τρικ με το σουρωτήρι και δύο ακόμη έξυπνες ιδέες με αυγά Στο βίντεο που ακολουθεί μπορείτε να δείτε έξυπνα τρικ σερβιρίσματος των αυγών. Τρεις προτάσεις, μεταξύ των οποίων και εκείνη με το σουρωτήρι που θα κάνει την ομελέτα πιο αφράτη από ποτέ. ",https://www.iefimerida.gr/gastronomie/syntagi-gia-tin-pio-afrati-aerini-omeleta
Food,iefimerida.gr,Συνταγή για κλασικό γλυκό ψυγείου με μπισκότα,26 10 2019,iefimerida.gr,"Το γλυκό ψυγείου δεν είναι μόνο για το καλοκαίρι. Συνεχίζουμε και τώρα (που υποτίθεται ότι χειμωνιάζει) να φτιάχνουμε και να γευόμαστε ωραία γλυκά ψυγείου εκτελώντας κλασικές  συνταγές . Οπως η παρακάτω.  Με τα γνωστά αγαπημένα από μικρούς και μεγάλους τετράγωνα μπισκότα και δύο κρέμες που δεν είναι ιδιαίτερα δύσκολες, μπορούμε να στήσουμε ένα ωραίο γλυκό ψυγείου που θα λατρέψουν μικροί και μεγάλοι. Οπως λατρεύουν  το κλασικότερο γλυκό ψυγείου όλων, το περίφημο γλυκό με το ζελέή την επίσης  εξαιρετική και εύκολη συνταγή για γλυκό ψυγείου σοκολάτας .  Μια συνταγή απλή που δίνει εξαιρετικό αποτέλεσμα.Υλικά για συνταγή γλυκού ψυγείου με μπισκότα Δύο με τρία πακέτα κλασικά τετράγωνα μπισκότα Λίγα μύγδαλα καβουρδισμένα και κομματιασμένα Λίγο λικέρ ή στιγμιαίο καφέ  Λίγη ζάχαρη άχνη Υλικά για την κρέμα ζαχαροπλαστικής 2 κρόκοι αυγών  3 κουταλιές της σούπας ζάχαρη  2 κουταλιές της σούπας κορν φλάουρ  300 ml γάλα  3 βανίλιες Εκτέλεση Βράζουμε το γάλα με τη βανίλια.  Μόλις ζεσταθεί, χωρίς να κάψει, αποσύρουμε από τη φωτιά.  Χτυπάμε τους κρόκους με τη ζάχαρη και το κορν φλάουρ ξεχωριστά και προσθέτουμε αργά αργά στο γάλα που έχουμε αποσύρει από τη φωτιά. Προσοχή, το γάλα πρέπει να είναι χλιαρό και σε καμία περίπτωση καυτό. Ανακατεύουμε συνεχώς.  Μολις ενσωματωθούν τα δύο μείγματα δένουμε την κρέμα ζαχαροπλαστικής σε χαμηλή φωτιά ή σε μπεν μαρί.  Την αφήνουμε να κρυώσει στο ψυγείο.  Υλικά για την κρέμα σοκολάτας  60 γρ. σοκολάτα γάλακτος λιωμένη  150ml κρέμα γάλακτος 35% λιπαρά πολύ κρύα  Εκτέλεση Χτυπάμε την κρέμα γάλακτος η οποία πρέπει να είναι πολύ παγωμένη, για να αφρατέψει.Προσθέτουμε τη λιωμένη σοκολάτα, την οποία όμως πρέπει να έχουμε αφήσει να κρυώσει.  Με μια σπάτουλα ανακατεύουμε απαλά μέχρι να ενσωματωθούν.Εκτέλεση συνταγής για γλυκό ψυγείου με μπισκότα Εχουμε τις δύο κρέμες μας έτοιμες Σε ένα πυρέξ απλώνουμε στον πάτο μια σειρά με μπισκότα.  Αν το επιθυμούμε αλείφουμε τα μπισκότα με λίγο λικέρ ή στιγμιαίο καφέ.  Στρώνουμε μια λεπτή στρώση κρέμας ζαχαροπλαστικής η οποία στο μεταξύ έχει παγώσει ελαφρώς στο ψυγείο.  Επαναλαμβάνουμε όσες φορές επιθυμούμε τις στρώσεις μπισκότο-κρέμα ζαχαροπλαστικής.  Μόλις τελειώσουμε με την κρέμα ζαχαροπλαστικής, μετά την τελευταία στρώση μπισκότων απλώνουμε μια παχιά στρώση της κρέμας σοκολάτας.  Στο τέλος σπάμε μερικά μπισκότα, βάζουμε μερικά μύγδαλα και αν το επιθυμούμε λίγη άχνη ζάχαρη.  Βάζουμε στο ψυγείο να παγώσει, μετά από δύο ώρες περίπου το γλυκό μας είναι έτοιμο!",https://www.iefimerida.gr/gastronomie/syntagi-gia-klasiko-glyko-psygeioy-me-mpiskota
Food,iefimerida.gr,Η viral συνταγή της μους με τα 5 υλικά (χωρίς ζάχαρη),21 04 2020,iefimerida.gr,"Το Πάσχα έφυγε, η διάθεση για γλυκά παραμένει. Ακολουθεί μια  συνταγή  για μια πανεύκολη μους σοκολάτα.  Πρόκειται για τη viral συνταγή μιας μους σοκολάτας που θυμίζει έντονα τη γεύση του σνακ Snickers. Εύκολη και υγιεινή η συνταγή απαιτεί 5 βασικά υλικά και φτιάχνεται σε λιγότερο από 5 λεπτά. Δηλαδή, σε λιγότερο χρόνο από ότι απαιτείται για να βράσεις ένα αυγό.  ΣΧΕΤΙΚΑ ΑΡΘΡΑ Εχει μόλις 226 θερμίδες ανά μερίδα, αφού αντικαθιστάς την σαντιγύ με ρικότα και τη ζάχαρη με σιρόπι σφενδάμου και μπορεί να γίνει το αγαπημένο σνακ χωρίς ενοχές. Αφού είδαμε λοιπόν τις τοπ συνταγές γλυκών των Ελλήνων σεφ ας δούμε μια πιο light συνταγή γλυκού.  Υλικά συνταγής για μους σοκολάτας με 5 υλικά  Ενα φλιτζάνι τυρί ρικότα  Δύο κουταλάκια του γλυκού σκόνη κακάο 1/3 του φλιτζανιού φυστικοβούτυρο Δύο κουταλιές σιρόπι σφενδάμου Μια κουταλιά της σούπας τσιπς σοκολάτας Εκτέλεση συνταγής για  μους με 5 υλικά  Βάλτε τα 5 υλικά σε ένα μεγάλο μπολ.  Ανακατέψτε απαλά μέχρι να ομογενοποιηθούν και να σχηματιστεί μια κρεμώδης μους.  Βάλτε την σε μπολάκια ή κούπες πασπαλίστε με τα τσιπς σοκολάτας και βάλτε την στο ψυγείο.  Έναλλακτικά, μπορείτε να λιώσετε τα τσιπς σοκολάτας και να περιχύσετε με τη σοκολάτα τη μους, πριν τη σερβίρετε. ",https://www.iefimerida.gr/gastronomie/viral-syntagi-tis-moys-me-ta-5-ylika-horis-zahari
