subtopic,website,title,date,author,text,url
Environment,iefimerida.gr,Εκλεισε τρύπα του όζοντος που είχε ανοίξει πάνω από την Αρκτική,29 04 2020,iefimerida.gr,"Μία  τρύπα του όζοντος  που σχηματίσθηκε πάνω από την Αρκτική αυτή την άνοιξη και τελικά εξελίχθηκε στη μεγαλύτερη που έχει καταγραφεί ποτέ έκλεισε. Οι επιστήμονες που  παρακολουθούσαν την τρύπα  στην Υπηρεσία για την Παρακολούθηση της Ατμόσφαιρας «Κοπέρνικος»  (CAMS) έκαναν την ανακοίνωση στα τέλη της περασμένης εβδομάδας σημειώνοντας ότι η «μάλλον ασυνήθιστη» τρύπα δεν προκλήθηκε από ανθρώπινη δραστηριότητα αλλά από μία ιδιαίτερα ισχυρή Αρκτική πολική δίνη, ανέφερε η CAMS.  «Η  COVID19 και τα σχετικά lockdown πιθανώς δεν είχαν καμία σχέση με αυτό», ανέφερε επίσης η CAMS στο Twitter και εξήγησε: «Οδηγείται από μια ασυνήθιστα ισχυρή και μακράς διάρκειας  πολική δίνη, και δεν σχετίζεται με τις αλλαγές στην ποιότητα του αέρα. The unprecedented 2020 northern hemisphere  #OzoneHole  has come to an end. The  #PolarVortex  split, allowing  #ozone -rich air into the Arctic, closely matching last week's forecast from the  #CopernicusAtmosphere  Monitoring Service. More on the NH Ozone hole➡️ https://t.co/Nf6AfjaYRipic.twitter.com/qVPu70ycn4 Ωστόσο όπως σημειώνει το CNN, η τρύπα ήταν τεράστια - το μεγαλύτερο μέρος του όζοντος που βρίσκεται συνήθως περίπου 11 μίλια μέσα στη στρατόσφαιρα είχε εξαντληθεί, ανέφερε η ομάδα. Την τελευταία φορά που παρατηρήθηκε τόσο μεγάλη αραίωση του όζοντος στην Αρκτική, σημειώθηκε πριν από μια δεκαετία περίπου. Μια πολική δίνη είναι μια μεγάλη περιοχή χαμηλής πίεσης και κρύου αέρα που περιβάλλει και τους δύο πόλους της Γης, όπως εξηγεί το CNN επικαλόύμενο στοιχεία από την Εθνική Υπηρεσία Καιρού. Οι πολικές δίνες υπάρχουν πάντα, αλλά συνήθως εξασθενούν κατά τη διάρκεια του καλοκαιριού και ενισχύονται το χειμώνα. Η πολική δίνη στην Αρκτική είναι συνήθως ασθενέστερη λόγω της παρουσίας  σε κοντινή απόσταση εκτάσεων γης καθώς και οροσειρών που διαταράσσουν τον καιρό περισσότερο από τον αντίστοιχο στο νότο, δήλωσε η  CAMS. Το στρώμα του όζοντος βρίσκεται σε απόσταση 9 και 22 μιλίων από τη Γη. Μας προστατεύει από την υπεριώδη ακτινοβολία. Σε αντίθεση με την τρύπα που αναπτύχθηκε πάνω από την Αρκτική, η τρύπα του όζοντος στην Ανταρκτική στο Νότιο Ημισφαίριο προκαλείται συνήθως από χημικές ουσίες όπως το χλώριο και το βρώμιο που μεταφέρονται στη στρατόσφαιρα. Αυτό έχει οδηγήσει στην ανάπτυξη της τρύπας του όζοντος στην Ανταρκτική κάθε χρόνο για τα τελευταία 35 χρόνια. Σημειώνεται ωστόσο ότι η τρύπα του όζοντος στην Ανταρκτική πέρυσι ήταν στο μικρότερο από τότε που ανακαλύφθηκε για πρώτη φορά.",https://www.iefimerida.gr/green/trypa-toy-ozontos-ekleise-pano-apo-tin-arktiki
Environment,iefimerida.gr,Επιστήμονες υποστηρίζουν πως οι βάτραχοι φωσφορίζουν -Οπως οι πυγολαμπίδες [εικόνα] ,28 02 2020,iefimerida.gr,"Μέχρι σήμερα οι επιστήμονες γνώριζαν μόνο τρία είδη  βατράχων  και ένα είδος σαλαμάνδρας που διέθεταν βιοφωταύγεια. Μπορούσαν δηλαδή να παράγουν το δικό τους απόκοσμο πράσινο-μπλε φως. Τώρα, σύμφωνα με νέες επιστημονικές εκτιμήσεις, η εικόνα αυτή ανατρέπεται, καθώς σχεδόν όλα τα αμφίβια φαίνεται πως έχουν την ίδια ικανότητα να λάμπουν. Η βιοφωταύγεια  συμβαίνει όταν το φως που πέφτει πάνω σε ένα ζωντανό οργανισμό, απορροφάται και στη συνέχεια εκπέμπεται ξανά σε διαφορετικό μήκος κύματος. Αρκετά πλάσματα της θάλασσας έχουν βιοφωταύγεια, αλλά λίγα πράγματα ήσαν γνωστά έως τώρα για τα αμφίβια.  Οι βιολόγοι του Πολιτειακού Πανεπιστημίου της Μινεσότα Τζένιφερ Λαμπ και Μάθιου Ντέιβις, που έκαναν τη σχετική δημοσίευση στο περιοδικό Scientific Reports, εξέτασαν δειγματοληπτικά 32 διαφορετικά είδη αμφίβιων (κυρίως βάτραχους και σαλαμάνδρες), τα οποία εξέθεσαν σε μπλε ή υπεριώδες φως. Στη συνέχεια, χρησιμοποιώντας φασματόμετρο, μέτρησαν τα μήκη κύματος του φωτός που εκπεμπόταν από τα ζώα και διαπίστωσαν ότι όλα είχαν βιοφωταύγεια, αν και το καθένα με το δικό του διακριτό τρόπο. Μερικά αμφίβια έχουν κηλίδες βιοφωταύγειας πάνω στο σώμα τους, άλλα βιοφωταυγείς ρίγες και άλλα διαθέτουν οστά με βιοφωταύγεια. Ορισμένα έχουν βιοφωταύγεια σε ολόκληρο το σώμα τους.Τα μάτια των αμφίβιων διαθέτουν ειδικά κύτταρα που ανιχνεύουν το πράσινο και μπλε φως, κάτι που βοηθά αυτά τα ζώα να εντοπίζουν το ένα το άλλο. Από την άλλη, η βιοφωταύγεια μπορεί να αποθαρρύνει πιθανούς θηρευτές ή να βοηθά τα αμφίβια να καμουφλάρονται κάτω από συγκεκριμένες συνθήκες φωτισμού στο περιβάλλον. Σε μερικά είδη υπάρχουν διαφορές στη βιοφωταύγεια μεταξύ αρσενικών και θηλυκών, κάτι πιθανώς σχετίζεται με την αναπαραγωγή. Οι επιστήμονες εκτιμούν ότι οι πρόγονοι των αμφίβιων είχαν αναπτύξει τη βιοφωταύγεια, γι' αυτό είναι τόσο διαδεδομένη στους απογόνους τους σήμερα.",https://www.iefimerida.gr/green/ki-omos-oi-batrahoi-fosforizoyn
Environment,iefimerida.gr,Αυστραλία: Οι πυρκαγιές κατέστρεψαν το ένα πέμπτο των δασών της χώρας,24 02 2020,iefimerida.gr,"Οι πρόσφατες πυρκαγιές που έπληξαν την  Αυστραλία  κατέστρεψαν σχεδόν το ένα πέμπτο των δασών της χώρας, σύμφωνα με μελέτες που δόθηκαν στη δημοσιότητα τη Δευτέρα. Οι πυρκαγιές αυτές ήταν άνευ προηγουμένου για την Αυστραλία που τα τελευταία χρόνια βρίσκεται αντιμέτωπη με ξηρασία, η οποία συνδέεται με την υπερθέρμανση του πλανήτη. Οι κλιματολόγοι εξετάζουν αυτήν την περίοδο τα δεδομένα που συνδέονται με αυτήν την καταστροφή για να καθορίσουν σε ποιο βαθμό ευθύνεται η κλιματική αλλαγή. Στο μεταξύ όμως, σε μια ειδική έκδοση της επιστημονικής επιθεώρησης Nature Climate Change, Αυστραλοί ερευνητές εξέτασαν άλλες πλευρές αυτών των δασικών πυρκαγιών. Σύμφωνα μεμία από αυτές τις μελέτες, από τονΣεπτέμβριο του 2019 μέχρι τον Ιανουάριοτου 2020 κάηκαν περίπου 58 εκατομμύριαστρέμματα εύκρατων δασών στη Νέα ΝότιαΟυαλία και τη Βικτόρια. Αυτή ήταν ηκαταστροφικότερη περίοδος πυρκαγιώνπου έχει καταγραφεί ποτέ στην ιστορίατης χώρας. «Στα μέσατης άνοιξης του 2019 (σ.σ. για το νότιοημισφαίριο) συνειδητοποιήσαμε ότι έναπολύ σημαντικό μέρος των δασών τηςανατολικής Αυστραλίας θα μπορούσε νακαεί μέσα σε μια εποχή», σχολίασε οΜατίας Μπερ, του Πανεπιστημίου τουΔυτικού Σίδνεϊ. Κατά μέσοόρο, λιγότερο από το 2% των δασών τηςΑυστραλίας καταστρέφονται κάθε χρόνοαπό πυρκαγιές. Άλλη μελέτηεπικεντρώνεται στις συνθήκες πουεπιδείνωσαν την καταστροφή: την πολυετήξηρασία στη λεκάνη του Μάρεϊ. Ο ΆντριουΚινγκ, του Πανεπιστημίου της Μελβούρνης,μελέτη μαζί με τους συναδέλφους του έναφαινόμενο που αποκαλείται Δίπολο τουΙνδικού Ωκεανού, το οποίο επηρεάζειάμεσα το επίπεδο των βροχοπτώσεων στηνΑυστραλία. Έτσι, όταν η θερμοκρασία στηνεπιφάνεια της θάλασσας είναι υψηλότεροαπό το συνηθισμένο στον ανατολικόΙνδικό, με νερά πιο κρύα στα δυτικά,προκαλούνται συνήθως περισσότερεςβροχοπτώσεις στη νοτιοανατολική Ασία. Οι ερευνητέςεκτιμούν ότι η ξηρασία που παρατηρείταιστο μεγαλύτερο μέρος της Αυστραλίαςαπό το 2017 συνδέεται με τη μείωση τηςσυχνότητας εμφάνισης αυτού του φαινομένου,λόγω της υπερθέρμανσης του συνόλου τωνωκεανών. Για τον λόγο αυτό, τον χειμώνατου 2016 σημειώθηκαν πολλές βροχοπτώσειςπου συνδέονταν με το φαινόμενο τουΔιπόλου, όμως στη συνέχεια στη λεκάνητου Μάρεϊ καταγράφηκαν 12 διαδοχικέςεποχές με βροχοπτώσεις κάτω του μέσουόρου. Αυτή ήταν η μακρύτερη περίοδοςξηρασίας από το 1990.",https://www.iefimerida.gr/green/aystralia-oi-pyrkagies-katestrepsan-ena-pempto-ton-dason-tis-horas
Environment,iefimerida.gr,Ανακαλύφθηκε το αρχαιότερο απολίθωμα σύγχρονου πτηνού -Εζησε πριν 67 εκατομμύρια χρόνια,19 03 2020,iefimerida.gr,"Το αρχαιότερο  απολίθωμα  ενός ανατομικά σύγχρονου πτηνού, το οποίο έζησε στο τέλος της εποχής των δεινοσαύρων, πριν 66,7 εκατομμύρια χρόνια, ανακάλυψε μια διεθνής ομάδα παλαιοντολόγων στο Βέλγιο. Το πουλί, που ανακαλύφθηκε σε ένα λατομείο κοντά στα βελγο-ολλανδικά σύνορα (μια περιοχή που κάποτε ήταν μια τροπική παραλία δίπλα σε ρηχή θάλασσα), διαθέτει ένα συνδυασμό χαρακτηριστικών κότας και πάπιας.  Συνεπώς μπορεί να θεωρηθεί ο πρόγονος κάθε κότας και πάπιας πάνω στη Γη σήμερα. Είναι επίσης το πρώτο σύγχρονο πουλί από την εποχή των δεινοσαύρων, που ανακαλύπτεται οπουδήποτε στο βόρειο ημισφαίριο. Οι ερευνητές, με επικεφαλής τον δρα Ντάνιελ Φιλντ του Τμήματος Γεωεπιστημών του Πανεπιστημίου του Κέιμπριτζ, ο οποίος χαρακτήρισε την ανακάλυψη «την πιο σημαντική στιγμή της επιστημονικής καριέρας μου», έκαναν τη σχετική δημοσίευση στο περιοδικό «Nature». Το αξιοθαύμαστο απολίθωμα ονομάστηκε ανεπίσημα «Wonderchicken» και επίσημα Αστεριόρνις (Asteriornis maastrichtensis), παραπέμποντας στην Αστερία, την κόρη ενός Τιτάνα της ελληνικής μυθολογίας και θεά των διαττόντων αστέρων. Οπως είπε ο παλαιοντολόγος δρ Ντάνιελ Κσέπκα του Μουσείου Μπρους του Κονέκτικατ, «το θεωρήσαμε κατάλληλο όνομα για ένα πλάσμα που έζησε λίγο πριν την πτώση του αστεροειδούς στο τέλος της Κρητιδικής περιόδου. Στην ελληνική μυθολογία η Αστερία μεταμορφώνεται σε ορτύκι. Πιστεύουμε ότι η Αστεριόρνις βρισκόταν πολύ κοντά στον κοινό πρόγονο των πουλιών που σήμερα περιλαμβάνουν τα ορτύκια, τα κοτόπουλα και τις πάπιες». Το απολίθωμα περιλαμβάνει ένα σχεδόν πλήρες κρανίο (από τα πιο καλοδιατηρημένα που έχουν βρεθεί στον κόσμο) και θα βοηθήσει τους επιστήμονες να κατανοήσουν γιατί τα πουλιά επιβίωσαν από την μαζική εξαφάνιση των δεινοσαύρων και άλλων ειδών μετά την πτώση ενός μεγάλου αστεροειδούς πριν 66 εκατομμύρια χρόνια. Η καταγωγή όλων των σημερινών πουλιών (περίπου 11.000 ειδών) περιβάλλεται από μυστήριο. Οι επιστήμονες γνωρίζουν ότι αυτά εξελίχθηκαν από μικρούς φτερωτούς δεινόσαυρους, αλλά ελάχιστα απολιθώματα έχουν βρεθεί από την περίοδο πριν την πτώση του αστεροειδούς. Ως αρχαιότερο απολίθωμα μέχρι σήμερα είχε θεωρηθεί η Vegavis, που ζούσε στην Ανταρκτική πριν 66,5 εκατομμύρια χρόνια, αλλά υπάρχουν διαφωνίες για τη θέση της στο «οικογενειακό δέντρο» των πουλιών. Η Αστεριόρνις, που είχε μήκος 30 εκατοστών και βάρος 400 γραμμάρια, σύμφωνα με τον δρ Τζον Γαγκτ του Μουσείου Φυσικής Ιστορίας του Μάαστριχτ, «δείχνει ότι, στην αρχή τουλάχιστον, μερικά σύγχρονα πουλιά ήσαν σχετικά μικρόσωμα, ζούσαν στο έδαφος και κοντά σε ρηχά νερά». Οι επισκέπτες θα έχουν την ευκαιρία να δουν το απολίθωμα και να μάθουν περισσότερα για τον αρχαίο πρόγονο των πουλιών στο Μουσείο Γεωεπιστημών Sedgwick του Κέιμπριτζ, όπου η Αστεριόρνις θα εκτίθεται έως τις 15 Ιουνίου (αν και λόγω κορονοϊού είναι αμφίβολο πόσο θα διαρκέσει η έκθεση…).",https://www.iefimerida.gr/green/anakalyfthike-arhaiotero-apolithoma-syghronoy-ptinoy
Environment,iefimerida.gr,Ερευνα υποστηρίζει πως τα φυτά δεν καθαρίζουν τον εσωτερικό αέρα,28 02 2020,iefimerida.gr,"Μέχρι στιγμής πιστεύαμε ότι τα  φυτά  εσωτερικού χώρου, εκτός από το γεγονός ότι ομορφαίνουν το σπίτι μας, λειτουργούν και ως φυσικό φίλτρο καθαρίζοντας τον αέρα. Ή μήπως όχι; Νέα έρευνα έρχεται να διαψεύσει την κοινή αυτή πεποίθηση, καταλήγοντας στο συμπέρασμα ότι η αποτελεσματικότητά τους είναι αμελητέα. Νέα μελέτη των Αμερικανών επιστημόνων Μάικλ Γουέρινγκ και Μπράιαν Κάμινγκ από το Πανεπιστήμιο Ντρέξελ στη Φιλαδέλφεια επιφυλάσσει δυσάρεστα νέα για όσους πιστεύουν ότι τα φυτά εσωτερικού χώρου προσφέρουν καλύτερη ποιότητα αέρα. Σύμφωνα με τα πορίσματά τους, τα φυτά σε γλάστρες δεν ανανεώνουν τελικά τον αέρα στο γραφείο ή το σαλόνι, όπως πιστεύεται. Οι επιστήμονες μελέτησαν επιστημονικά πορίσματα των τελευταίων 30 χρόνων, εξέτασαν 12 προηγούμενες επιστημονικές μελέτες καθώς και 196 φυτά της τελευταίας δεκαετίας και δημοσίευσαν τα νέα ευρήματά τους στο περιοδικό «Journal of Exposure Science και Environmental Epidemiology». Το συμπέρασμα στο οποίο κατέληξαν είναι ότι κάθε ανοιχτό παράθυρο συμβάλει στην αραίωση πιθανών οργανικών στοιχείων, όπως είναι για παράδειγμα οι υδρογονάνθρακες, οι αλκοόλες, και τα οργανικά οξέα, στους εσωτερικούς χώρους ταχύτερα απ’ ό,τι τα φυτά απορροφούν αυτές τις ενώσεις. Ποιος δημιούργησε όμως τον μύθο ότι τα φυτά εσωτερικού χώρου καθαρίζουν τον αέρα; Ηταν η NASA, όταν το 1989, αναζητώντας τρόπους καθαρισμού του αέρα στους διαστημικούς σταθμούς, ανακοίνωσε ότι τα φυτά μπορούν να κάνουν αυτή τη «δουλειά» και να φιλτράρουν αρκετά καλά τις διάφορες ουσίες από τον αέρα. Για τον σκοπό αυτό τοποθετήθηκε φυτό σε σφραγισμένο θάλαμο και ήρθε αντιμέτωπο με μία και μόνη οργανική ένωση. Η αποσύνθεσή της μελετήθηκε από ειδικούς για ώρες ή μέρες. Το πρόβλημα είναι ότι αυτές οι συνθήκες έχουν εντούτοις ελάχιστα κοινά στοιχεία με τους εσωτερικούς χώρους που συναντάμε στην καθημερινή ζωή στη Γη, σύμφωνα με τους ερευνητές Γουέρινγκ και Κάμινγκ.  Εάν τα φυτά έχουν αρκετό χρόνο, μπορούν πράγματι να καθαρίσουν τον αέρα στο γραφείο. Ωστόσο, για να μπορέσουν να συναγωνιστούν ένα σύστημα εξαερισμού, ο χώρος θα πρέπει να είναι γεμάτος πρασινάδες και συγκεκριμένα: 10 έως 1.000 φυτά ανά τετραγωνικό μέτρο θα ήταν απαραίτητα.  Οποιοσδήποτε περνάει αρκετή ώρα σε ένα κλειστό δωμάτιο είναι λογικό να αισθάνεται μετά από λίγο ασφυκτική τη ζέστη ή τη μύτη του μπουκωμένη. Συνήθως μάλιστα η προσοχή δεν είναι εστιασμένη, το άτομο κοιτάει συνέχεια το ρολόι του και νιώθει μια υπνηλία. Αυτό σημαίνει ότι η ρύπανση του εσωτερικού αέρα είναι σε υψηλά επίπεδα και δημιουργείται συνήθως από κλειστές πόρτες, το μαγείρεμα ή ακόμα και από τις χημικές ουσίες που εμπεριέχονται σε καθαριστικά. Ποια είναι λοιπόν η εναλλακτική; Μπορείτε απλώς να ανοίξετε τα παράθυρα.",https://www.iefimerida.gr/green/ta-fyta-den-katharizoyn-tin-atmosfaira-aera-ereyna
Environment,iefimerida.gr,Κάνε το μπαλκόνι σου λαχανόκηπο -Τι να φυτέψεις τον Απρίλιο για να...μαζεύεις τους επόμενους μήνες,10 04 2020,iefimerida.gr,"Με τις παρούσες συνθήκες απομόνωσης λόγω  κορωνοϊού , αυτή την άνοιξη οφείλουμε να αποδεχτούμε ότι διαθέτουμε άπλετο χρόνο ενώ η δημιουργικότητά μας χτυπάει κόκκινο.  Είναι γεγονός πως η καραντίνα εκτός πέρα από εργαλείο περιορισμού μας δίνει τη δυνατότητα να ανακαλύψουμε τη χαρά σε πιο μικρά αλλά και πιο ουσιαστικά πράγματα. Σαν έναν σπόρο που αγνοούσαμε την ύπαρξή του, αλλά ό ίδιος βρήκε πρόσφορο έδαφος και άνθισε. Ο καιρός ανοίγει σιγά σιγά και η ηλιοφάνεια θα γίνει ο καλύτερός μας σύμμαχος. Το μπαλκόνι, θα γίνει το νέο μαύρο (αφού όλοι θα τη βγάζουμε όπως φαίνεται εκεί), οπότε δεν υπάρχει καταλληλότερη στιγμή να το μετατρέψετε σε μια αστική όαση (όσο μικρό κι αν είναι).  Χρησιμοποιήστε σάκους φύτευσης και υφασμάτινες γλάστρες που μπαίνουν ακόμη και μέσα στο σπίτι (ναι καλά διαβάζετε)﻿ και ξεκινήστε τη φύτευση.  Δείτε τι να φυτέψετε τον Απρίλιο στο Bovary.gr",https://www.iefimerida.gr/green/lahanokipos-sto-mpalkoni-ti-fyteyoyme-ton-aprilio
