subtopic,website,title,date,author,text,url
Environment,iefimerida.gr,Μια ασυνήθιστη μίνι-τρύπα του όζοντος έχει ανοίξει πάνω από την Αρκτική,06 04 2020,iefimerida.gr,"Οι επιστήμονες που αναλύουν τα δεδομένα του ευρωπαϊκού δορυφόρου Copernicus Sentinel-5P, ανακάλυψαν μια σχετικά μικρή  τρύπα του όζοντος  πάνω από την Αρκτική.  Οι ασυνήθιστεςατμοσφαιρικές συνθήκες, που περιλαμβάνουνπολύ χαμηλές θερμοκρασίες στη στρατόσφαιραπάνω από το βόρειο πόλο, έχουν οδηγήσεισε μεγάλη μείωση των συγκεντρώσεων καιαραίωση του όζοντος. Το στρώματου αέριου όζοντος στη στρατόσφαιρααποτελεί μια ασπίδα προστασίας για τηζωή στη Γη από την επιβλαβή υπεριώδηακτινοβολία του Ήλιου, η οποία μπορείνα προκαλέσει καρκίνο του δέρματος καικαταρράκτες στα μάτια, καθώς και άλλαπεριβαλλοντικά προβλήματα. Η πιο γνωστήκαι μεγαλύτερη τρύπα του όζοντος είναιαυτή πάνω από την Ανταρκτική στο νότιοπόλο, που σχηματίζεται κάθε χρόνο στηδιάρκεια του φθινοπώρου. Και οι δύοπόλοι εμφανίζουν εποχικές απώλειεςόζοντος κατά τη διάρκεια του χειμώνα,αλλά η αραίωση πάνω από την Αρκτικήσυνήθως είναι σημαντικά μικρότερη απόό,τι πάνω από την Ανταρκτική. Στο παρελθόνμίνι τρύπες έχουν ανιχνευθεί και πάνωαπό το βόρειο πόλο, αλλά φέτος η τρύπαείναι πολύ μεγαλύτερη σε σχέση με ταπροηγούμενα χρόνια. Οι ερευνητέςτου Γερμανικού Αεροδιαστημικού Κέντρου(DLR), σύμφωνα με ανακοίνωση του ΕυρωπαϊκούΟργανισμού Διαστήματος (ESA), πρόσεξανότι πάνω από την περιοχή του βορείουπόλου έχει δημιουργηθεί μια τρύπα τουόζοντος έκτασης σχεδόν ενός εκατομμυρίουτετραγωνικών χιλιομέτρων, έναντι 20 έως25 εκατομμύρια τετραγωνικά χιλιόμετραπου μπορεί να φθάσει η τρύπα πάνω απότο νότιο πόλο και η οποία συνήθως διαρκείτρεις έως τέσσερις μήνες. Η τρύπα τουόζοντος εμφανίζει εποχική αραίωσηεξαιτίας των πολύ χαμηλών θερμοκρασιώνστη στρατόσφαιρα (κάτω από μείον 80βαθμούς Κελσίου), του ηλιακού φωτός, τωνανέμων και ουσιών όπως οι χλωροφθοράνθρακες. Οι αρκτικέςθερμοκρασίες συνήθως δεν πέφτουν τόσοπολύ όσο οι ανταρκτικές, αλλά φέτος οιισχυροί άνεμοι που πνέουν πέριξ τουΒορείου Πόλου έχουν παγιδεύσει παγωμένοαέρα στη στρατόσφαιρα, πράγμα πουαραιώνει περισσότερο το στρώμα όζοντος.Παρόλα αυτά, η αρκτική τρύπα παραμένειακόμη μικρή σε σχέση με την ανταρκτική.Η τρύπα στην Αρκτική αναμένεται νακλείσει ξανά σε μεγάλο βαθμό έως τα μέσαΑπριλίου φέτος. Το στρώμαόζοντος ανακάμπτει με ρυθμό 1% έως 3% ανάδεκαετία μετά το 2000. Με αυτό το ρυθμό,το όζον στο βόρειο ημισφαίριο αναμένεταινα έχει αποκατασταθεί περίπου το 2030,στο νότιο ημισφαίριο γύρω στο 2050, ενώπάνω από τις πολικές περιοχές έως το2060.",https://www.iefimerida.gr/green/trypa-toy-ozontos-arktiki-epistimi-periballon
Environment,iefimerida.gr,Φτιάχνουμε λαχανόκηπο στο μπαλκόνι! -Τα εύκολα λαχανικά που μπορείτε να φυτέψετε ,25 04 2020,iefimerida.gr,"Ποιος δεν θέλει να τρώει καθημερινά φρέσκα  λαχανικά ; Και ποιος δεν ενθουσιάζεται στη θέα ενός περιποιημένου μποστανιού ακόμη και στη βεράντα ενός διαμερίσματος ή ενός πλούσιου λαχανόκηπου; Σκεφτείτε επίσης ότι μια πολύ καλή ιδέα για να περιορίσετε ακόμα περισσότερο τις μετακινήσεις σας στο σουπερμάρκετ και να μειώσετε τη διασπορά του κορωνοϊού, είναι να δημιουργήσετε τον δικό σας λαχανόκηπο. Και αν αναρωτιέστε τι μπορείτε να φυτέψετε, δείτε ποια λαχανικά είναι εύκολο να ευδοκιμήσουν σε μια αυλή, στη βεράντα ή στον κήπο του σπιτιού σας! Για να φυτέψετε τα δικά σας λαχανικά και να δημιουργήσετε το δικό σας λαχανόκηπο προμηθευτείτε τον εξοπλισμό που θα χρειαστείτε. Αυτός περιλαμβάνει γλαστράκια με τρύπες για να στραγγίζει το νερό, σπόρους (έτοιμους βλαστούς) ώστε να απλώσουν καλύτερα στο χώμα, χώμα ειδικό για φύτευση λαχανικών και λίπασμα το οποίο θα προσθέτετε κάθε δύο με τρεις εβδομάδες, σύμφωνα με τις οδηγίες του πακέτου που περιείχε τους σπόρους. Τα πράσινα φασολάκια θεωρούνται ένα εύκολο στην καλλιέργεια φυτό, κατάλληλο για τους πρωτάρηδες καλλιεργητές. Για να ευδοκιμήσουν χρειάζονται ήλιο, κανονικό πότισμα και μέτριο προς πλούσιο χώμα. Μάλιστα οι φασολιές μπορούν να φτάσουν τα 50 εκατοστά σε ύψος ενώ αναρριχώμενες φτάνουν το 1,5 ως και 2 μέτρα. Οι κολοκυθιές είναι ένα από τα πιο εύκολα στην καλλιέργεια φυτά και έρχονται σε ποικιλία μεγεθών, χρωμάτων και σχημάτων. Ο Απρίλης ειδικά θεωρείται ιδανικός μήνας για να φυτέψετε απευθείας σπόρο κολοκυθιού στη γλάστρα σας.  Χρειάζονται πότισμα κάθε τρεις μέρες και μέσα σε ενάμιση μήνα θα μπορείτε να απολαύσετε κολοκυθάκια τηγανητά, ψητά βραστά που πάνω απ' όλα θα είναι δικά σας.  Το ραπανάκι είναι τέλειο για να συνοδεύσει τη σαλάτα σας και να δώσει μια πιο πικάντικη γεύση. Για να φυτέψετε ραπανάκια, χρησιμοποιήστε γλάστρα με βάθος 15-25 εκατοστών σε δροσερό έδαφος και σχετικά συχνό πότισμα. Θα τα απολαύσετε πολύ γρήγορα αφού ειδικά τα μικρά στρογγυλά ραπανάκια αναπτύσσονται στον 1,5 μήνα μετά τη σπορά.  Όπως τα κολοκύθια, έτσι και τα αγγούρια είναι παραγωγικά και εύκολα καλλιεργούνται. Απλώς δώστε τους ηλιοφανή θέση και θερμοκρασίες μεταξύ 20-25°C για να αναπτυχθούν.  Επιλέξτε επίσης στρογγυλές γλάστρες, διαμέτρου τουλάχιστον 30 εκατοστών, με τρύπα αποστράγγισης για να φεύγει το νερό. Όσον αφορά τις ανάγκες σε πότισμα θα χρειαστεί κάθε δυο μέρες και σε διάστημα 1 - 2 μήνες θα έχετε τα δικά σας αγγουράκια.  Ισως η ντομάτα να είναι και η πιο ελκυστική καλλιέργεια από όλα τα λαχανικά. Άλλωστε με μια σαλάτα μπορεί να αποτελέσει ακόμα και κυρίως γεύμα ενώ σκεφτείτε επίσης, τι ωραίες σάλτσες μπορείτε να δημιουργήσετε με τις δικές σας ντομάτες. Για να την καλλιεργήσετε θα πρέπει καταρχάς να επιλέξετε την ποικιλία που θέλετε. Μικρές, ντοματίνια στρογγυλά, ντοματίνια στενόμακρα, ντομάτες πομοντόρο κ.α. Σε κάθε περίπτωση χρησιμοποιήστε μεγάλες γλάστρες στρογγυλές ή τετράγωνες, με βάθος 30-40 εκατοστά και πλάτος 40 εκατοστά, ένα σημείο που να βλέπει ήλιο και πότισμα κάθε 3 - 4 ημέρες την άνοιξη. Έτσι θα έχετε κόκκινες, ζουμερές, νόστιμες, λαχταριστές ντομάτες.  Όταν όλα αυτά τα λαχανικά μεγαλώσουν, η χαρά σας δεν θα περιγράφεται!  Θα τα κόψετε και θα τα απολαύσετε με διπλό ενθουσιασμό γιατί και θα είναι ολόφρεσκα και θα αποτελούν δικό σας δημιούργημα! Φωτογραφίες: Shuttestock  ",https://www.iefimerida.gr/green/lahanokipos-karantina-poia-lahanika-na-fytepso
Environment,iefimerida.gr,ΥΠΕΝ: Με φυσικό αέριο οι τηλεθερμάνσεις στις λιγνιτικές περιοχές	,29 04 2020,iefimerida.gr,"Το  φυσικό αέριο  θα είναι πλέον το βασικό καύσιμο για όλα τα εν λειτουργία δίκτυα τηλεθέρμανσης που σήμερα εξαρτώνται από τις υπό απόσυρση λιγνιτικές μονάδες της ΔΕΗ, ενώ στις πόλεις της Φλώρινας και της Μεγαλόπολης θα αναπτυχθούν νέα δίκτυα φυσικού αερίου για θέρμανση και οικιακή χρήση. Τον σχεδιασμό για την συνέχιση της λειτουργίας των τηλεθερμάνσεων μετά την  κατάργηση της λιγνιτικής παραγωγής ρεύματος  ανακοίνωσε σήμερα το υπουργείο Περιβάλλοντος και Ενέργειας με βάση τις κατευθύνσεις της Κυβερνητικής Επιτροπής για αδιάλειπτη λειτουργία των υφιστάμενων δικτύων κατά το μεταβατικό διάστημα και τη μη πρόσθετη επιβάρυνση των καταναλωτών και τις μελέτες της Συντονιστικής Επιτροπής του Σχεδίου Δίκαιης Αναπτυξιακής Μετάβασης των λιγνιτικών περιοχών. Για τα έργα τηλεθερμάνσεων που ήδη λειτουργούν (Πτολεμαΐδα, Κοζάνη, Αμύνταιο) καθώς και για το συμπληρωματικό έργο των Εργατικών Πολυκατοικιών Πτολεμαΐδας, θα διασφαλισθεί από τη Δημόσια Επιχείρηση Δικτύων Διανομής Αερίου (ΔΕΔΑ) η παροχή του απαιτούμενου θερμικού φορτίου με φυσικό αέριο σε αντικατάσταση του φορτίου που σήμερα παρέχεται από τους θερμικούς σταθμούς της ΔΕΗ. Παράλληλα για την λειτουργικότητα του ανωτέρω συστήματος θα υλοποιηθούν και έργα προσαρμογής (νέα λεβητοστάσια, συμπληρωματικά δίκτυα κλπ). Οι δαπάνες όλων των ανωτέρω παρεμβάσεων θα καλυφθούν από το ΕΣΠΑ 2014-2020 (ΕΠ-ΥΜΕΠΕΡΑΑ). Ολα τα λοιπά νέα έργα Τηλεθέρμανσης σε περιοχές της Δυτικής Μακεδονίας, θα αντιμετωπιστούν στο πλαίσιο του γενικότερου προγραμματισμού και ανασχεδιασμού βασισμένου στις νέες συνθήκες που έχουν προκύψει. Επισημαίνεται ακόμη ότι η προμήθεια φυσικού αερίου στην Φλώρινα και τη Μεγαλόπολη θα γίνεται σε ανταγωνιστικές τιμές από προμηθευτές που θα έχουν ελεύθερη πρόσβαση στο δίκτυο φυσικού αερίου που θα αναπτυχθεί, προκειμένου οι καταναλωτές να επιλέγουν ελεύθερα τον προμηθευτή τους. Επίσης, στις περιοχές που η παρεχόμενη θερμότητα στις τηλεθερμάνσεις θα παράγεται με καύσιμο φυσικό αέριο, οι δημοτικές επιχειρήσεις που λειτουργούν τις εγκαταστάσεις θα προμηθεύονται με αντίστοιχο τρόπο το φυσικό αέριο, προκειμένου να παρέχεται στους καταναλωτές θερμική ενέργεια σε ανταγωνιστικές τιμές. «Η απρόσκοπτη και βιώσιμη θέρμανση των λιγνιτικών περιοχών κατά τη μεταβατική περίοδο αποτελεί κεντρικό άξονα του προγράμματος της απολιγνιτοποίησης, όπως έχουμε δεσμευθεί ενώπιον των τοπικών κοινωνιών. Με συστηματική δουλειά και με βάση το σχέδιο που ανακοίνωσε η πολιτική ηγεσία του ΥΠΕΝ και του Υπουργείου Ανάπτυξης τον Φεβρουάριο στην Πτολεμαΐδα και τον Ιανουάριο στη Μεγαλόπολη, η Συντονιστική Επιτροπή προωθεί την υλοποίηση όλων των 12 μέτρων άμεσης δράσης». Ο πρόεδρος της Συντονιστικής Επιτροπής Δίκαιης Αναπτυξιακής Μετάβασης Κωστής Μουσουρούλης υπογράμμισε: «Με γνώμονα το συμφέρον των τοπικών κοινωνιών και σε συνεργασία με τις αρμόδιες αυτοδιοικήσεις, αντιμετωπίσαμε τα σύνθετα ζητήματα προγραμματισμού των αναγκαίων επενδύσεων αξιοποιώντας με τον καλύτερο δυνατό τρόπο του πόρους του ΕΣΠΑ 2014-2020, προκειμένου να καλυφθούν οι ανάγκες θέρμανσης υφιστάμενων και νέων καταναλωτών στις λιγνιτικές περιοχές της χώρας».",https://www.iefimerida.gr/green/fysiko-aerio-tilethermanseis-lignitikes-periohes
subtopic,website,title,date,author,text,url
Food,iefimerida.gr,Συνταγή για εύκολο σοκολατένιο γλυκό ψυγείου ,29 04 2020,iefimerida.gr,"Είμαστε ακόμη σε καραντίνα και συνεχίζουμε να μαγειρεύουμε μανιωδώς. Μια πανεύκολη  συνταγή  για ένα διαφορετικό, σοκολατένιο γλυκό ψυγείου.  Τα γλυκά  ψυγείου η ελληνική οικογένεια τα λατρεύει και τώρα που ανοίγει ο καιρός δεν λείπουν από κανένα ψυγείο! Από εδώ έχουμε δει πολλές συνταγές για γλυκά ψυγείου, το  κλασικό με την φρυγανιά και το ζελέ , άλλα λίγο πιο πρωτότυπα όπως η  συνταγή  για τη χειμωνιάτικη εκδοχή του γλυκού ψυγείου με φρυγανιές.  Τώρα ήρθε η ώρα να δούμε ένα διαφορετικό γλυκό ψυγείου, μια συνταγή σχετικά εύκολη, με μόλις 5 υλικά. Σκέτη απόλαυση! Αυτή είναι η δόση για ένα κλασικό ορθογώνιο ταψί. Αν θέλετε να κάνετε μια στρογγυλή μέτρια φόρμα, μπορείτε να κάνετε τη συνταγή με τη μισή δόση. ",https://www.iefimerida.gr/gastronomie/syntagi-gia-eykolo-sokolatenio-glyko-psygeioy
Food,iefimerida.gr,Συνταγή για σπιτικό γύρο -Εύκολος και πεντανόστιμος,29 04 2020,iefimerida.gr,"Με την καραντίνα να συνεχίζεται, η κουζίνα και οι  συνταγές  παραμένουν αγαπημένη δημιουργική απασχόληση. Παρακάτω βλέπουμε μια υπέροχη συνταγή για σπιτικό γύρο.  Μια λιχουδιά που σίγουρα θα λατρέψει όλη η οικογένεια και θα την φέρει και πιο κοντά μιας και η... συναρμολόγηση του τελικού πιάτου μοιάζει με παιχνίδι. Μια σχετικά εύκολη συνταγή η οποία απλά απαιτεί λίγο χρόνο για το μαρινάρισμα. Κατά τα άλλα διασκεδαστική. Ετοιμάστε παράλληλα  σπιτικές πίτες, για τις οποίες είδαμε πρόσφατα συνταγή , φτιάξετε μια  τηγανιά πατάτε ς, λίγο τζατζίκι, κόψτε κρεμμύδι, ντομάτα, λίγο μαϊντανό και ετοιμάστε ένα δείπνο που σίγουρα θα σας ξετρελάνει. ",https://www.iefimerida.gr/gastronomie/syntagi-gia-spitiko-gyro-eykolos-kai-pentanostimos
Food,iefimerida.gr,"Συνταγή για πίτα βουτύρου στο τηγάνι, με 3 υλικά -Ινδική Παράθα",28 04 2020,iefimerida.gr,Οι πίτες αποτελούν αγαπημένο φαγητό όλων. Ξεφεύγοντας από τα συνηθισμένα βλέπουμε εδώ μια υπέροχη  συνταγή  για μια πίτα από την Ινδία. Παράθα λοιπόν.  Πρόκειται για μια συνταγή που βασίζεται στο αλεύρι και στο βούτυρο και μια συνταγή που μπορεί σαν παρασκευή να είναι εύκολη έχει κάποια δυσκολία στο άνοιγμα της πίτας.  Το βίντεο που συνοδεύει τη συνταγή λύνει όλες τις απορίες για να φτιάξετε την πίτα σας η οποία μπορεί να συνοδεύσει την αφράτη ομελέτά σας (δείτε μια  συνταγή  εδώ) ή τις υπέροχες και δυναμωτικές φακές (πρόσφατα είδαμε μια  συνταγή για φακές όπως τις φτιάχνουν στο Μαρόκο ). ,https://www.iefimerida.gr/gastronomie/syntagi-gia-pita-boytyroy-sto-tigani-indiki-paratha
Food,iefimerida.gr,Με αυτή τη συνταγή για σουβλάκια κοτόπουλο θα απογειώσεις το street food από την κουζίνα σου,28 04 2020,iefimerida.gr,"Είναι το ελληνικό παραδοσιακό street food που λατρεύουν μικροί και μεγάλοι. Ενα φαγητό γρήγορο, εύκολο που ικανοποιεί πάντα την πείνα χωρίς περιττά λιπαρά. Το  σουβλάκι  κοτόπουλο. Τρυφερά και ζουμερά κομματάκια κρέας περασμένα σε καλαμάκι με τη νοστιμιά τους να οφείλεται εν μέρει στη μαρινάδα μέσα στην οποία έχουν ξεκουραστεί. Τα σουβλάκια κοτόπουλο θέλουν την τέχνη τους, δηλαδή τα σωστά υλικά για να απογειωθούν και να γίνουν ένα πιάτο που μπορείτε να προσφέρετε σε όλους. Με αυτή τη συνταγή είναι βέβαιο ότι θα θέλετε να κάνετε μπάρμπεκιου κάθε μέρα. Η απίθανη μαρινάδα του chef Αλέξανδρου Παπανδρέου δίνει στο κοτόπουλο μια απερίγραπτη νοστιμιά, ενώ το κάνει πολύ τρυφερό. Το αγαπημένο πιάτο ολόκληρης της οικογένειας θα γίνει ακόμη πιο λαχταριστό... Δείτε τη συνταγή στο Bovary.gr",https://www.iefimerida.gr/gastronomie/syntagi-soyblakia-kotopoylo-alexandros-papandreoy
Food,iefimerida.gr,"Συνταγή για ισπανική ομελέτα κόλαση -Με λιωμένη πατάτα, θεϊκή",25 04 2020,iefimerida.gr,"Μια  συνταγή  για μια ομελέτα διαφορετική, πλούσια, πλήρες γεύμα, ιδανική για το βράδυ του Σαββάτου ή για σπιτικό brunch την Κυριακή.  Συνταγές για ομελέτες  η αλήθεια είναι ότι υπάρχουν πολλές. Και συνταγές για πατάτες με αυγά επίσης. Η ισπανική ομελέτα είναι μια ομελέτα με πατάτες, αλλά με τις πατάτες ενσωματωμένες, είτε λιωμένες, είτε τριμμένες, με το αποτέλεσμα να είναι κάτι παραπάνω από συναρπαστικό.  Δοκιμάστε αυτή τη συνταγή και δεν θα χάσετε... Φτιάξτε και μια εύκολη μους σοκολάτα (είδαμε εδώ μια πανεύκολη  συνταγή μους σοκολάτας ) για να κλείσετε γλυκά το Σαββατόβραδό σας, για να έχετε ένα πιο ολοκληρωμένο brunch. ",https://www.iefimerida.gr/gastronomie/syntagi-gia-ispaniki-omeleta-kolasi
Food,iefimerida.gr,"Συνταγή για oreo cheesecake -Χωρίς ψήσιμο, με «τρελή» γεύση",29 04 2020,iefimerida.gr,"Η αλήθεια είναι πως το Cheesecake στην Ελλάδα έχει ταυτιστεί με  συνταγές  που δεν χρειάζονται ψήσιμο. Ωστόσο, αυτό το δροσερό γλυκό συνδυάζει δύο γλυκές αμαρτίες σε μία. Από τη μίαέχουμε την απόλυτη γεύση τυριού στηνκρέμα ενός γλυκού που έχει γίνει από ταδιασημότερα στον κόσμο και από την άλλη,το κλασικό μπισκότο oreo που προσφέρειμια γλυκιά (έχετε προσέξει τις αλμυρέςνότες που αφήνει;) αφορμή για δεκάδεςσυνταγές.Όταν είδαμετην παρακάτω συνταγή κάτι μέσα μας είπεπως αυτό το γλυκό πρέπει να το δοκιμάσουμε.Δείτε την εικόνα και θα καταλάβετε. ",https://www.iefimerida.gr/gastronomie/syntagi-gia-oreo-cheesecake
