subtopic,website,title,date,author,text,url
Sports,tanea.gr,«Βόμβα»: Ο Ολυμπιακός προσέφυγε στο CAS για ΠΑΟΚ και Ξάνθη,28 Απριλίου 2020 | 21:04,tanea.gr,"Ο Ολυμπιακός δικαιώθηκε απόλυτα ΠΑΝΤΟΥ στην υπόθεση της πολυιδιοκτησίας ΠΑΟΚ-Ξάνθης. Και ετοιμάζεται να δικαιωθεί και στο CAS όπου σύμφωνα με πληροφορίες προσέφυγε κατά του ΠΑΟΚ και της Ξάνθης για την υπόθεση της πολυιδιοκτησίας που είναι πλέον και με την βούλα επίσημη και επικυρωμένη από τα ελληνικά δικαστήρια. Από καταγγελία του Ολυμπιακού ξεκίνησε η έρευνα της Επιτροπής Επαγγελματικού Αθλητισμού όπου αποφάνθηκε πως ΠΑΟΚ και Ξάνθη έχουν κοινή ιδιοκτησία, κάτι που απαγορεύεται ρητά. Τόσο πρωτόδικα όσο και στην Επιτροπή Εφέσεων αποδείχθηκε πως ο ΠΑΟΚ και η Ξάνθη παρανόμησαν και συνεχίζουν να παρανομούν έχοντας την ίδια ιδιοκτησία. Τελεσίδικα πλέον για την ελληνική δικαιοσύνη υπάρχει πολυιδιοκτησία. ΠΑΟΚ και Ξάνθη θα ήταν τώρα στην δεύτερη κατηγορία αν δεν προέκυπτε η τροπολογία της Κυβέρνησης που για να μην… χωρίσει την Ελλάδα στα δύο ο ΠΑΟΚ όπως απειλούσε άλλαξε την ποινή του υποβιβασμού για την βαριά παρανομία σε αφαίρεση βαθμών. Όλα αυτά βεβαίως όταν είχε ήδη βγει επισήμως η απόφαση της ΕΕΑ που είναι και δεσμευτική όπως αποφάνθηκαν άλλωστε όλα τα δικαστήρια. Ο Ολυμπιακός παρά την τεράστια του δικαίωση δεν μένει εδώ! Από την πρώτη στιγμή είχε τονίσει με επιστολή του πως η παρέμβαση της Κυβέρνησης δεν έπρεπε να είχε συμβεί.  ",https://www.tanea.gr/2020/04/28/sports/vomva-o-olympiakos-prosefyge-sto-cas-gia-paok-kai-ksanthi/
Sports,tanea.gr,Superleague : Παρόντες στην τηλεδιάσκεψη Μαρινάκης και Αλαφούζος,29 Απριλίου 2020 | 12:03,tanea.gr,"Βαγγέλης Μαρινάκης και Γιάννης Αλαφούζος παίρνουν μέρος στην κρίσιμη τηλεδιάσκεψη της Superleague. Εκτός των μεγαλομετόχων Ολυμπιακού και Παναθηναϊκού, στη σύσκεψη βρίσκονται οι: Μ.Λυσάνδρου (ΑΕΚ) Αρ. Πιαλόγλου (Ξάνθη) Χρ.Δάρας (Πανιώνιος) Ηλ.Πουρσανίδης (ΟΦΗ) Μ.Γκαγκάτσης (ΠΑΟΚ) Σ.Τσικνής (Λαμία) Λ.Μπουτσικάρης (ΠΑΟ) Κ.Κοξένογλου (Ατρόμητος) Αλ.Κούγιας (ΑΕΛ) Τ.Αγραφιώτης (Ολυμπιακός) Στ.Αντωνίου (ΕΠΟ) Δ.Μποροβήλος (Αστέρας) Π.Λούτσος (Βόλος) Απουσιάζει ο Παναιτωλικός.  ",https://www.tanea.gr/2020/04/29/sports/football/superleague-parontes-stin-tilediaskepsi-marinakis-kai-alafouzos/
Sports,tanea.gr,Τι σκέφτεται ο Τσιγκρίνσκι - Τι σχεδιάζει η ομάδα,26 Απριλίου 2020 | 13:18,tanea.gr,"Ρευστή είναι η κατάσταση στην ΑΕΚ όσον αφορά το κέντρο της άμυνάς της ενόψει της επόμενης σεζόν. Ο Όγκνιεν Βράνιες είναι δανεικός χωρίς οψιόν και θα πρέπει αρχικά να επιστρέψει το καλοκαίρι (όταν και αν ολοκληρωθεί η αγωνιστική περίοδος) στην Άντερλεχτ, ενώ ολοκληρώνεται και το συμβόλαιο του Ντμίτρο Τσιγκρίνσκι. Έτσι, βάσει συμβολαίου, οι σίγουροι στα στόπερ για την επόμενη σεζόν είναι οι Σβάρνας, Οικονόμου και Λάτσι. Όσον αφορά τον ουκρανό αμυντικό όμως τα πάντα είναι ανοιχτά ακόμη, αφού δεν έχει ληφθεί κάποια οριστική απόφαση για το μέλλον του. Ο Τσιγκρίνσκι έχει όρο αυτόματης ανανέωσης στο συμβόλαιό του αν πιάσει τις 25 συμμετοχές (μέχρι τη διακοπή είχε 17), και όπως αναφέρει σε σημερινό της ρεπορτάζ η «Ώρα» η επιθυμία του είναι όχι μόνο να συνεχίσει για τουλάχιστον μία ακόμη σεζόν στην Ένωση αλλά και να ηγηθεί της «κιτρινόμαυρης» άμυνας. Ο ίδιος νιώθει πολύ καλά σωματικά και πιστεύει πως μπορεί να παίξει 20-25 παιχνίδια την επόμενη σεζόν (τόσος είναι και ο μέσος όρος του αυτά τα χρόνια στην ΑΕΚ), ενώ δεδομένη είναι η εκτίμηση των ανθρώπων της ομάδας προς το πρόσωπό του, τόσο ως ανθρώπου όσο και ως ποδοσφαιριστή. Όλα λοιπόν θα ξεκαθαρίσουν στις συζητήσεις που θα γίνουν το επόμενο διάστημα, ενώ δεδομένο είναι πως στην ΑΕΚ θα ήθελαν τον Τσιγκρίνσκι σε κάποιο πόστο και μετά το τέλος της καριέρας του.  ",https://www.tanea.gr/2020/04/26/sports/football/ti-skeftetai-o-tsigkrinski-ti-sxediazei-i-omada/
Sports,tanea.gr,"Ινσούα : Η μάχη ΠΑΟΚ, ΑΕΚ και Ολυμπιακού για την απόκτησή του – Το πλεονέκτημα του ΠΑΟ",21 Απριλίου 2020 | 13:04,tanea.gr,"Είναι ο πλέον περιζήτητος ελεύθερος ποδοσφαιριστής στο ελληνικό ποδόσφαιρο. Ο πρώτος εδώ και αρκετά χρόνια που έβαλε όλους τους ισχυρούς του ποδοσφαίρου μας να μπουν στη διαδικασία να «κονταροχτυπηθούν» για το ποιος θα τον αποκτήσει. ΟΚ, η μάχη για την απόκτηση του Εμάνουελ Ινσούα, περί ου ο λόγος , δεν έχει πάρει ακόμη φωτιά, ωστόσο είναι σαφές ότι Ολυμπιακός, ΠΑΟΚ και ΑΕΚ τον έχουν στους βασικούς στόχους τους ενόψει της νέας σεζόν. Ο 28χρονος αριστερός μπακ μένει ελεύθερος από τον Παναθηναϊκό σε λίγες εβδομάδες. ",https://www.tanea.gr/2020/04/21/sports/football/insoua-i-maxi-paok-aek-kai-olympiakou-gia-tin-apoktisi-tou-to-pleonektima-tou-pao/
Sports,tanea.gr,Αυτή είναι η ΑΕΚ που θέλει να φτιάξει ο Καρέρα,23 Απριλίου 2020 | 11:42,tanea.gr,"Ο Μάσιμο Καρέρα είναι ο άνθρωπος πάνω στον οποίο θα στηριχθεί η ΑΕΚ για να επιστρέψει στην κορυφή. Ο Ιταλός προπονητής κέρδισε την εμπιστοσύνη της διοίκησης, που του έδωσε τα κλειδιά, προκειμένου να δημιουργήσει μια ομάδα βάσει των δικών του «θέλω». Ένα σύνολο που θα έχει ξεκάθαρα τη σφραγίδα του και που θα έχει διαφορές σε σχέση με το φετινό. Ωστόσο, θα υπάρχουν και κάποια κοινά στοιχεία, που θα κρατήσει η ΑΕΚ από την χρονιά που διανύουμε. Διαβάστε περισσότερα  εδώ",https://www.tanea.gr/2020/04/23/sports/football/ayti-einai-i-aek-pou-thelei-na-ftiaksei-o-karera/
Sports,tanea.gr,Παναθηναϊκός : Κοιτάζει τον 26χρονο Φάρλεϊ Ρόσα του Παναιτωλικού,2 Απριλίου 2020 | 09:41,tanea.gr,Ακόμα μία εγχώρια λύση φέρεται να απασχολεί τους «πράσινους» για τα άκρα της επίθεσης. Η εφημερίδα Sportime υποστηρίζει ότι ο Φάρλεϊ Ρόκα έχει τεθεί υπόψη των Τσάβι Ρόκα και Γιώργου Δώνη και θα τον εξετάσουν εν όψει της θερινής μεταγραφικής περιόδου. Ο 26χρονος εξτρέμ μένει ελεύθερος από τον Παναιτωλικό το καλοκαίρι και θα ήθελε να πάρει μεταγραφή στον Παναθηναϊκό. Διαβάστε περισσότερα  εδώ,https://www.tanea.gr/2020/04/02/sports/football/panathinaikos-koitazei-ton-26xrono-farlei-rosa-tou-panaitolikou/
Sports,tanea.gr,Κούγιας : «Κατάπτυστη η ανακοίνωση του ΠΑΟΚ – Δε σέβεται την Ελλάδα ο Γιώργος Σαββίδης»,15 Απριλίου 2020 | 13:56,tanea.gr,"Ο Αλέξης Κούγιας με προσωπική του δήλωση εξαπέλυσε «βολές» κατά του ΠΑΟΚ, για την ανακοίνωση που εξέδωσε ο Δικέφαλος του βορρά μετά τη διατήρηση της ποινής αφαίρεσης 7 βαθμών από την Επιτροπή Εφέσεων της ΕΠΟ. Ο μεγαλομέτοχος της ΑΕΛ μίλησε για την χωρίς ίχνος ντροπής ανακοίνωση του ΠΑΟΚ, ενώ έκανε ειδικά αναφορά και στον Γιώργο Σαββίδη για την χθεσινή ανάρτηση του, ξεκαθαρίζοντας πως δεν σέβεται την Ελλάδα. Αναλυτικά η δήλωση του Αλέξη Κούγια:Με ακραία δυσάρεστη έκπληξη και προσωπική αγανάκτηση ως Δικηγόρος που υπηρετώ το χώρο της Δικαιοσύνης καθημερινά 45 χρόνια, διάβασα, άκουσα και είδα σε μέσα μαζικής ενημέρωσης που ελέγχονται από την ΠΑΕ ΠΑΟΚ (ευτυχώς η συντριπτική πλειοψηφία των άλλων μέσων σε όλη την Ελλάδα δεν έκανε το ίδιο), λέξη προς λέξη την ανακοίνωση της ΠΑΕ ΠΑΟΚ, με την οποία χωρίς ίχνος ντροπής, προσωπικού και νομικού αυτοσεβασμού, μετά από 3 καταδικαστικές κρίσεις ανεξάρτητης αρχής και τακτικών Δικαστών, οι υπεύθυνοι επικοινωνίας της ΠΑΕ ΠΑΟΚ και ο λαλίστατος και εσχάτως εμφανισθείς ως νομικός σωτήρας της ΠΑΕ κος Μπαλτάκος, «καπελώνοντας» με ανάγωγο τρόπο τους συνυπερασπιστές του αξιόλογους δικηγόρους και καθηγητές πανεπιστημίου, ένας δικηγόρος τον οποίο δεν έχω συναντήσει ποτέ σε ένα Δικαστήριο σε όλη την καριέρα μου (είμαι βέβαιος, κατά την προσωπική μου κρίση, ότι αυτοί συνέταξαν αυτή την κατάπτυστη – παράνομη ανακοίνωση, αφού αυτοί όλο αυτό το χρονικό διάστημα προσπαθούν να κάνουν το άσπρο μαύρο), επιτίθενται και προσπαθούν να κατεξευτελίσουν με ταπεινά επιχειρήματα και με τη συνδρομή ανήθικων ανθρώπων τόσο το προπύργιο της αληθινής Δημοκρατίας, την ανεξάρτητη Δικαιοσύνη και τα επίλεκτα μέλη της, όσο και διακεκριμένους επιστήμονες, καθηγητές πανεπιστημίου, επίλεκτους συνταξιούχους δικαστικούς, επίλεκτους οικονομολόγους, μέλη της ΕΕΑ, με μοναδική σκοπιμότητα να παραπλανήσουν τους εκατοντάδες χιλιάδες αγνούς οπαδούς της ΠΑΕ ΠΑΟΚ και τους λιγοστούς οπαδούς της ΠΑΕ ΞΑΝΘΗ και για να μην παραδεχτούν, όπως κάνουν όλοι οι φυσιολογικοί άνθρωποι, το σφάλμα της ιδιοκτησίας της ΠΑΕ ΠΑΟΚ και των συμβούλων της, με το οποίο παραβίασαν ακραίως όσα προβλέπονται στην καταστροφική για το ποδόσφαιρο παράβαση του νόμου περί πολυϊδιοκτησίας ποδοσφαιρικών ομάδων, παράνομη συμπεριφορά η οποία παγκοσμίως τιμωρείται με την ποινή του υποβιβασμού και, λόγω της χαριστικής τροπολογίας της κυβερνήσεως Μητσοτάκη στην Ελλάδα, με συνεχή αφαίρεση βαθμών, όσο διαρκεί το καθεστώς της πολυϊδιοκτησίας. Κύριοι, η συμπεριφορά σας και τα όσα λέτε στην κατάπτυστη ανακοίνωσή σας, δεν προσβάλλουν μόνο την ελληνική Δημοκρατία, την ελληνική Δικαιοσύνη, τους Έλληνες Δικαστές και το σύνολο των ανεξάρτητων ποδοσφαιρικών ομάδων, που δεν τόλμησαν να παρέμβουν όπως η ΠΑΕ ΑΕΛ και να καταγγείλουν, λόγω της επικοινωνιακής τρομοκρατίας, την οποία προσπαθείτε να εγκαθιδρύσετε, τις παράνομες πράξεις, τις οποίες διέπραξαν οι ΠΑΕ ΠΑΟΚ και ΞΑΝΘΗ, αλλά προσβάλλουν και εμάς τους Δικηγόρους που υποστηρίξαμε με νομική επάρκεια, ευπρέπεια και κάθε νόμιμο μέσο τις καταγγελίες κατά των δύο ΠΑΕ και δικαιωθήκαμε. Δεν ανέχομαι τόσο ο ίδιος με την προσωπική μου διαδρομή, όσο και εν ονόματι των υπολοίπων συναδέλφων που συμπαρασταθήκαμε στην υπόθεση αυτή και δικαιωθήκαμε στις νομικές μας προβλέψεις, αλλά και εν ονόματι όλων των Ελλήνων συναδέλφων Δικηγόρων μου, μόνο και μόνο για να παραπλανηθούν οι εκατοντάδες χιλιάδες έντιμοι οπαδοί του ιστορικού ΠΑΟΚ και οι λιγοστοί της ΠΑΕ ΞΑΝΘΗ, αλλά και για τους ιδιοτελείς σκοπούς υπαλλήλων και δικηγόρων να θεωρούμεθα ως μέρος ενός βρόμικου συστήματος απονομής Δικαιοσύνης στην Ελλάδα, όπως καταλήγει η κατάπτυστη ανακοίνωσή σας. Θα περιμένω τις αντιδράσεις των Εισαγγελικών αρχών στην Θεσσαλονίκη και την Αθήνα, των ποδοσφαιρικών Εισαγγελέων στη Θεσσαλονίκη και την Αθήνα, αλλά και τις αντιδράσεις των ενώσεων Δικαστών – Εισαγγελέων και ακολούθως θα προβώ προσωπικά στις δέουσες νομικές ενέργειες. Υ.Γ. Περισσότερο απ’ όλα με έχει καταπλήξει η έλλειψη σεβασμού στην Ελλάδα, στο πολίτευμά της και στην ελληνική Δικαιοσύνη, την οποία εκδήλωσε ο γιος του Ιβάν Σαββίδη Γιώργος Σαββίδης με την φράση που ανήρτησε στο instagram «η πιο δημοκρατική χώρα, το πιο ανεξάρτητο δικαστήριο». Δεν γνωρίζω την παιδεία και την προσωπικότητα του νεαρού Γιώργου Σαββίδη, γιατί στην Ελλάδα βρίσκεται μόνο λίγα χρόνια και δεν έχει εκδηλώσει άλλη κοινωνική παρουσία και ειδικά αυτός που έχει ζήσει τα περισσότερα χρόνια σε μία χώρα που μετά την ρωσική επανάσταση μόνο δημοκρατία δεν υπήρξε ποτέ και όπου οποιοσδήποτε προσπαθούσε να αρθρώσει έστω και μια λέξη απέναντι σε ένα ολοκληρωτικό καθεστώς, είτε έχανε τη ζωή του, είτε εφυλακίζετο στα κάτεργα της Σιβηρίας, αλλά στο λίγο χρόνο που βρίσκεται στην Ελλάδα, θα έπρεπε να έχει μάθει από το ελληνικό περιβάλλον του ότι αυτή η χώρα δίδαξε και διδάσκει καθημερινά τη Δημοκρατία σε όλο τον κόσμο και ότι ο τρόπος απονομής της Δικαιοσύνης που δίδαξε η Ελλάδα ακόμη και από την εποχή του Περικλέους, είναι αυτός που αποτελεί το πρότυπο της απονομής της Δικαιοσύνης σε όλες τις χώρες που έχουν αληθινή Δημοκρατία. Όλοι εμείς που έχουμε γνωρίσει τον Ιβάν Σαββίδη και την οικογένειά του, αλλά και όλη η ελληνική κοινωνία τούς σεβόμαστε και τους περιβάλλουμε με αγάπη για τα όσα έχουν προσφέρει και προσφέρουν στην ελληνική κοινωνία, στον ΠΑΟΚ και στο ελληνικό ποδόσφαιρο, αλλά το ίδιο θα πρέπει να κάνουν και αυτοί προς όλους εμάς τους υπόλοιπους Έλληνες πολίτες, οι οποίοι είμαστε και υπερήφανοι για τη Δημοκρατία μας, αλλά και εμπιστοσύνη έχουμε στην ελληνική Δικαιοσύνη και δεν πρέπει για ένα λάθος να εξευτελίζουμε, και ειδικά όταν είμαστε επώνυμα πρόσωπα, την χώρα, στην οποία ζούμε και θα ζήσουν και τα παιδιά μας.  ",https://www.tanea.gr/2020/04/15/sports/football/kougias-kataptysti-i-anakoinosi-tou-paok-de-sevetai-tin-ellada-o-giorgos-savvidis/
Sports,tanea.gr,"Βόμβες και αποκαλύψεις Κούγια για «Σαγόνια», ΠΑΟΚ, αλλά και τη σχέση του με τον Μαρινάκη",21 Απριλίου 2020 | 15:40,tanea.gr,"Νέα ανακοίνωση-απάντηση στον Κυριάκο Θωμαΐδη από τον Αλέξη Κούγια, μέσω της επίσημης ιστοσελίδας της ΑΕΛ. Βόμβες και αποκαλύψεις από τον μεγαλομέτοχο της Λάρισας. Αναλυτικά όσα αναφέρει ο Κούγιας: Απάντηση Ν.1 προς τον Σαγόνια, έντιμο – ανεξάρτητο δημοσιογράφο – εξυγιαντή – λάτρη μόνο της αλήθειας – τον άνθρωπο που φαντασιώθηκε σε όλη του τη ζωή, παρά το ότι τελείωσε μόνο το Γυμνάσιο, το λειτούργημα του εισαγγελέα και του δικαστή. ",https://www.tanea.gr/2020/04/21/sports/football/vomves-kai-apokalypseis-kougia-gia-sagonia-paok-alla-kai-ti-sxesi-tou-me-ton-marinaki/
