subtopic,website,title,date,author,text,url
world,www.cnn.gr,Κορωνοϊός - Εκτός ελέγχου η κατάσταση στην Τουρκία: «Θερίζει» η πανδημία,"21:14 Κυριακή, 19 Απριλίου 2020","Newsroom, CNN Greece","Σε 86.306 ανήλθαν τα επιβεβαιωμένα κρούσματα της πανδημίας του  κορωνοϊού  στην  Τουρκία , ανακοίνωσε ο υπουργός Υγείας  Φαχρετίν Κότζα , καθώς 3.977 νέα κρούσματα καταγράφηκαν κατά το τελευταίο εικοσιτετράωρο στην χώρα. Ο υπουργός Υγείας, Φαχρετίν Κότζα ανακοίνωσε ότι 127 άνθρωποι πέθαναν κατά τις τελευταίες 24 ώρες, επί συνόλου 2.017 νεκρών της επιδημίας και ότι 35.344 διαγνωστικά τεστ έχουν πραγματοποιηθεί κατά το τελευταίο 24ωρο. Η Τουρκία έχει τον μεγαλύτερο αριθμό κρουσμάτων εκτός της Ευρώπης και των Ηνωμένων Πολιτειών, καταλαμβάνοντας την 7η θέση στην παγκόσμια κατάταξη. Το υπουργείο Εσωτερικών της Τουρκίας ανακοίνωσε, επιπλέον, ότι παρατείνει τους περιορισμούς στις μετακινήσεις μεταξύ 31 πόλεων για άλλες 15 ημέρες, αρχής γενομένης από απόψε τα μεσάνυχτα. Κατά τη διάρκεια της εβδομάδας, η εντολή «μένουμε στο σπίτι» ισχύει μόνο για τους κάτω των 20 και άνω των 65 ετών . Όλοι οι άλλοι πολίτες θεωρητικά μπορούν να βγουν έξω, παρότι πολλές μικρές επιχειρήσεις είναι κλειστές, τα εστιατόρια είναι ανοικτά μόνο για επί τόπου παραλαβή ή delivery, οι δημόσιοι χώροι, όπως τα πάρκα είναι κλειστοί, και οι τράπεζες λειτουργούν περιορισμένες ώρες. Σε αντίθεση, οι οικοδομές, τα εργοστάσια και άλλες επιχειρήσεις λειτουργούν κανονικά. Κάποιοι ειδικοί λένε ότι οι μερικοί περιορισμοί όπως αυτοί που ισχύουν στην Τουρκία μπορεί να είναι επιτυχημένοι, αρκεί οι ευπαθείς ομάδες να προστατεύονται και αυτοί που συνεχίζουν να κυκλοφορούν, να ακολουθούν τις ενδεδειγμένες οδηγίες.  «Είναι μια εναλλακτική στρατηγική», λέει ο δρ. Μοχάμαντ Μουνίρ , βιολόγος από το Πανεπιστήμιο Λάνκαστερ στο Ηνωμένο Βασίλειο, εξηγώντας ότι οι υγιείς που βγαίνουν έξω δεν βλάπτουν απαραίτητα. Ο δρ. Τζέρεμι Ρόσμαν, λέκτορας ιολογίας στο Πανεπιστήμιο του Κεντ, από την άλλη, ότι πρόκειται για ριψοκίνδυνη τακτική , δεδομένων του αριθμού των νεκρών και των κρουσμάτων που ανακοινώνει καθημερινά η Τουρκία, και ότι τα μερικά lockdown είναι αποτελεσματικά μόνο γίνονται εγκαίρως όταν τα κρούσματα είναι ακόμη λίγα, ή όταν το φαινόμενο σε μια χώρα έχει φτάσει στην κορύφωσή του και αρχίζει η απόσυρση των περιοριστικών μέτρων. «Στο επίπεδο της Τουρκίας, οι περισσότερες χώρες επιβάλουν πλήρες lockdown. Το μερικό lockdown μπορεί να είναι καλό, βοηθώντας στην ισορροπία της οικονομίας μιας χώρας ενώ παράλληλα αυτή προσπαθεί να συγκρατήσει τον ιό. Έχει να κάνει με το κατά πόσο ο πληθυσμός ανταποκρίνεται στις οδηγίες και κατά πόσο εφαρμόζονται τα μέτρα υγιεινής και κοινωνικής αποστασιοποίησης στο επαγγελματικό περιβάλλον . Αλλά ο ρυθμός του κορωνοϊού στην Τουρκία αυτή τη στιγμή δείχνει ότι υπάρχει κίνδυνος αυτά τα μέτρα να μην επαρκούν».  Η  Τουρκία  βρίσκεται στις 10 πρώτες χώρες στον κόσμο σε αριθμό επιβεβαιωμένων κρουσμάτων, ενώ κάθε μέρα ο αριθμός τους αυξάνει κατά περισσότερα από 4.000. Ωστόσο το ποσοστό θνησιμότητας είναι πολύ μικρότερος από οπουδήποτε αλλού – γεγονός που έχει παραξενέψει πολλούς.",https://www.cnn.gr/news/kosmos/story/216005/koronoios-ektos-elegxoy-i-katastasi-stin-toyrkia-therizei-i-pandimia
world,www.cnn.gr,Κιμ Γιο-τζονγκ: Ποια είναι η αδερφή και το ανερχόμενο alter ego του ηγέτη της Βόρειας Κορέας,"22:06 Τρίτη, 21 Απριλίου 2020- ","Newsroom, CNN Greece","Συγκεχυμένες και  αντιφατικές  είναι οι  πληροφορίες  που βλέπουν το φως της δημοσιότητας σχετικά με την  κατάσταση της υγείας  του ηγέτη της  Βόρειας Κορέας ,  Κιμ Γιονγκ Ουν , με αποτέλεσμα την   έντονη φημολογία αναφορικά με το πού βρίσκεται  o ίδιος, αλλά και το μέλλον του μοναδικού κληροδοτούμενου κομμουνιστικού κράτους στον κόσμο. Οι φήμες ξεκίνησαν μετά την απουσία του Κιμ Γιονγκ Ουν στην πιο σημαντική αργία της Βόρειας Κορέας, καθώς στις 15 Απριλίου, ημέρα της επετείου γέννησης του πατέρα του και ιδρυτή της χώρας, Κιμ Ιλ Σουνγκ , δεν έγινε καμία αναφορά για τις κινήσεις του ηγέτης της χώρας.Η τελευταία φορά που εμφανίστηκε ο Κιμ στα κρατικά μέσα ήταν στις 11 Απριλίου. Στη συνέχεια, η Daily NK, μια ηλεκτρονική εκδοτική με έδρα τη Νότια Κορέα που επικεντρώνεται στον βορρά, ανέφερε ότι ο Κιμ είχε υποβληθεί σε μια  εγχείριση καρδιάς  την 12η Απριλίου και ήταν  υπό θεραπευτική αγωγή  σε μια βίλα στο Hyangsan County. Το  CNNi  δεν ήταν σε θέση να επιβεβαιώσει τη σχετική αναφορά, ωστόσο ένας Aμερικανός αξιωματούχος δήλωσε ότι η Ουάσινγκτον εξετάζει πληροφορίες σύμφωνα με τις οποίες ότι ο Κιμ βρίσκεται σε  σοβαρό κίνδυνο μετά από προηγούμενη χειρουργική επέμβαση. Μια δεύτερη πηγή με πρόσβαση σε πληροφορίες για το ζήτημα, ανέφερε στο CNNi ότι οι ΗΠΑ παρακολουθούν στενά τις εκθέσεις για την υγεία του Κιμ.  Με τα διεθνή μέσα ενημέρωσης να στρέφονται όλο και περισσότερο στο τι πραγματικά συμβαίνει, η  Κιμ Γιο-τζονγκ χαρακτηρίζεται πλέον από πολλούς ως  η πιο σημαντική προσωπικότητα στο καθεστώς  της Βόρειας Κορέας, μετά τον αδελφό της. Από τότε που εκπροσώπησε τον Κιμ στους  Χειμερινούς Ολυμπιακούς Αγώνες  του  2018  στην Πιόνγκτσανγκτης Νότιας Κορέας, δεν απέκτησε μόνο περίοπτη θέση στο κυβερνών κόμμα. Φημολογείται ότι είναι ο «εγκέφαλος» πίσω από την πολύ προσεκτικά δομημένη δημόσια εικόνα του Κιμ Γιονγκ Ουν, τόσο στο εξωτερικό όσο και το εσωτερικό της Βόρειας Κορέας.  Σε αντάλλαγμα, απολαμβάνει την απόλυτη εμπιστοσύνη του αδελφού της, ενός ηγέτη ο οποίος κατηγορείται πως διέταξε την εκτέλεση του θείου του για φερόμενη προδοσία.Ο  Τζανγκ Σονγκ Τεκ , ο θείος τουΚιμ Γιονγκ Ουν,εκτελέσθηκε για  προδοσία  το 2013. Ο ετεροθαλής αδελφός του, ο Κιμ Γιονγκ Ναμ, το 2017, δηλητηριασμένος με νευροτοξικό παράγοντα, σε ένα σκηνικό βγαλμένο από τον Ψυχρό Πόλεμο. Καθώς ο  πλανήτης  βρίσκεται  αντιμέτωπος με την πανδημία του νέου  , η Πιονγιάνγκ   συνεχίζει να δηλώνει ότι δεν έχει καταγραφεί ούτε ένα κρούσμα της νόσου Covid-19 και η ανοδική πορεία της  Κιμ Γιο-τζονγκ συνεχίζεται. Η ισχυρότερη γυναίκα ενός καθεστώτος όπου η εξουσία αποτελεί οικογενειακή υπόθεση για περισσότερα από 70 χρόνια, έκανε τονπερασμένο μήνα την πρώτη της δήλωση,  χαρακτηρίζοντας τη Νότια Κορέα «φοβισμένο σκυλί που γαβγίζει» , ενώ συνοδεύει σταθερά τον αδελφό της σε όλες τις σημαντικές συνόδους κορυφής. Η δημοσίευση πολιτικών δηλώσεων από την Κιμ Γιο-τζονγκ  υπογραμμίζει τον κεντρικό ρόλο της στο καθεστώς, σύμφωνα με τον Γιούνγκσικ Μπονγκ, ερευνητή στο Ινστιτούτο Βόρειας Κορέας του Πανεπιστημίου Yonsei στη Σεούλ. «Δηλώνει ότι ο Κιμ Γιονγκ Ουν τής επέτρεψε να γράψει και να ανακοινώσει μια οργισμένη δήλωση για τη Νότια Κορέα με τόσο προσωπικό τόνο. Είναι σαφώς έτοιμος να επιτρέψει στην αδερφή του να γίνει το alter ego του», τονίζει ο Γιούνγκσικ Μπονγκ. Η Κιμ Γιο-τζονγκ, η οποία θεωρείται ότι είναι τέσσερα χρόνια νεότερη από τον αδερφό της, σπάνια εμφανιζόταν δημοσίως έως το 2010, όταν φωτογραφήθηκε σε μία εκδήλωση. Τον επόμενο χρόνο, εμφανιζόταν πλεόν τακτικά στο περιβάλλον του πατέρα της Κιμ Γιονγκ Ιλ και φωτογραφήθηκε να πενθεί τον θάνατό του στα τέλη του 2011. Σύμφωνα με αξιωματούχος της Νότιας Κορέας, το 2014 είχε αναλάβει προσωρινά τα ηνία της χώρας όταν ο αδελφός της αντιμετώπιζε προβλήματα υγείας λόγω του διαβήτη του.  Με πληροφορίες από ",https://www.cnn.gr/news/kosmos/story/216286/kim-gio-tzongk-h-aderfi-toy-kim-giongk-oyn-anerxomeno-alter-ego-toy-igeti-tis-voreias-koreas
world,www.cnn.gr,Κορωνοϊός: Τα χαρακτηριστικά του ιού στα παιδιά ,"22:59 Τρίτη, 21 Απριλίου 2020- ","Newsroom, CNN Greece","Η εξέλιξη της νόσου  Covid-19   σε παιδιά  που μολύνονται από τον  κορωνοϊό  SARS-CoV-2 είναι, σε σχέση με τους ενήλικες, σχετικά  ήπια . Παρόλα αυτά, στα  βρέφη  η νόσος μπορεί να εμφανίσει  σοβαρές επιπλοκές . Ως εκ τούτου, η κατανόηση της νόσου στα παιδιά αποτελεί σημαντικό βήμα για την ανάπτυξη στρατηγικών  θεραπείας  στην κλινική, αλλά και περιορισμού της μετάδοσής της, αναφέρει ηΘεραπευτική Κλινική της  Ιατρικής Σχολής  του ΕΚΠΑ που πραγματοποιεί αποδελτίωση των πιο σημαντικών δημοσιεύσεων και ανακοινώσεων. Σε μια πολύ πρόσφατη  δημοσίευση  στο  περιοδικό PEDIATRICS  (Official Journal of the American Academy of Pediatrics) (Vol 145, No 6, June 2020), οι ερευνητές μελέτησαν δεδομένα από 2.135 περιπτώσεις παιδιών με  COVID-19  που καταγράφηκαν στο κέντρο Ελέγχου νοσημάτων και πρόληψης της Κίνας. Η μέση ηλικία των παιδιών ήταν τα  7 έτη  (εύρος ηλικιών 2-13 έτη) και 1208 παιδιά ήταν αγόρια. Παραπάνω από 90% των παιδιών ήταν  ασυμπτωματικά  ή εμφάνισαν ήπια ή ενδιάμεσης κλινικής βαρύτητας συμπτώματα, ενώ η μέση περίοδος από την εμφάνιση συμπτωμάτων μέχρι τη διάγνωση ήταν 2 ημέρες. Βρέθηκε ότι παιδιά όλων των ηλικιών είναι δεκτικά σε μόλυνση από τον ιό, χωρίς στατιστικά σημαντικές διαφορές (αν και εμφανίστηκε μια σχετική «προτίμηση» του ιού για τα  αγόρια ) όσον αφορά στο  φύλο . Αν και η κλινική εικόνα των παιδιών με  Covid-19  είναι σημαντικά πιο ήπια σε σχέση με τους ενήλικες (καταγράφηκε ένας θάνατος μεταξύ των 2.135 παιδιών), η νόσος στα βρέφη είναι δυνατόν να εμφανίσει  σοβαρή κλινική εικόνα . Ο λόγος για τον οποίο υπάρχει αυτή η διαφοροποίηση στην κλινική εικόνα της νόσου μεταξύ παιδιών και ενηλίκων παραμένει ασαφής, αλλά πιθανώς σχετίζεται με τη μικρότερη (σε σχέση με του ενήλικες) έκφραση στα παιδιά του υποδοχέα ACE2 μέσω του οποίου ο ιός επιμολύνει τα ανθρώπινα κύτταρα. Επίσης, η  συχνή έκθεση  των παιδιών σε ιογενείς  επιμολύνσεις  του αναπνευστικού τη χειμερινή περίοδο ίσως συντηρεί ένα πιο ενεργό ανοσοποιητικό σύστημα σε σχέση με τους ενήλικες. Εναλλακτικά, καθώς το ανοσοποιητικό σύστημα των παιδιών δεν έχει ολοκληρώσει την ανάπτυξη του ίσως αποκρίνεται διαφορετικά, σε σχέση με τους ενήλικες στα παθογόνα. Σε κάθε περίπτωση, οι παραπάνω υποθέσεις παραμένουν υποκείμενες περαιτέρω έρευνας. Μια άλλη μεγάλη  μελέτη που πραγματοποιήθηκε στον ισλανδικό πληθυσμό και συμπεριέλαβε 9199 άτομα στους οποίους έγινε στοχευμένος έλεγχος, καθώς και 13080 άτομα που συμμετείχαν σε πληθυσμιακό έλεγχο χωρίς συγκεκριμένα κριτήρια, επιβεβαίωσε ότι τα παιδιά  κάτω των 10 ετών  ήταν λιγότερο πιθανό να έχουν θετικό τεστ από τους υπόλοιπους, τόσο κατά το στοχευμένο όσο και κατά τον πληθυσμιακό έλεγχο.Σε αυτό το πλαίσιο, υπενθυμίζεται ότι στην  Ελλάδα , σύμφωνα με την ειδική επιτροπή που συντονίζεται από τις καθηγήτριες Βάνα Παπαευαγγέλου και Μαρίζα Τσολιά, έλεγχος για  COVID-19  θα πρέπει να διενεργείται στα παιδιά ηλικίας κάτω των 16 ετών με: Σε σχέση με τα παραπάνω ευρήματα σε μια πρόσφατη δημοσίευση στο περιοδικό Nature Medicine,μελετήθηκε η επιδημιολογική και κλινική εικόνα 10 παιδιών με θετική διάγνωση για  COVID-19  και  νοσοκομειακή παρακολούθηση . Δεν παρατηρήθηκαν ειδικά για τη νόσο συμπτώματα, ενώ κανένα παιδί δε χρειάστηκε αναπνευστική υποστήριξη. Επίσης, ο ακτινολογικός έλεγχος δεν έδειξε σημάδια πνευμονίας, μιας επιπλοκής που συνοδεύει συχνά τη νόσο στους ενήλικες.",https://www.cnn.gr/news/kosmos/story/216163/koronoios-ta-xaraktiristika-toy-ioy-sta-paidia
world,www.cnn.gr,Μακελειό στο Λίβανο: Σκότωσε τη γυναίκα του και άλλα οκτώ άτομα ,"23:24 Τρίτη, 21 Απριλίου 2020","Newsroom, CNN Greece","Ένας άνδρας σκότωσε τη γυναίκα του και άλλους οκτώ ανθρώπους, συμπεριλαμβανομένου και του αδελφού του, στη  χειρότερη μαζική δολοφονία  που έχει σημειωθεί εδώ και πολλά χρόνια στον  Λίβανο . Σύμφωνα με την πηγή αυτή, αστυνομικοί συνέλαβαν τον δράστη, ο οποίος διέφυγε αφού μαχαίρωσε τη γυναίκα του και κατόπιν πυροβόλησε και σκότωσε άλλους οκτώ ανθρώπους στην πόλη Μπαακλίνε, 45 χιλιόμετρα νοτίως της πρωτεύουσας Βηρυτού. Ο άνδρας χρησιμοποίησε μια επαναληπτική  καραμπίνα . Το δημόσιο ειδησεογραφικό πρακτορείο NNA μετέδωσε ότι το κίνητρό του παραμένει ασαφές. Η πηγή την οποία επικαλείται το πρακτορείο Reuters ωστόσο είπε ότι υπάρχουν υπόνοιες ότι επρόκειτο για  «έγκλημα τιμής». Τα  πέντε  από τα θύματα ήταν  Σύροι  και μεταξύ αυτών ήταν και  δύο παιδιά  ηλικίας  15 και 10 ετών  που διέμεναν σε ένα  γιαπί , όπου έγινε η σφαγή.",https://www.cnn.gr/news/kosmos/story/216305/makeleio-sto-livano-skotose-ti-gynaika-toy-kai-alla-okto-atoma
world,www.cnn.gr,"Κορωνοϊός: Πάνω από 2,5 εκατομμύρια τα κρούσματα στον κόσμο ","23:33 Τρίτη, 21 Απριλίου 2020","Newsroom, CNN Greece","Η πανδημία του  νέου κορωνοϊού  έχει στοιχίσει τη ζωή σε τουλάχιστον  174.001 ανθρώπους  σε όλον τον κόσμο από τον περασμένο Δεκέμβριο, όταν πρωτοεμφανίστηκε ο SARS-CoV-2 στην  Κίνα , σύμφωνα με τον απολογισμό που συντάσσει το Γαλλικό Πρακτορείο βασιζόμενο σε επίσημες πηγές. Μέχρι τις 22.00 (ώρα Ελλάδας) είχαν καταγραφεί περισσότερα από  2.525.240 επιβεβαιωμένα κρούσματα  σε  193 χώρες και εδάφη.  Περίπου το ένα πέμπτο από αυτούς τους ασθενείς (567.400) έχουν πλέον αναρρώσει. Από την Δευτέρα μέχρι σήμερα, στη μακάβρια λίστα προστέθηκαν  5.244 νέοι θάνατοι  και  68.529 νέα κρούσματα.  Οι χώρες όπου καταγράφηκαν οι περισσότεροι θάνατοι μέσα στο τελευταίο 24ωρο είναι οι ΗΠΑ (1.106), η Βρετανία (828) και η Ιταλία (534). Οι  ΗΠΑ , όπου ο πρώτος ασθενής απεβίωσε στα τέλη Φεβρουαρίου, είναι η χώρα που έχει πληγεί περισσότερο, τόσο σε αριθμό κρουσμάτων (804.194) όσο και θανάτων (43.200). Τουλάχιστον  73.533 άνθρωποι έχουν αναρρώσει. Μετά τις ΗΠΑ, ακολουθούν η  Ιταλία  (24.648 θάνατοι σε σύνολο 183.957 κρουσμάτων), η  Ισπανία  (21.282 θάνατοι, 204.178 κρούσματα), η  Γαλλία  (20.796 θάνατοι, 158.050 κρούσματα) και η  Βρετανία  (17.337 θάνατοι, 129.044 κρούσματα). Η  Κίνα  (χωρίς το Χονγκ Κονγκ και το Μακάο) απ’ όπου ξεκίνησε η επιδημία, έχει επισήμως 82.758 κρούσματα (11 νέα) και 4.632 θανάτους (κανένας το τελευταίο 24ωρο). Οι ασθενείς που ανέρρωσαν φτάνουν τους 77.123.  Η  Ευρώπη  μέχρι σήμερα μετρά 109.381 θανάτους σε σύνολο 1.234.340 κρουσμάτων, οι ΗΠΑ και ο Καναδάς μαζί 44.982 θανάτους (841.584 κρούσματα), Η Ασία 7.191 θανάτους (174.020 κρούσματα), η Μέση Ανατολή 5.784 θανάτους (133.221 κρούσματα), η Λατινική Αμερική και η Καραϊβική 5.377 θανάτους (109.739 κρούσματα), η Αφρική 1.195 θανάτους (24.409 κρούσματα) και η Ωκεανία 91 θανάτους (7.927 κρούσματα).  Ο απολογισμός συντάσσεται με βάση δεδομένα που συλλέγουν τα γραφεία του Γαλλικού Πρακτορείου από επίσημες πηγές και από πληροφορίες του Παγκόσμιου Οργανισμού Υγείας.",https://www.cnn.gr/news/kosmos/story/216312/koronoios-pano-apo-2-5-ekatommyria-ta-kroysmata
